Item,Price
Neoprene Knee Wrap Support/ Brace,"₦ 4,500"
Prevail Adult Diaper Pull Up XXlarge,"₦ 14,500"
Circumcision Set Kit Surgical Instruments Set Of 9 Pieces,"₦ 7,500"
Prevail Adult Diaper Pull Up,"₦ 15,000"
Chic Blue Short Sleeve Slit- 2pieces,"₦ 9,999"
Paw Patrol Microphone For Kids,"₦ 4,999"
SoftSheen Carson Sporting Waves Hair Cream For Men,"₦ 5,500"
DOUBLE WAIST AND TUMMY SLIMMING TRIMMER WAIST TRAINERS BELT ( L),"₦ 5,999"
Knee Support Professional Protectives Sports Knee Pad,"₦ 3,833"
Facial 5 In 1 Brush Massager For Deep Exfoliation,"₦ 4,999"
Adult Diaper Pull Up,"₦ 12,000"
Kids Career Day Surgeon Costume Scrubs,"₦ 11,000"
Noise Cancelling Ear Plugs Sound Blocking Earplug Noise,"₦ 3,918"
Multitool Pocket Multifunction Multipurpose Floding Stainless Keychain Tools Set(6.1X3X0.65CM),"₦ 3,221"
Lucky FF918-C100DS Color Screen Wired Fish Finder Dual,"₦ 100,437"
Quality Couples Pyjamas Set,"₦ 17,000"
Golden State Warriors NBA Sudadera Con Capucha-Azul,"₦ 13,804"
Patati Patata Toy Motorcycle,"₦ 10,999"
12 Pcs Water Gun For Party Pack,"₦ 9,500"
Golden State Warriors Curry #30 NBA - Negro,"₦ 13,804"
Fútbol 2019-2020 Arsenal,"₦ 11,423"
Sandpaper Sand Paper Round Wood Metal Sanding  - 3 Pieces,"₦ 2,500"
Lixada 9 Pack Aluminum Alloy D-ring Locking Carabiner Clip,"₦ 13,875"
2Pcs Tactical Military Carabiner Clip Climbing Molle Bag-,"₦ 1,254"
Toronto Raptors Leonard #2 NBA Temporada Regular-Rojo,"₦ 9,995"
2 Pcs Survival Whistle Emergency Camping Compass Kit Fire-,₦ 648
Fútbol 2019-2020 Manchester City,"₦ 11,423"
Jik Bleach 475ml X  6,"₦ 12,000"
Mini Portable Pocket Compass For Camping Hiking Outdoor-,"₦ 1,002"
High Purity 99.99% Magnesium Metal Rod Mg Fire Starter Survival Emergency Rod Well Sparks For Camping Hiking,"₦ 4,189"
Superman Action Figure,"₦ 6,500"
"15"" Rechargeable Bluetooth PA System/Speaker/2Mic Radio/USB","₦ 95,900"
Neoprene 2 Pair Knee Cap Support For Outdoor Sports And Massaging,"₦ 3,500"
