Item,Price
Carburetor PZ19 Carb,"₦ 14,437"
Carburetor Replacement For Briggs   Stratton 809008,"₦ 35,644"
Carburetor Carb Manual Choke For Polaris Sportsman 90 90cc,"₦ 22,099"
Carburetor Carb For Yamaha Raptor 350 YFM350 2004-2012,"₦ 45,128"
Carburetor Carb Replacement Kit For Yamaha TW200 2001-2017,"₦ 44,802"
Carburetor Carb For Yamaha Grizzly 450 YFM450 4WD 2007-2014,"₦ 43,895"
Carburetor Carb Replacement For Tecumseh 640221 5156,"₦ 21,243"
Carburetor Carb With Gasket Replacement For Tecumseh 640297,"₦ 21,321"
