Item,Price
2pcs Silicone Security Bands Replacement Straps For Bike,"₦ 1,130"
Bike Cargo Rack Rear Bike Rack Quick Release Cycling,"₦ 27,030"
ZTTO CO2 Cartridge Holder Bracket For Road Bike Water Bottle,"₦ 5,970"
Lixada Lightweight Bike Bottle Holder Alloy MTB Water,"₦ 5,190"
YSANAM Out Front Combo Bicycle Computer Camera Mount Holder,"₦ 13,670"
ZTTO MTB Bike Computer Mount Holder For Garmin/Cateye/Bryton,"₦ 20,360"
Gub Bicycle Double Water Bottle Cage Water Bottle Cage Adapter,"₦ 19,250"
Gub Adjustable Bicycle Phone Mount Holder MTB Mountain Bike,"₦ 7,660"
Bike Handlebar Extender Aluminum Alloy Bike Handlebar,"₦ 7,040"
Boy Character Singlet 6 In 1,"₦ 8,500"
Road Bike Crankset Aluminum Alloy Crank   Gear Wear Resistance,"₦ 47,561 - ₦ 51,874"
Universal Phone Holder Silicone Bicycle Mobile Phone Riding Bracket 360 Degree Rotatable Mobile Phone Riding Bracket Black,"₦ 6,290"
Blue Light Blocking Glasses Large Frame Anti Eyestrain UV Gl,"₦ 3,483"
Bike Crankset Colorful Durable Hollow Crank Replacement Tool,"₦ 28,259 - ₦ 37,355"
Mens Padded Mountain Bike Shorts Breathable Cycling Underwear,"₦ 4,950 - ₦ 5,192"
Suspension Seatpost With Shock Absorber,"₦ 15,140 - ₦ 18,382"
Universal Phone Holder Silicone Bicycle Mobile Phone Riding Bracket 360 Degree Rotatable Mobile Phone Riding Bracket Grey,"₦ 6,290"
RD-M390 Rear Derailleur 9/27 Speed,"₦ 7,928"
TouchScreen Bike Front Frame Bag Simple To Fix And Install S,"₦ 5,718"
Waterproof Metal Motorcycle Smart Phone Mount With QC 3.0 USB Quick Charger Black,"₦ 38,790"
Bike Water Bottle Holder Carbon Fiber Nylon Bicycle Bottle,"₦ 5,160"
Gub Aluminum Bike Phone Holder 360 Degree Rotating Adjustable,"₦ 20,790"
Bike Bicycle Handlebar Silicone Mount Holder Kit For Garmin,"₦ 4,410"
Bicycle Pedal Holder Quick Release Aluminum Alloy Bike Rack Mount Bike Pedal Holder,"₦ 2,318 - ₦ 2,362"
Silicone Security Bands Replacement Straps For Bike Phone,₦ 960
Gub Aluminum Bicycle Bike Water Bottle Cage Cycling Drink Water,"₦ 6,120"
Gub Bicycle Phone Holder 360 Degree Rotating Length Adjustable,"₦ 15,570"
Bike Rack Storage Wall Mount For Indoor Garage Shed (2,"₦ 21,240"
Metal Adapter For Insta 360 Go 2 Metal Protection,"₦ 7,746"
Advanced Mountain Bike Bicycle Front Fork Tube Height Increaser Stand Upright,"₦ 6,050"
Heavy Duty Digital Tyre Inflator Portable Bicycle For Vehicle USB,"₦ 62,179"
Big Frame  Y Ling Gl Es Bike Bi Y Le Sungl Es UV400 Eyewear  -black+yellow,"₦ 5,130"
ZTTO Bicycle Phone Mount Aluminum Alloy Cycling Bike Phone,"₦ 6,040"
Bike Tube Frame Bag Waterproof Large Capacity Cycling Accessories Pack,"₦ 1,978 - ₦ 2,583"
32 Hole Hub Set Ultralight,"₦ 48,077 - ₦ 54,978"
Gub Mountian Bike Phone Mount Universal Adjustable Bicycle Cell,"₦ 12,250"
Mountain Road Bike 44.5-60.5cm Retractable Wall Mount Stand,"₦ 76,860"
Heavy Duty   Inflator  Bicycle USB For Vehicle 130PSI,"₦ 59,533"
Quick Release Skewer Front And Rear Skewer Clip Bolt Hub,"₦ 4,387 - ₦ 4,477"
