Item,Price
Universal Wire Lock Bicycle Lock Five-digit Code Lock With Bracket,"₦ 5,890"
Motorcycle Bike Bicycle Security Safe Disk Disc Wheel Lock Brake Rotor Lock,"₦ 3,250"
Stainless Steel Anti-Theft Padlock Large Round Discus Lock,"₦ 8,587"
Hp Keyed Cable Lock 10 Mm For Notebook,"₦ 7,500"
Bicycle Lock Code Key Locks Bike Cycling Password Combination Steel Wire Locks,"₦ 2,820"
Telescopic Wire Rope Steel Cable Wire Code Lock Security Digit Password Lock,"₦ 4,030"
4-digit Password Anti-theft Bicycle Safety Lock,"₦ 12,200"
Password Lock 4-digit Password Anti-theft Bicycle Safety Lock,"₦ 17,300"
1.2M Wire Bicycle Lock Spring Reminder Anti-theft Lock Rope For Motorcycles,"₦ 1,450"
Practical Design Anti Theft Bicycle Security U Lock Cycling Safety Accessories,"₦ 8,360"
