Item,Price
Female Corporate Work High Heel Cover Shoe- Black,"₦ 7,499 - ₦ 7,799"
Bowed Patentl Corporate Cover Shoe - Black,"₦ 8,980"
Glittered Ankle Strap Heel Corporate Cover Shoe - Black,"₦ 21,000"
Block And Corporate Heels Cover Shoe,"₦ 16,000"
Ladies Coperate Mid/low Heel Cover Shoe For Women-Black,"₦ 13,500 - ₦ 14,500"
Flap Cross Over Microfiber Leather High Heel Sandals-Black,"₦ 19,500"
Bowed Patent Mid Heel Corporate Cover Shoe - Wine,"₦ 19,500"
Bowed Patent Mid Heel Corporate Cover Shoe - Black,"₦ 19,500"
Block Heel Patent Leather Pointee Cover Shoe - Red,"₦ 12,000"
Block Heel Patent Leather Pointee Cover Shoe - Black,"₦ 12,000"
Ladies Pointed Toe Pumps Shoe- Black,"₦ 16,000"
Criss-Cross Microfiber Leather Sturdy Heel Sandals-Silver,"₦ 19,500"
Multistrip Microfiber Leather Sturdy Heel Sandals- Champaign Gold,"₦ 19,500"
Block Heel Patent Leather Pointee Cover Shoe - Off White,"₦ 12,000"
Criss-Cross Microfiber Leather Sturdy Heel Sandals-Gold,"₦ 19,500"
Women's Shoes Shine Rhinestone-Gold,"₦ 30,757"
Ladies Cooperate Court Shoe-Black,"₦ 13,500"
Woman's Square Toe High Heel Courts PU Leather Block Heel Female Shoes-Blue,"₦ 13,638"
Block Heel Patent Leather Pointee Cover Shoe - Wine,"₦ 12,000"
Block Heel Patent Leather Pointee Cover Shoe - Onions,"₦ 12,000"
Ladies Coperate Court Mid/low Heel Shoe For Women-Black,"₦ 13,999"
Female Coperate Court Cover Shoe Mid/low Heel With Heart- Black,"₦ 17,000"
Female Mid/low Heel Open Cover Shoe Women-Multicolour,"₦ 15,000"
