Item,Price
GLASSES TRANSPARENT PROTECTION ANTI-SCRATCH FOR,"₦ 1,258"
Unisex Sports Outdoor Square Frame Sunglasses Black +,"₦ 1,311"
No Box Outdoor Motorcycle Goggles Cycling  Sport ATV Dirt,"₦ 19,660"
Alloy Finger BMX Fun Tional Kids Bi Y Le Modle Finger Bike Toys Gift-black,"₦ 1,370"
Fuell Scarcity - Rechargeable Battery Electric/Pedal Motorcycle Bicycle Bike,"₦ 299,000"
Fashion Glasses Shades 8 Bit Pixelated Ladies Sunglasses,"₦ 14,620"
Driving Glasses Night-Vision Glasses Protective Gears,"₦ 13,130"
Alloy Finger BMX Fun Tional Kids Bi Y Le Modle Finger Bike Toys Gift-orange,"₦ 6,290"
Outdoor Necessary Glasses 9 Color Polarizing Night Vision,"₦ 14,420"
2021 Luxury Oversize Square Sunglasses Women Vintage Big,"₦ 12,890"
Rectangle Women Small Frame SunGlasses S17072 Black Frame,₦ 688
Military Motorcycle Glasses Night Vision Outdoor Sports,"₦ 21,430"
WEST BIKING Cycling Glasses Polarized Glasses 5 Lens,"₦ 25,370"
Tom Holland Style Superhero Peter Parker Edith Sunglasses,"₦ 15,140"
Moto Sunglasses Motorcycle Outdoor Glasses Goggles ATV For,"₦ 20,470"
Fashion Rimless Men Sunglasses Women Trendy Bat Shaped Sun,"₦ 15,000"
Military Motorcycle Glasses Army Polarized Sunglasses For,"₦ 15,140"
POC Glasses Men Women Lens Polarized 2 UV400 Cycling,"₦ 39,835"
KINGSEVEN Cycling Sunglasses For Men Women UV400 Polarized,"₦ 26,710"
UV400 Kids Cycling Sunglasses Sport Running Goggles,"₦ 14,230"
Ladies Heart Sunglasses Heart Gradient Metallic Ladies,"₦ 15,050"
Motorcycle Cycling Glassess Dirt Bike Motocross Sunglassess,"₦ 16,390"
UV Protection Safety Goggles Work Lab Laboratory Eyewear,"₦ 14,710"
Man Cycling Sunglasses 5 Lens V400 Women MTB Bike Glasses,"₦ 21,430"
Night Motorcycle Vision Military Sports Glasses Outdoor,"₦ 18,759"
Bicycles Cycling UV400 Glasses For Women Glasses HOT Men,"₦ 8,970"
Night Vision Glasses Safety Protective Goggles Anti-Glare,"₦ 12,890"
Polarized Sport Semi-Metal Running Fishing Glasses Men,"₦ 27,860"
UV400 Female Cycling Sunglasses 2022 Pink Road Bike Glasses,"₦ 13,510"
Photochromic Cycling Glasses Outdoor Sports Men Women,"₦ 16,250"
"Away Flip Visor Children's Helmet, Pink","₦ 48,473"
"Macback Coolrace Bike Helmet, White   Black","₦ 31,434"
