Item,Price
Harmless Bodysuit - Black,"₦ 3,500"
Boohoo Basic Wrap Over Bodysuit- Black,"₦ 7,000"
Chasse Long Sleeve Turtle Neck Bodysuit - Blue,"₦ 5,000"
Ladies Long Sleeve Bodysuit,"₦ 5,299"
Sexy Costume Lingerie Fishnet Diamond Terno Pajama Adult Bodysuit,"₦ 3,990"
Trendyolmilla White Knitted Body,"₦ 6,747"
Seamless Long Sleeve Bodysuit - Black,"₦ 5,000"
"Irisnaya Shapewear Bodysuit For Women Sleeveless Tank Top, Long Sleeve Turtle Neck Bodysuit - Black","₦ 5,000"
Black Stylish Turtle Neck Bodysuit For Women,"₦ 4,450"
Ribbed Short Sleeve High Cut Bodysuit - White,"₦ 5,000"
Long Sleeve Turtle Neck Bodysuit - Black,"₦ 5,000"
Boohoo Mesh 2-in-1 Strappy Bodysuit-White,"₦ 7,000"
Black Button Front Off Shoulder Long Sleeve Bodysuit - Black,"₦ 5,000"
Open Back Halter Bodysuit With Skirt Hottes - Black,"₦ 6,500"
White Stylish Turtle Neck Bodysuit For Women,"₦ 4,700"
Sexy Bodysuit Lingerie That Can Size S-xxl As It Has Big Fitting,"₦ 4,500"
Ofat Black Hair Shampoo Dye -10pcs,"₦ 3,800"
Rough Edge Cut Out Bodysuit00 - Black,"₦ 4,500"
Long Sleeve Square Neck Bodysuit - Red,"₦ 5,000"
Eugenie Round Nick Bodysuit Long Sleeve - Black,"₦ 5,000"
Ladies Bodysuit Lace Underwear,"₦ 8,000"
2black Hair Cream  Small X3,"₦ 3,700"
Series Curl Activator Gel 180g X2 With Free Git,"₦ 6,000"
Mfed Taupe Off Shoulder Ruffle Bodysuit,"₦ 3,500"
Tcb Naturals Combo Set,"₦ 18,700"
Mega Growth No Lye 12 Salon Pack Relaxer,"₦ 8,500"
CACATIN Herbal Ointment 20g X 12,"₦ 4,500"
Plus Size Velvet Mesh Body Suit,"₦ 7,000"
Sexy Bodysuit Lingerie That Can Size S-xxl As It Has Big Fitting Check Slide To See Full Picture,"₦ 4,500"
