Item,Price
"GATWIGA Casual Belt Pouch, Waist Packs Multifunctional Gadget Bag, Outdoor, Hiking, Cycling","₦ 1,999"
Large-Capacity Waist Bag Chest Bag Casual Messenger Bag,"₦ 4,900"
GATWIGA Varnish Leather/patent Waist Multifunctional Bag,"₦ 1,499"
3 Layers Canvas Shoulder Slinging Bag Chest Bag,"₦ 3,580"
GATWIGA Belt Pouch Sport Waist Bag Multifunctional Outdoor Fanny Pack,"₦ 1,299"
Sport Waist Bag Pouch Cross Body Shoulder Chest Belly Bag Cellphone Key Holder Running Jogging Motorcycle Waterproof,"₦ 4,880"
Men Crossbody Sling Chest Bag Shoulder Bag,"₦ 4,500"
Casual Waist Bag Shoulder Slinging Chest Bag,"₦ 4,980"
Waist Pack Cross Body Bag Pouch Bag Casual,"₦ 4,900"
3 Layers Canvas Crossbody Chest / Shoulder Bag,"₦ 4,980"
Unisex Running Waist Pocket,"₦ 5,000"
Unisex Running Waist Pocket Black,"₦ 3,900"
Bag Baileda Unisex Waist Bag,"₦ 3,000"
Unisex Waist Bag,"₦ 3,900"
New Multi Purpose Casual Chest Bag. Crossbody Sports Waist Packs,"₦ 5,750"
Unisex Single-Shoulder Multi-Function Large-Capacity Waist Bag Men's,"₦ 8,550"
Unisex Single-Shoulder Multi-Function Waist Bag,"₦ 5,690"
Waist Packs - Mobile Phone Waist Bag Men's Mobile Phone Leather Case Can Hold Cigarette Case Hanging Key Belt Storage Bag,"₦ 4,550"
Huge Capacity Traveling Backpack,"₦ 8,999"
Shoulder Multi-Function Large-Capacity Waist Bag Men's Chest Bag Casual Messenger Bag Wallet,"₦ 7,500 - ₦ 8,500"
Sporting Waist Belt Bag Chest Bag,"₦ 1,980"
3 Layers PU Leather Crossbody Chest / Shoulder Bag,"₦ 4,980"
Unisex Running Waist Pocket Pink,"₦ 2,350"
Unisex Messenger Bag Crossbody Shoulder Bags Travel Bag,"₦ 6,000"
Arm Bag For Exercise/ Phone Case,"₦ 3,980"
PU Leather Shoulder Slinging Bag Chest Bag,"₦ 6,999"
LouisWill Men Fashion Nylon Crossbody Sports Waist Packs,"₦ 4,690"
Male Ratro Zipper Men's Waist Bags Small Solid Color Card,"₦ 21,788"
Military Vintage Tactical Waist Bag Men Women Belt Pouch,"₦ 13,630"
