Item,Price
Headband Magnifier With LED Light Head Mounted Magnifying Glasses,"₦ 20,198"
Rechargeable  LED Headlight Clip On Sensor  Black,"₦ 1,461"
LED  Head Light Hand Sensor Flashlights For Hiking Gray,"₦ 3,208"
Head Lamp Super Bright LED Head Lamp Black,"₦ 3,602"
Rechargeable  LED Headlight Clip On Torch Camping Black,"₦ 1,461"
Running Headlight Extremely Bright Outdoor Work COB Head Lamp Blue,"₦ 2,429"
LED Headlight Rechargeable Compact Outage Head Torch Walking Hiking,"₦ 4,874"
Xpg COB  Head Band Light Headlights Torch For Black,"₦ 5,757"
COB LED  Head Flashlight Rechargeable Lamp For Cycling Outdoor,"₦ 9,437"
Headlight Waterproof Cycling Head Torch Walking Reading Hiking Work,"₦ 4,490"
USB LED  Head Band Lamp Floodlight Torch Work With Red Light,"₦ 9,701"
LED  Headlight Flashlight Head Torch Lamp Rechargeable For,"₦ 14,256"
USB LED  Head Light For Skiing Industrial Purpose Adjustable,"₦ 4,808"
LED Super Bright  Rechargeable Waterproof With Motion Sensor,"₦ 12,563"
Elastic Head Band LED  Flashlight Work Light With Red Light,"₦ 10,132"
LED  Rechargeable USB Head Band Light Floodlight For Hunting,"₦ 10,332"
Dp Led Light Rechargeable Emergency LED Flash-Light Torch,"₦ 7,500"
LED  Waterproof Wide Beam  For Induction Focusing,"₦ 16,463"
LED  Waterproof For Running Industrial Non-sensing Models,"₦ 10,700"
Illuminated LED Rechargeable  + UK Adapter + Battery,"₦ 14,994"
Flashlight Torch Rechargeable Head LED  Head Light Blue,"₦ 2,512"
USB Rechargeable COB LED Light  Flashlight Head Wear Lamp Blue,"₦ 12,172"
Headlights Super Bright Zoomable Headlamp 1800lm XM-L T6 LED,"₦ 4,688"
LED  Rechargeable 3 Light Modes For Hunting Camping Night,"₦ 5,605"
LED  Adjustable Headband Essential COB For Non-sensing Models,"₦ 10,491"
Rechargeable  LED Headlight Sensor  Camping Black,"₦ 1,813"
LED  Waterproof For Running Industrial Induction Fix Focus,"₦ 14,257"
Running Headlight Extremely Bright Outdoor Work COB Head Lamp Yellow,"₦ 2,379"
LED  Head Light Hand Sensor Flashlights For Adults Outdoor Red,"₦ 3,868"
USB Rechargeable Waterproof Adjustable 6 Modes Super Bright,"₦ 14,495"
"Cycle Head Torch - Rechargeable , Perfect For Runners,  Only","₦ 8,831"
Wide Beam Waterproof LED  For Indoor Induction Fix Focus,"₦ 14,635"
