Item,Price
Children Kids Outdoor Ski Snow Boot Gaiters Leg Cover Waterproof Red,"₦ 12,159"
Kids Waterproof Hiking Trekking Walking Boot Leggings Leg Cover Red,"₦ 12,394"
Black Horse Riding Half Chaps Gaiters For Men Women Kids Sports XXS,"₦ 26,655"
Trail Running Waterproof Leg Gaiters Protective Wrap Shoe Covers Blue,"₦ 5,521"
Zipper   Adult   Leather   Half   Chaps   Equestrian   Gaiters   XL,"₦ 54,376"
Waterproof Outdoor Hiking Walking Climbing Hunting Snow Legging Black,"₦ 10,012"
Waterproof Outdoor Hiking Walking Climbing Hunting Snow Legging Green,"₦ 7,678"
Kids Waterproof Outdoor Hiking Walking Climbing Ski Snow Leg Black,"₦ 12,627"
2x Children Girls Boys Waterproof Outdoor Hiking Hiking Climbing,"₦ 26,701"
West Horse Riding Gaiters Equestrian Half Chaps Riding Boots L,"₦ 28,808"
Children Kids Outdoor Trekking Hiking Walking Ski Snow Boot Red,"₦ 15,284"
Kids Waterproof Outdoor Hiking Walking Climbing Ski Snow Leg Red,"₦ 13,711"
Waterproof Hiking Walking Boot Ski Snow Gaiters Leg Cover For Shoe Red,"₦ 12,900"
West Horse Riding Gaiters Equestrian Half Chaps Riding Boots M,"₦ 27,435"
2x Kids Waterproof Hiking Trekking Walking Boot Leggings Leg Cover Ski,"₦ 25,122"
"Kids Hiking Leg Gaiters, Snow Boot Gaiters, Waterproof Walking Red","₦ 13,711"
Prettyia       Horse       Riding       Half       Chaps       M,"₦ 54,156"
Prettyia       Horse       Riding       Half       Chaps       XS,"₦ 14,492"
2xKids Waterproof Outdoor Hiking Walking Climbing Ski Snow Leg Gaiters,"₦ 23,678"
Kids Waterproof Hiking Trekking Walking Boot Leggings Leg Cover Black,"₦ 12,159"
Waterproof Hiking Walking Boot Ski Snow Gaiters Leg Cover For Black,"₦ 10,922"
2X Kids Waterproof Outdoor Hiking Walking Climbing Ski Snow Leg,"₦ 26,701"
Waterproof Outdoor Hiking Walking Climbing Hunting Snow Legging Blue,"₦ 9,944"
Hiking Gaiters For Outdoor Camping Running Walking Backpacking Black,"₦ 15,417"
2x Kids Waterproof Outdoor Climbing Hiking Walking Ski Snow Gaiters,"₦ 21,270"
2x Waterproof Hiking Walking Boot Ski Snow Gaiters Leg Cover For Shoe,"₦ 26,701"
2x Kids Waterproof Outdoor Climbing Hiking Walking Snow Legging,"₦ 22,016"
"2x Snow Legging Gaiters,Outdoor Waterproof Hunting Leg Gaiters Leg","₦ 24,136"
Kids Girls Boys Waterproof Outdoor Hiking Walking Climbing Black,"₦ 12,900"
