Item,Price
Women's Dark Fishnet Tights Sexy Sheer Stockings Stars Moon Print,"₦ 1,390"
Ladies Sexy Stockings Fishnet Stockings,"₦ 4,260"
Women Extra Long Thigh High Socks Soft Knit Stocking School White,"₦ 1,855"
Samvine Compression Stockings(Thigh High),"₦ 14,000"
Women Thigh High Socks Soft Knit Elastic Stocking Boots Socks Black,"₦ 2,574"
Womens  Top Stockings Thigh High  Stay Up Black,"₦ 2,380"
Sexy See-Through Stockings Suspenders Hollow Fashion Pajamas,"₦ 1,844"
Women Hot Solid Thigh High Socks Over Knee Stocking School Black,"₦ 3,197"
LACE TOPPED THIGH HIGH SHEER FISHNET STOCKINGS LADIES SEXY- HOLD Skin,"₦ 2,280"
Black Stockings Various Patterns Passionate Mysterious High,"₦ 2,767"
LACE TOPPED THIGH HIGH SHEER FISHNET STOCKINGS LADIES SEXY- HOLD Black,"₦ 2,151"
Women Thigh High Socks Soft Knit Elastic Stocking Boots Socks White,"₦ 1,169"
Sexy Ladies Sheer Lace Top Thigh High Elasticated Hold Up Skin,"₦ 1,933"
Women Fishnet Lace Top Mesh High Thigh Stockings Long Socks White,"₦ 2,021"
Women Girls Thigh High Socks Soft Over Knee Stocking Boots 71Cm Coffee,"₦ 1,262"
Women Girl Extra Long Plain Thigh High Socks Soft Cotton White,"₦ 4,207"
"2 Pairs Of Women Hold-ups Skin Color, Lace Hold-ups","₦ 3,734"
Sexy Ladies Sheer Lace Top Thigh High Elasticated Hold Up Stockings,"₦ 2,426"
Women Girl Extra Long Thigh High Socks Stocking School Boots Black,"₦ 3,197"
Women Girls Hot Extra Long Thigh High Socks Cotton Stocking White,"₦ 3,670"
Sexy Ladies Lace Top Stockings Sheer Over Knee Thigh High Hold Up Skin,"₦ 2,868"
"2 Pairs Of Women's   Stockings Skin-colored, Lace Stockings   Nylon","₦ 4,261"
2x Ladies Lace Top Stockings Thigh High  Hold  Pantyhose,"₦ 3,734"
Women Girls Hot Thigh High Socks Soft Knit Elastic Stocking White,"₦ 3,448"
Sexy Ladies Sheer Lace Top Thigh High Elasticated Hold Up Black,"₦ 1,065"
Women Hot Solid Thigh High Socks Over Knee Stocking School White,"₦ 4,423"
Women's Over Knee Long Socks Skull Thigh Highs Sock Halloween Cosplay,"₦ 4,442"
Women Non Slip Thigh High Socks Stockings Above Knee Cosplay White,"₦ 4,423"
Women Girls Thigh High Socks Soft Over Knee Stocking Boots Dark Grey,"₦ 2,335"
Women Extra Long Cotton Thigh High Socks Over The Knee High Boot White,"₦ 3,589"
2x LACE TOPPED THIGH HIGH SHEER FISHNET STOCKINGS LADIES - HOLD UPS,"₦ 4,261"
Gothic Skull Fishnet Stockings Halloween Carnival Costume Hold Up,"₦ 4,083"
Women Sexy Extra Long Plain Thigh High Socks Soft Stocking Black,"₦ 3,670"
