Item,Price
Small Pet Breathable Mesh Harness Leash For Hamsters Rabbits Gray M,"₦ 1,961"
Tactical Dog Harness Leash Metal Buckle MOLLE German Shepherd Pet Large Big Dogs Military Training,"₦ 52,137"
Rainbow Colored Dog/Puppy Leash With Body Strap,"₦ 3,950"
Small Pet Breathable Mesh Harness Leash For Hamsters Rabbits Red S,"₦ 1,696"
Rainbow Colored Woven Dog/Puppy Training Leash,"₦ 4,000"
Pet Harness Vest Set Pet Walking Leash For Small Animals Cat Dog,"₦ 1,956 - ₦ 6,014"
Hamster Rabbit Guinea Pig Rat Ferret Breathable Mesh Harness Pink S,"₦ 1,040"
Adjustable Pet Cat Nylon Leash Collar Harness Safety Strap Rope Pink,"₦ 1,094"
Hamster Rabbit Guinea Pig Rat Ferret Breathable Mesh Harness Blue S,"₦ 1,705"
Nylon Woven Soft Chain Pet Dog Chain,"₦ 15,850"
Rabbit Vest Harness Breathable Leash Set Jacket Coat For Bunny L Red,"₦ 6,672"
Rabbit Harness Breathable Soft Denim Jacket Coat For Walking L Yellow,"₦ 7,561"
Harness Adjustable  Jacket Coat For Running Guinea Pig L Yellow,"₦ 7,982"
Dog Sled Harness Pet Weight Pulling Sledding Harness Mushing X Back Harness For Large Dogs Husky Ca,"₦ 25,409"
Rabbit Harness Multipurpose Breathable Denim Jacket Coat For L Yellow,"₦ 6,542"
Automatic Telescopic Traction Rope,"₦ 15,210"
Cute Bunny Pet Vest Accessories Outdoor Leash Rabbit Clothes Harness Strap Leash For Rabbit Dress C,"₦ 12,200"
Retractable Tractor Dog Chain,"₦ 15,850"
Retractable Puppy Harness Small Pets Chain,"₦ 23,150"
5ft Strong Dog Leash Pet Thick Durable Nylon Rope,"₦ 7,234"
Nylon Heavy Duty Dog Pet Harness Collar Adjustable Padded Extra Big Large Medium Small Dog Harnesse,"₦ 14,716"
Rabbit Guinea Pig Rat Ferret Breathable Mesh Vest Harness Black S,"₦ 1,045"
Stainless Steel Pet Chain Dog Leash,"₦ 20,600"
Pets Collar Leash Dog Rope Pet Chain,"₦ 20,000"
Hamster Rabbit Guinea Pig Rat Ferret Breathable Mesh Harness Blue M,"₦ 2,085"
Reflective Polyester Dog Leash Pet Walk Running Hiking Leash Orange,"₦ 3,866"
Pet Dog Harness Small Dog Chain Teddy Vest Puppies Chest Strap Breathable Mesh Harness Leash Pet Se,"₦ 8,130"
Pattern Pet Chest Strap Explosion Proof Punch Pet Traction Rope Dog  Chest Strap Pet Products Dog A,"₦ 9,708"
Rabbit Cute Small Pet Harness Vest And Leash Set With  Hat L Yellow,"₦ 6,944"
Cat Accesories Pink PU Leather XS S M L XL Safety Name Personalized Chihuahua Necklace Small Cat Le,"₦ 8,099"
Hamster Rabbit Guinea Pig Rat Ferret Breathable Mesh Harness Pink L,"₦ 2,146"
Reflective Dog Collar Harness For Medium Large Dogs Breathable Adjustable Pet Harness Vest Pasted P,"₦ 24,402"
1pc Durable Dog Leash Nylon Pet Noose Loop Lock Clip Rope Harness Dogs Grooming Table Arm Bath Rest,"₦ 5,994"
