Item,Price
Casual Sweater Set Men's Long Sleeve Sweatshirt + Trousers,"₦ 8,311"
Casual Round Neck Sweatshirt Men's Long Sleeve Top,"₦ 5,256"
Black Casual Long Sleeve Hoddie 100% Cotton,"₦ 9,999"
Dubai Emirate Black Quality Jalabia Arabian Muslim Wears With Throbe,"₦ 24,500"
Jaop Red Crew Neck Sweatshirt,"₦ 14,000"
Sweatshirt Beach Wear Christmas Boys Men's Fashon T Shirt And Short - Black,"₦ 7,999"
UP AND DOWN COLLAR NECK POLO AND SHORT,"₦ 9,999 - ₦ 12,999"
BLACK UP AND DOWN COLLAR NECK AND TROUSERS,"₦ 9,999 - ₦ 10,999"
GREY UP AND DOWN COLLAR NECK AND TROUSERS,"₦ 13,999"
Dubai White Quality Jalabia Arabian Muslim Wears With Throbe (The Emirate),"₦ 24,500"
Quality Jalabia,"₦ 21,890 - ₦ 35,890"
Luxury Grey Cargo Sweatshirt,"₦ 8,000"
Christian Edition Sweatshirt Ezra 10:14 Black,"₦ 11,000"
UP AND DOWN ROUNDNECK AND TROUSERS,"₦ 9,999 - ₦ 12,999"
Jaop Black Crew Neck Sweatshirt,"₦ 10,000"
Black  Hoddie With Ohh Yes Print,"₦ 9,000 - ₦ 15,000"
Luxury Sweatshirt,"₦ 6,900"
Navy-Blue Casual Long Sleeve Hoddie 100% Cotton,"₦ 9,999"
UP AND DOWN ROUND NECK T-SHIRTS AND TROUSERS,"₦ 9,999 - ₦ 10,999"
Danami Navy Blue And White Bold Striped Sweatshirt,"₦ 5,999"
Yellow Casual Long Sleeve Hoddie 100% Cotton,"₦ 9,999"
Praaaaempire Black Cargo Sweatshirt And Cargo Pant,"₦ 20,000"
Pink Casual Long Sleeve Hoddie 100% Cotton,"₦ 9,999"
Christmas Boys Men's Fashon T Shirt And Short Sweatshirt Beach Wear- Black,"₦ 7,999"
Christian Edition Sweatshirt Ezra 10:14 Offwhite,"₦ 10,500"
Christian Edition Sweatshirt Great Is He (Off White),"₦ 11,000 - ₦ 12,500"
Christian Edition Sweatshirt Great Is He (Black),"₦ 11,500"
Christian Edition Sweatshirt Philips 4:13 Red,"₦ 10,500"
Plain Black Turtleneck,"₦ 7,000 - ₦ 8,000"
Black Urban Hoddie,"₦ 7,500 - ₦ 8,000"
Christian Edition Sweatshirt T.G.I.F. - Red,"₦ 11,000"
Christian Edition Sweatshirt T.G.I.F. White,"₦ 12,500"
Wine Casual Long Sleeve Hoddie 100% Cotton,"₦ 9,999"
