Item,Price
T6 L2LED Three Light Aluminum Alloy Flashlight Bicycle Headlight,"₦ 10,500"
Super Bright Three-mode Motorcycle And Bicycle LED Headlight Belt,"₦ 5,096"
Green/red/blue Violet Laser Pen Laser Pointer Pen Visible,"₦ 8,403"
50000lm T6 Tactical Military Led Flashlight 18650 Torch,"₦ 19,002"
Tactical Police 5000lm Zoom Xm-L T6 Led 5modes Flashlight,"₦ 13,169"
Two Sides 32 Led 32-Pattern Waterproof Wheel Signal Lights,"₦ 34,284"
Gub Cycling City Bike Urban Helment High Quality Bicycle,"₦ 5,204"
Suitable For Mountain Bike Wheel Set Stickers Mtb En305 Pvc,"₦ 59,445 - ₦ 62,799"
Children's Bicycles Accelerate Bell Sound Imitation Bicycle,"₦ 24,282"
Bicycle Rear Light 5led2laser Waterproof Led Bycicle Rear 7,"₦ 26,523 - ₦ 26,847"
32pcs Led Diy Bicycle Light Colorful Bike Wheel Spokes Lamp,"₦ 13,131"
Bike Light Multifunction Bluetooth Flashlight Speaker Music,"₦ 18,722"
7 Led Silicone Bicycle Light Head Front Rear Wheel Led Lamp,"₦ 32,064"
New Horn Headlamp Wireless Code Meter Multifunction Lamp,"₦ 25,030"
Bike Bag Bicycle Bag Phone Case For Bycicle Cycling Head,"₦ 43,284"
Moon METEOR STORM PRO USB Rechargeable Front Light Brightness 2000 lumens Black One size 90473000,"₦ 123,200"
Usb Rechargeable Rear Tail Bike Light Lamp Taillight Raypal,"₦ 44,804"
3 Meters Bicycle Handlebar Tap Self-Adhesive Glow In Dark,"₦ 7,939"
Cycplus Bicycle Speed Sensor Wireless Bt Ant Bike Ipx7 4g,"₦ 18,482"
Tyre Tire Valve Caps Bike Light 1pcs Bycicle Luces Led Led,"₦ 25,284"
Sahoo 112003-Wxy Water-Resistant Touchscreen Cycling Head,"₦ 14,781"
Usb Rechargeable Bike Light Mtb Bicycle Front Back Rear,"₦ 15,866 - ₦ 18,772"
Usb Rechargable Bicycle Light Led Blue Red Dual Color Bike,"₦ 27,684"
4 In 1 Bicycle Light 2*t6 Led Usb Rechargeable Bicycle Horn,"₦ 5,204 - ₦ 20,380"
Universal Led Bicycle Wheel Lamp Waterproof Mtb Road Bike,"₦ 35,976"
6.5inch Self-Balancing Electric Scooters Skin Hover Board,"₦ 40,062 - ₦ 56,094"
12psi Rechargeable Portable Intelligent Electric Ball Pump,"₦ 71,187"
Style Waterproof 5led Bike Bicycle Flashing Flashlight Rear,"₦ 29,829"
500000 Lumens Xhp50 5 Mode Led Usb Rechargeable 18650 Torch,"₦ 57,600 - ₦ 74,088"
Cycling Accessories Decoration Led Flashlight Front / Rear,"₦ 27,168"
Q5 Led Bike Front Light 3000 Lumens 3 Mode Handlebar Torch,"₦ 31,755"
Kingseven Bicycle Head Lights Sunny 1000 Lumen Grande Power,"₦ 68,187"
Car Air Pump Nozzle Adapter Truck Tire Inflator Valve Head,"₦ 22,371"
3w Police Led Flashlight T6 Waterproof Shock Resistant Led,"₦ 15,626"
Mini Led Spotlight Lighting Stage Spot Effect Light For,"₦ 26,746"
Powerful Laser Pen 303 Adjustable Focus 532nm Green Laser,"₦ 17,340 - ₦ 21,554"
Z30 15000lm T6 Led Light Bike/bicycle/light Set Usb Cycling,"₦ 29,804"
Wadsn Tactical Flashlight Fast Helmet Guide Light Safety,"₦ 18,012"
Baseball Bat Led Flashlight 2000 Lumens Super Bright Baton,"₦ 21,542 - ₦ 51,652"
Rockbros Bicycle Light Front 4800mah 1000lumen Usb Charging,"₦ 61,311"
