Item,Price
Fat Tyre Cruiser Power Bike,"₦ 250,000"
Electronic Necessities E-bike,"₦ 180,000"
Motorbikes Ride On Power Bike Motorcycle,"₦ 115,000"
Unisex Children Kids Bicycle -16 Inches,"₦ 55,500"
Kent 26” Northwood 21-speed Dual Drive Tandem Adult’s Bike,"₦ 250,000"
Fat / Wide Tire Adult 26inches Mountain Bike,"₦ 275,000"
Spinning Bike With Meter Quality Standard,"₦ 185,000"
"Raleigh 26"" Adult Bicycle_raleigh Dual Suspension Mountain Bike","₦ 117,900"
Newly Improved Exotic Spinning Fitness Bike With Multi-Adjustable Big Sized Seat,"₦ 235,000"
"Mongoose Excursion Mountain Bike, 24-inch Wheel, 21 Speeds, Black","₦ 190,000"
Kids/Children Tricycle (Age 1-5),"₦ 39,000"
Motorbikes Kids Children Power Bike Motorcycle Tricycle Bicycle,"₦ 120,000"
Adult Big Size Tyre Bicycle,"₦ 400,000"
"Hyper Electric Bicycle Pedal Assist Commuter, 700C Wheels, Black","₦ 750,000"
Spinning Bike With Meter High Fly Wheel Standard,"₦ 160,000"
STEM Assembled Intelligent Electric Dog 142PCS Children's Smart Toys,"₦ 18,964"
26 Inches Hyper E Bike ( 36 Volts),"₦ 750,000"
"Hyper Bicycles E-Ride Electric Pedal Assist Men's Cruiser Bike, 26"" Wheels, Black","₦ 423,000"
2Pack Bike Inner Tube 20X1.75-2.125AV Bicycle Inner Tube Tyres Road MTB Bike Interior Tire Tube Bike Parts,"₦ 14,467"
Hyper Toys HPR 350 Dirt Bike 24 Volt Electric Motorcycle In Pink,"₦ 255,000"
WILD MAN ES3 Hard Shell Bicycle Bag Front Beam Bag Mountain Bike Mobile Phone Touch Screen Upper Tube Bag Riding Equipment Colour: Black(1L),"₦ 14,960"
LMV 26 Inches Fat Bike,"₦ 235,000"
"Huffy 26"" Nighthawk Men's Mountain Bike,","₦ 180,000"
"Kent 20"" Torpedo Kids Ebike, Electric Bicycle","₦ 350,000"
"Mongoose PT20 Pump Track, BMX Bike, Single Speed, 20-inch Wheels, Silver","₦ 215,000"
Magnetic Bike For Fitness Exercise With Meter,"₦ 82,500"
"ToTs by Smartrike SmarTrike STR7J, 7-in-1 Folding Baby Stroller Tricycle, 6M+ - Warm Grey","₦ 275,000"
Nel Lusso American  Elegant Outdoor Bike -26Inch,"₦ 236,250"
TWITTER Carbon Fiber Road Bike,"₦ 950,000"
"Hyper Bicycles Adult 26"" Multi-Color BMX Bike With Custom Jet Fuel Paint","₦ 298,000"
"Huffy NextGen 16 In Children's Bike Basket, Adjustable Padded Seat And Full-color Graphics,","₦ 98,000"
"Hyper E-Ride Electric Bike, Mid-Drive MTB Dual-Suspension, 36 Volt Battery, 20+ Mile Range,","₦ 1,310,000"
"Kent 700c RoadTech Men's Bike, Black/Green","₦ 210,000"
