Item,Price
3-Layer Spin Bike Frame Wrap Durable Sweat-Absorbing Towel Bicycle,"₦ 3,077"
Bike Front Wheel Riser Block Stabilize Bike Trainer Support Stand 2,"₦ 5,499"
Durable Spin Bike Frame Protection Wrap Stationary Spinning Bicycle,"₦ 3,077"
Universal Sweat Cather Net Frame Protector Guard For Stationary Red,"₦ 6,458"
Cycling Bike Trainer Sweat Cover Home Riding Frame Guard Net Absorb,"₦ 6,601"
Roller&Jump Rope No Noise Abdominal Wheel Ab Roller With Mat  For Exercise Fitness-2PCS Jump Rope,"₦ 55,871"
Fitness AB Roller With 2 PCS Elasticity Pull Rope Waist Abdominal Core Workout Abs-AB Roller,"₦ 50,767"
Bike Sweat Cover Bicycle Frame Guard Adjustable Net Strap Green,"₦ 4,831"
Bike Sweat Cover Bicycle Frame Guard Adjustable Net Strap Elastic Red,"₦ 4,831"
Resistance Bands  Stand Bar Abdominal Wheel AB Roller Jump Rope Grip Strength-Push-up Rack,"₦ 79,918"
Bike Sweat Cover Catcher  Frame Guard Adjustable Net Absorb Belt,"₦ 7,674"
Roller&Jump Rope No Noise Abdominal Wheel Ab Roller With Mat  For Exercise Fitness-2,"₦ 55,871"
Bike Sweat Guard Bicycle Trainer Sweat Net Sweat Catcher Protector,"₦ 11,304"
Electric Simulators Massage Press Trainer Abdominal Muscle Exerciser Belly Leg Arm-Type5,"₦ 50,631"
Abdominal Muscle Wheel Non-slip Roller 15CM Mute Men's Two-wheeled Abdominal Abdomen-Blue,"₦ 40,959"
Roller&Jump Rope No Noise Abdominal Wheel Ab Roller With Mat  For Exercise Fitness-Blue B,"₦ 55,871"
Bike Trainer Sweat Net,"₦ 15,021"
Bike Sweat Guard Bicycle Trainer Sweat Net Cover Strap With Phone,"₦ 11,765"
Smart Abdominal Muscle Stimulator Training Abs Trainer Home Gym Trainer Fitness Gear-Gold,"₦ 29,943"
Smart Abdominal Muscle Stimulator Training Abs Trainer Home Gym Trainer Fitness Gear-Ivory,"₦ 29,943"
MTB Mountain Bike Trainer Sweat Cover Catcher Indoor Frame Guard Net,"₦ 9,774"
2x Indoor Bike Bicycle Cycle Trainer Sweat Absorb Cover Frame Guard,"₦ 9,344"
Mosodo Ab Roller Wheel Abdominal Muscle Trainer With Non-slip Mat Waist Exercise-Green,"₦ 38,138"
MTB Bike Trainer Sweat Cover Bicycle Frame Guard Net Absorb Strap,"₦ 7,695"
Resistance Bands  Stand Bar Abdominal Wheel AB Roller Jump Rope Grip Strength-AB Wheel,"₦ 79,918"
Ab Roller No Noise Abdominal Wheel Ab Roller Stretch Trainer For Arm Waist Leg-Blue,"₦ 42,706"
ABS Abdominal Roller Exercise Wheel Mute Ab Roller Arms Back Belly Core Trainer Body-Red,"₦ 38,945"
Mosodo Ab Roller Wheel Abdominal Muscle Trainer With Non-slip Mat Waist Exercise-Gold,"₦ 38,138"
Electric Simulators Massage Press Trainer Abdominal Muscle Exerciser Belly Leg Arm-Type7,"₦ 50,631"
Smart Abdominal Muscle Stimulator Training Abs Trainer Home Gym Trainer Fitness Gear-Gray,"₦ 29,943"
Electric Simulators Massage Press Trainer Abdominal Muscle Exerciser Belly Leg Arm-Type4,"₦ 50,631"
Smart Abdominal Muscle Stimulator Training Abs Trainer Home Gym Trainer Fitness Gear-Green,"₦ 29,943"
Ab Roller No Noise Abdominal Wheel Ab Roller Stretch Trainer For Arm Waist Leg-Red,"₦ 42,706"
