Item,Price
Motorcycle Height Extender Rear Shock Absorber Riser Suspension Red,"₦ 3,370"
Rear Shock Absorber For Honda XR50 CRF50 70 90 110 50cc125cc Pit Dirt,"₦ 31,552"
Motorcycle Height Extender Rear Shock Absorber Riser Suspension Silver,"₦ 1,850"
Motorcycle Height Extender Rear Shock Absorber Riser Suspension Gold,"₦ 3,987"
Rear Oil Fil  Sho K Absorber Adjustable For Ra Ing 1/10 R   Ar-orange-105mm,"₦ 6,460"
Rear Oil Fil  Sho K Absorber Adjustable For Ra Ing 1/10 R   Ar-red-92mm,"₦ 6,300"
MTB Bike Rear Shock Deluxe Mountain Bicycle Rear Suspension Damping,"₦ 29,032 - ₦ 31,426"
Bicycle Suspension Seat Post Alloy Alumium Shock Absorber Bike Seatpost,"₦ 14,025 - ₦ 16,174"
"Mountain Bike Shock Absorber Bushings, Bicycle Rear Shock Mount","₦ 2,125"
Seat Post Dropper Hydraulic Lifting MTB Bike 31.6mm 30.9mm Internal Wire Remote Control,"₦ 22,755 - ₦ 22,909"
For Lenovo Tb-x505x Tablet Case 3D Emboss Tree Leather Flip,"₦ 20,420"
Rear Shock Absorber For Honda XR50 CRF50 70 90 110 50cc/125cc Pit Dirt,"₦ 29,028"
2xBike Rear Shock Bushing Turn Point Rear Suspension Modified Parts 22,"₦ 4,882"
Rear Shock Premium Du Bush Low Friction Bushing,"₦ 3,973"
