Item,Price
Clotheslines Hosiery Cleaning Collector Socks Collation,"₦ 2,015"
Wooden Eat Fruit Children Hand Wear Baby Funny,"₦ 1,344"
Small Rhinestone Embellished Hollow Jewelry Storage Gift,"₦ 7,964"
"Target Pouch Storage Carry Equipment Bag for Nerf Guns,","₦ 28,200"
Waterproof Windproof Cycling Lock Shoe Covers,"₦ 10,682"
Hydfly Sea Beach Bag For Watersport Water Proof Pool,"₦ 15,699"
Clotheslines Hosiery Cleaning Collector Socks,"₦ 2,341"
Unisex Rain Boots Cover Heels Platform Rain Boot——Blue,"₦ 4,080"
RLichiy 1 Pair Cycling Shoe Covers Waterproof Warm,"₦ 12,232"
Newest Bike Wall Mount Bicycle Stand Holder Mountain Bike Rack Stands Steel Hanger Hook Storage Bicycle Accessories,"₦ 14,907"
Wooden Eat Fruit Children Eay Education Puzzle Hand Wear,"₦ 1,283"
Unisex Rain Waterproof Boots Cover Heels Boots Reusable,"₦ 4,106"
SOLDIER Bike Cycle Storage Rack Mount Hanger Hook Red,"₦ 17,288"
Assorted Doll Accessories Bedroom Furniture Kitchen,"₦ 1,159"
Cute Plush Velour Animals Hand Puppets Toy,"₦ 3,808"
"Plastic White Bathroom Wall Shelf, Suction Rustic U Shaped Floating Shelves Wall Mounted Bathroom Organizer Shower Caddy, Set of 3","₦ 46,165"
Rhinowalk Bike Bag Handlebar Bag Bicycle Bags Waterproof,"₦ 23,503"
"Wooden Trumpet Eat Fruit Pear Watermelon Child Early Education Puzzle Hand Wear Baby Funny Toy Eat Apple, Watermelon, Pear 3 In 1 Wooden Toy","₦ 4,488"
"Bike Phone Holder, Flexible Handlebar Smartphone","₦ 6,035"
Hard Plastic Batteries Battery Case Holder,"₦ 1,853"
Rear Bike Rack-Bike Rack for Back of,"₦ 45,408"
1 Pcs Kawaii Squishy Piggy Mochi Anti Stress,₦ 741
New Hot Creative Clotheslines Hosiery Cleaning Auxiliary Collector Socks Collation Device Blue,"₦ 2,341"
Bicycle Wall Mount Storage Holder Set Stand Cycle Bike,"₦ 18,904"
Bike Cargo Rack Disc Brake Aluminum Alloy Bicycle Rear Rack MTB Road Bike Foldable Bikes Pannier Carrier Luggage Shelf,"₦ 37,470"
Bike Stand Wall Mount Bicycle Holder Mountain,"₦ 40,402"
Mountain Bike Rear Luggage Rack Height Adjustable Coating,"₦ 85,851"
DRCK HROS Bicycle Hanger Wall Hook Road Mountain,"₦ 18,020"
"Plastic White Bathroom Wall Shelf, Suction Rustic","₦ 39,337"
Hydfly 10L Sport Sealed Waterproof Dry Swimming,"₦ 12,270"
Outdoor Drifting Scuba Diving Gear Storage Bag,"₦ 31,886"
Folding Bicycle Luggage Carrier Alloy Portable Heavy Duty,"₦ 50,162"
Water Bottle Holder Nylon Fiber Sport Mountain Road Bike Bottle Mount Rack Black,"₦ 2,350"
