Item,Price
Fcfb Carbon Handler Matt Glossy Gold Red Mountain Handlebar,"₦ 57,236"
Mountain Bike Road Bicycle TT Handlebar Rest Handle Bar  Performance,"₦ 7,427"
Cycling Double Side With Mobile Phone Pouch Bike Frame Bag,"₦ 33,588"
Platt-Wss Carbon Fine Bar Carbon Handlebar Super Light Bars,"₦ 51,802"
Bicycle Rest Tt Handlebar Clip On Aero Bars Handlebar Bars,"₦ 24,878"
Fcfb Delivery Freight Payment,"₦ 11,023"
3 In 1 Atv Quad Light Turn Signal Horn On/off On For,"₦ 11,551"
Rest Tt Handlebar Aero Bars For Triathlon Time Trial Tri,"₦ 44,657"
Bicycle Fork Stem Height Extender Handlebar Rise Up Adapter,"₦ 44,079 - ₦ 59,502"
Ullicyc Mtb Carbon Friber Bicycle Handlebar Flat Or Rise,"₦ 37,712"
2pcs Road Bike Bicycle Cycle EVA Handlebar Tape Wrap With Bar Black,"₦ 1,033"
Fmfxtr Ultralight Road Bike Curved Handle Broken Wind Bike,"₦ 11,653"
Tomtou Bike Road Drop Bars Sets Carbon Fibre Handlebars -,"₦ 37,277"
E-Bike Elelctric Bicycle Half Right Hand Throttle For Motor,"₦ 34,524"
Rest Tt Handlebar Aero Bars For Triathlon Time Trial Bike,"₦ 20,802"
Black Knight Pro Rxl Style Ud Carbon Xxx Mtb Bicycle Flat 9,"₦ 37,712"
Bicycle/bike Cart Mount Kit Holder Stand For Garmin Gpsmap,"₦ 16,535"
Ec90 Brand New High Quality Highway Bicycle Handlebar Fiber,"₦ 83,514"
5pcs Accessories Easy Use Bicycle Stem Black Fairing Fix /,"₦ 26,036"
Aero Bars Rest Handle Handlebar For Triathlon Time Trial,"₦ 45,017"
Mountain Bike Handlebars Aluminum Alloy Small Pay Cattle,"₦ 21,260"
Hb-021 Toray Carbon Bicycle Handlebar For Mountain Bike,"₦ 37,712 - ₦ 44,826"
Gub 693 690 660 668 692carbon Fiber Bicycle Computer Frame,"₦ 14,898 - ₦ 31,840"
Tmaex- Full Carbon Road Bike Breaking Wind Carbon Seatpost,"₦ 43,412 - ₦ 55,928"
Universal Motocycle Bicycle Mobile Phone Holder For Iphone,"₦ 28,214"
West Biking Bicycle Handlebar Tape Soft Bike Barstape Pu,"₦ 29,806 - ₦ 47,284"
Bicycle Bottom Bracket Remover Bb Puller 20 Teeth Wrench,"₦ 28,860"
Skateboard Handle Bar Replacement Black Blue,"₦ 80,627"
Retro Bike Fixed Gear Handlebar Aluminum Alloy Ladies Bike,"₦ 48,462"
Frame Headset Bearing 1k Talon Carbon Handlebar Washer Stem,"₦ 12,948 - ₦ 43,412"
10cm Carborn Fiber Bicycle Handlebar Extended Bracket Bike,"₦ 17,764 - ₦ 18,618"
Uno Bicycle Road Bike Race Wind-Breaking Bending Handle,"₦ 23,665"
Free Full Carbon Fiber Road Bike Ultralight Breaking Wind,"₦ 21,706"
Fouriers Hb-Tr002 Bike Triathlon Tri-Bar Bridge Road Tt End,"₦ 18,400"
