Item,Price
"Edifier TWS1 PRO True Wireless Earbuds,Bluetooth V5.2 Headphone,CVC8.0 Noise Canceling, IP65 Dustproof & Waterproof,One-Step Pairing","₦ 17,766"
"Edifier X5 Wireless Headphone, Bluetooth 5.0 Headset Earpiece,Noise Cancelling,Touch Contro,IP55 Dustproof & Waterproof, Deep Bass","₦ 11,100"
Wireless Fingerprint Touch Noise Cancelling Headphones,"₦ 4,290"
Edifier G2000 32W PC Computer Speakers Bluetooth USB 3.5mm AUX Inputs RGB Lights Multimedia Speaker,"₦ 27,264"
Pro3 In-Ear Wireless Sports Headphones Stereo Headphones,"₦ 3,324"
V9 Earhook Wireless Bluetooth Earphone Headset Noise Cancelling,"₦ 3,660"
Nail Art Kit Nail Dryer Nail Drill Machine With Accessories,"₦ 10,500"
WiFi Adapter - 600Mbps 5Ghz USB - Ethernet - Black,"₦ 4,190"
True Wireless Earphones Bluetooth 5.0,"₦ 4,100"
Laptop Tablet Stand Foldable 10 Level Adjustable Computer Notebook Holder Bracket,"₦ 3,999"
Smart Watch Touch Screen Sports Waterproof Fitness Tracker,"₦ 10,590"
Women Wallet Long Purse Love To You Solid Color Clutch Vintage Fashion Money Clip Coin Pocket,"₦ 1,350"
Tripod Stand Holder Bluetooth Remote Control Stretchable Adjustable Camera Phone Stand Mount Holder,"₦ 4,999"
Women Gothic Heart Rhinestone Pendant Velvet Choker-Black,₦ 581
1 Pair Women Necklace Best Friends Letters Engraved Jewelry Freinds Matching,₦ 735
1 Pair Couple Bracelet Chic Adjustable Resin Key Heart Lock Chain Bangle For Dating-Black,₦ 535
Ear Rings Dangle Exquisite Eye-catching 2 Colors Imitation Pearl Tassel Earrings Dangle For Banquet-Silver,₦ 440
1 Pair Iron Eardrops Strong Magnetic Health Pierced Round Magnetic Iron Eardrops Earrings Gift For Women-White,₦ 441
Bracelet Braided With Magnetic Buckle Faux Leather Versatile Men Hand Chain For Anniversary-Coffee,₦ 555
His Queen Her King Couple Bracelet Matching Bangles Lovers Jewelry Gift,₦ 498
1 Pair Ear Studs Heart-shaped Easy To Match Alloy-Golden,₦ 570
Ear Rings Dangle Exquisite Eye-catching 2 Colors Imitation Pearl Tassel Earrings Dangle For Banquet-Golden,₦ 446
Multi-Layer Heart Pendant Anklet Women-Silver,₦ 715
Lady Elegant Multi-Layer Round Long Drop Dangle Hook Earrings Jewelry Gift-Silver,₦ 606
Bracelet Braided With Magnetic Buckle Faux Leather Versatile Men Hand Chain For Anniversary-Black,₦ 517
Ethnic Silver Plated Bead Braided Red Rope Bracelet Unisex Lucky Wrist Decor-Red,₦ 221
For OPPO A53 Transparent TPU Case,₦ 860
Camera Precision Hole PP Protective Case For IPhone 13 (Gray Blue),"₦ 1,010"
For Xiaomi Redmi Note 10S Shockproof Soft TPU Case,"₦ 1,780"
For Apple AirPods Pro Ultra-thin Silicone Wireless Earphone Protective Case(Yellow),₦ 900
For Samsung Galaxy A32 4G Protective Case (Transparent),"₦ 1,010"
For Tecno Spark 7 Pro Camon 17 Sunrise Phone Back Cover,"₦ 1,818"
Protective Case For Huawei Honor 9 Lite (Transparent),"₦ 1,040"
For Itel P38 Pro TPU Phone Case(Black),"₦ 1,160"
For Google Pixel 4a TPU Ultra-Thin Transparent Mobile Phone Case,"₦ 1,080"
For Xiaomi Redmi 9C TPU Case,₦ 840
For Samsung Galaxy M11 / A11 TPU Case,₦ 890
TPU Phone Case For Tecno Spark 7P,"₦ 1,310"
For Redmi Note 5A Prime Case Cute Superman Phone Back Cover,"₦ 1,863"
For Infinix Note 12 VIP TPU Phone Case(Pudding Black),"₦ 1,190"
TPU Case For Tecno Pova 5G,"₦ 1,290"
Adjustable Laptop Tablet Stand Multi-angle Laptop Holder,"₦ 7,790"
4.4/6.5/8.5/10/12 Inch LCD Drawing Tablet For Children's Toys Painting Tools Electronics Writing Board Boy Kids Educational Toys,"₦ 3,500 - ₦ 8,980"
3.5mm AUX Audio Cable Speaker Receiver Adapter Dongle USB Bluetooth,"₦ 2,440"
Yvonne YT601-2 USB2.0 U Disk 16GB OTG Double Ports,"₦ 2,760"
2x Micro USB Female To USB2.0 A Male Converter Connector Adapter For,₦ 549
DP To Mini DP Adapter DisplayPort Male To Mini Display Port Female,₦ 704
Portable USB Hub USB Adapter 4-in-1 Aluminum Alloy Hub With,"₦ 2,550"
PIX-LINK USB Wi-Fi Range Extender Wireless Wifi Repeater,"₦ 12,510"
External Hard Drive Disk Case Shockproof EVA Case 2.5in HDD,"₦ 3,440"
2.4G Wireless Optical Mouse Vertical Mouse 6 Keys Ergonomic,"₦ 10,620"
2.4G Wireless Mouse Portable Ultra-thin Mute Mouse 4 Keys,"₦ 2,580"
Oraimo 27000mAh Massive Power Charing Bank Traveller 3 Byte,"₦ 19,000"
Eaget Pen Flash Drive 3.0 32GB - Metal OTG Micro USB Type-C,"₦ 2,718"
Fingerprint Touch Bluetooth Headset Noise-cancelling Stereo Headset,"₦ 3,500"
Men's Trendy Zipper Comfort Hoodie Jacket Sweatshirts - White,"₦ 2,999"
Yemlays Men's Casual Shoe -blue,"₦ 4,980"
Men Breathable Outdoor Casual Shoes -black,"₦ 7,800"
Edifier M206BT 68Watts Channel Bluetooth Multimedia Speakers,"₦ 36,355"
Mens Patterned Vintage T-shirts Floral Short Sleeve Shirts,"₦ 3,500"
Blackview FS-Android Smartphone Oscal C20 Dual-SIM 3G 1+32GB 6.088 Inch Screen -Black,"₦ 50,545"
4 In 1 Set Handbags Single Shoulder Messenger Bag-Brown,"₦ 6,200"
"UMIDIGI A13S (4GB,64GB ROM) 6.7"" HD+ 5150mAh Global Version (16MP+8MP+5MP)+8MP-Galaxy Blue","₦ 86,900"
Edifier W800BT PLUS Wireless Bluetooth Headset,"₦ 22,718"
Blackview Oscal C20Pro 32GB+2GB 4G Android 11 Smartphone 6 Inch Screen 8MP+2MP Camera-Blue,"₦ 56,973"
4 In 1 Women Crossbody Handbag -Pink,"₦ 6,990"
Eaget Pen Flash Drive 3.0 64GB - Metal OTG Micro USB Type-C,"₦ 2,900"
Big Size Men Glossy Tassel Brogue Leather Shoes-black,"₦ 24,500 - ₦ 27,300"
Crocodile Pattern Mens Bullock Leather Shoes Oxford Formal Shoes Retro Big Size,"₦ 18,703 - ₦ 26,481"
Children's High-end Sports Shoes Leather Shoes School,"₦ 17,888"
Luxury Fashion Large Size 38-46 Loafers Men's Wedding Shoes Casual Rivet Leather Shoes Black,"₦ 27,000 - ₦ 28,900"
Top Quality Mens Shoes - Brown,"₦ 27,500 - ₦ 28,900"
Work Safety Steel Toe Slip-on Breathable Puncture-proof Shoe,"₦ 23,333 - ₦ 31,111"
Children's Sports Leather Shoes Boys And Girls Flat Running Shoes White,"₦ 20,450"
Men's Fashion Anti Slip Flip Flop - Blue,"₦ 16,850"
Mens Casual Leather Wedding Dress Formal Shoes Loafers-Black,"₦ 27,000 - ₦ 29,900"
Men's Formal Shoes Alligator Leather Loafers Tassel Business Casual Moccasins,"₦ 26,000 - ₦ 27,900"
EUR Size 38-44 Mens Shoes Brogues Slip-On Loafers British Style Tassel Leather Shoes Black,"₦ 27,000 - ₦ 28,900"
Men's New Fashion Breathable Leather Shoes -black,"₦ 19,963"
HOT Mens Dynamic Formal Leather Shoes-Brown,"₦ 24,900 - ₦ 25,900"
2020 Big Size Men Glossy Tassel Brogue Leather Shoes-Black,"₦ 24,900 - ₦ 26,900"
Skmei Top Luxury Brand Watch Men's Sports Watch Fashion Digital Watches Gift For Male SKM1142,"₦ 7,100"
Yazole Top Luxury Brand Watch Famous Fashion Sports Cool Men Quartz Watches Wristwatch Gift For Male YZL281H-A-Brown,"₦ 3,220"
Skmei 1503 Men Sport Watches Waterproof Outdoor Wristwatch,"₦ 10,440"
Yazole Brand Watch Sports Men Watches Male Wristwatch YZL509,"₦ 5,490"
Wlisth Mens Watches Waterproof Quartz Luxury Wristwatch Steel Strap,"₦ 7,600"
Business Men's Watch Blue-ray Plexiglass Quartz Watch,"₦ 2,688"
Nibosi Sport Watch Men Business Waterproof Quartz Watch Man Mens Watchs Clock,"₦ 24,853"
Yazole Top Luxury Brand Watch Famous Fashion Sports Cool Men Quartz Watches Wristwatch Gift For Male YZL271X-Black,"₦ 4,930"
Charm Bracelets Handmade Wrap Bracelets Stainless Steel Love Leather Bracelet Gold,"₦ 3,500"
Olevs Ultra Thin Quartz Watch Men OLEVS Luxury Rose Gold Men Watch,"₦ 11,660"
Yazole Brand Watch Sports Men Watches Male Wristwatch YZL448,"₦ 4,350"
Mini Focus Watch Fashion Men Sport Watches Male MF0052G.02,"₦ 12,510"
1 Pair Couple Watch Automatic Quartz Romantic Watch,"₦ 11,920"
Men Ultra Thin Quartz Watch Luxury Wrist Watches Business Leather Watches Rose Waterproof  -Gold,"₦ 8,520"
Mini Focus Watch Fashion Men Sport Watches Male MF0244G.01,"₦ 16,570"
Fingerprint Touch Bluetooth 5.0 Earphones Wireless 9D Stereo Professional Headset.,"₦ 3,634"
Fingerprint Touch Bluetooth 5.0 Earphones,"₦ 3,220"
Bluetooth Headset +  Smart Watch Waterproof Sports Combination Affordable Set,"₦ 8,640"
"10"" LED Selfie Ring Light Circle Fill Light Dimmable Round Lamp Makeup Photography RingLight","₦ 9,190"
Bluetooth Speaker Subwoofer Portable ABS 3W HiFi Sound-Green,"₦ 7,446"
Smart Watch Full Touch Screen Watch - For Android & IOS.,"₦ 5,470"
IOS Smart Watch Fitness Sleep Watch - For Android & IOS,"₦ 3,300"
Bluetooth 5.0 PRO3 Wireless Earphone Waterproof Earbuds Air3 Business Big Batteries Headset,"₦ 3,270"
"Wireless Earbuds, Bluetooth 5.0 Headset Earpiece,Noise Cancelling,Touch Contro..","₦ 3,550"
"10"" Live Ring Light LED Ringlight With Tripod Stand And Phone Holder.","₦ 14,260"
Bluetooth Headset +  Smart Watch Waterproof Sports Combination Affordable Set.,"₦ 9,970"
Bluetooth Sport Pedometer Watch  Smartwatch For All Phone,"₦ 3,250"
S8 Mini Wireless In-ear Stereo Earbuds,"₦ 1,600"
Men's Cotton Short Sleeve Casual Shirt - Brown,"₦ 12,999"
Incerun Men Trendcy Leisure Hit Color 3/4 Sleeve Top Shirt,"₦ 6,020"
Fredd Marshall Men's Fashion Denim Short Sleeve Shirt - Blue,"₦ 12,999"
Men Design Shirt Plus Size Long Sleeved Plaid Casual Classic Shirt Slim Shirt,"₦ 8,399"
Incerun Men Casual Coconut Tree Print Shirts Short Pant Set,"₦ 9,280"
100% Ick Cotton Men's Gold High-end Embroidery Cotton Party Work Shirt Long Sleeve,"₦ 18,999"
2 Piece Set Men's Linen Print Long Sleeve Shirt With Casual Long Pants,"₦ 29,944"
Men's Printing Check Line Polka Dot Business Shirt Long Sleeve Wholesale,"₦ 11,499"
Men Shirt Long Sleeve New Palace Printed Flower New,"₦ 12,999"
3 In 1 Men's Casual Office Short Sleeve Shirt - Multicolor,"₦ 22,330"
New Men's Grey Shirt Long-sleeved Solid Color Slim Shirt,"₦ 8,800"
Incerun Men Leisure Stand Collar Short Sleeve Pants-Grey,"₦ 5,020"
Summer Short Sleeve Linen Vintage Shirts,"₦ 7,810"
2 Pieces (White+Black)= 6999 Men's Printed Rose Flower High-end Business Shirt,"₦ 18,999"
Plus Size Vintage Beach Hawaiian Shirt Long Sleeves Printed Floral Shirt,"₦ 8,399"
50 LEDs Fairy String Lights 5M Length USB Copper Wire Lamp,"₦ 2,510"
1 Meter 10 LEDs Copper Wire Fairy Light Wine Bottle Cork,₦ 730
6 Color Digital RGB Disco Ball Stage Light LED Bluetooth Speaker Prom Laser Party Light With Mp3 Player Prom DJ Projector Light,"₦ 22,148"
LED Ceiling Downlight Recessed 9W 12W 15W AC220V LED Lamp Dimmable Led Downlight LED Spot Light,"₦ 6,482 - ₦ 8,408"
Modern Simple Square Acrylic LED Ceiling Light Living Room Bedroom Home Lamp# Inner Warm And Outside White,"₦ 22,705"
3-inch 7W Induction Lamp LED Motion Sensor Downlight,"₦ 12,190"
Button Battery Indoor Outdoor Copper Wire Decorative LED String Lights Orange,₦ 570
Modern Simple Floral Design Acrylic LED Ceiling Light Living Room Bedroom Home Lamp#Full Warm Light,"₦ 22,705"
Colorful Metal Aladdin Magic Lamp Retro Wishing Lamp Aladdin Genie Lamp Incense Burner Home Decor Gift Child Toy#Blue,"₦ 16,237"
Modern Simple Square Acrylic LED Ceiling Light Living Room Bedroom Home Lamp# Inner White And Outside Warm,"₦ 22,705"
10pcs/set Wedding Invitation Card Cover Pearl Paper Laser,"₦ 2,160"
Safe Book Shaped Metal Safe Piggy Bank Money Saving Case Storage Box With Keys #brown,"₦ 17,100"
Modern Simple Floral Design Acrylic LED Ceiling Light Living Room Bedroom Home Lamp#Full White Light,"₦ 22,705"
14m Waterproof SMD 5050 LED Strip 220V 230V 60leds/m Flexible Tape Rope Light Yellow,"₦ 24,181"
Imitation Wood Ceiling Lighting 8W,"₦ 6,333"
LED Ceiling Panel Down Light Surface Mount Living Lamp Bathroom Kitchen UK White Light 15W,"₦ 30,966"
LED Neon Sign Light USB/Battery Operated Night Lights Bedroom Christmas Decor,"₦ 14,854"
Magnetic Levitation Floating Globe LED Light World Map Round Shape Decor Gifts,"₦ 26,893"
E27 Lantern Retro Pendant Lights Vintage Wall Lamp For Bedroom Hallway Room Cafe,"₦ 16,530"
Solar Power Rose Flower Garden Stake Landscape Lamp Outdoor Yard LED Light # Red,"₦ 15,457"
1 Pack Waterproof LED Solar Light For Garden Holiday Solar Lawn Lamp Colors Changing,"₦ 13,677"
Solar Power Flower RGB Garden Decor Stake Outdoor Landscape Path LED Night Light Sunflower,"₦ 19,694"
5Pcs Transparent Color Square Plexiglass Acrylic Plate Plastic 4mm Thick Laser Cut,"₦ 14,702 - ₦ 18,060"
Colour Changing 5V RGB 5050 LED Strip USB TV Background PC Mood Night Light Lamp （Blue）,"₦ 14,354"
5/15/36w LED Modern Ceiling Light Bedroom Living Room Surface Mount Lamp Decor # Warm 20cm,"₦ 19,191"
Modern Simple Square Acrylic LED Ceiling Light Living Room Bedroom Home Lamp#Full White Light,"₦ 22,705"
10PCS/Set Vintage Colorful Geometric Wall Floor Stickers PVC Art Wall Decals Wallpaper Home Kitchen Bathroom Decoration Nonslip,"₦ 14,719"
Laser Fairy Light Projection Projector Christmas Outdoor Lawn Landscape LED Lamp (AU Plug),"₦ 25,243"
"Stainless Steel Contact Paper Self Adhesive Vinyl Film Wallpaper(24"" X 117"")","₦ 17,253"
Modern Corridor Vintage Retro Industrial Black Ceiling Wall Light Lamp Fitting,"₦ 32,601"
High-end Art Micro-spray Home Restaurant Living Room Porch Oil Painting Five Seaside Sunset,"₦ 13,285"
PVC World Map Wall Stickers Poster Traveller Vacation Maps Art Wall Decals Wallpaper Home Office Decoration Black 75*105cm,"₦ 14,250"
54x3W RGBW LED Light 162W PAR 64 DMX Outdoor DJ Party Club Stage Show Lighting,"₦ 27,494"
Mini Decor LED Artificial Silk Flame Glow Effect Party Table Light Lamp FZ#US,"₦ 16,349"
"18""x 20"" White High Density Seat Foam Cushion Pad Replacement Upholstery Firm # 3 Inch","₦ 54,437"
Solar Power Laser Lights Projector Outdoor LED Waterproof Garden Party Christmas,"₦ 32,176"
