Item,Price
Large Display Electronic Stopwatch Professional Running,"₦ 3,942"
Plus Smartwatch Talk Sports Timing Sleep Watch Strap,"₦ 3,471"
Kitchen Timer Digital Stopwatch With Loud Alarm Large LCD,"₦ 5,840"
Mens Sports Watch Chronograph Alarm Clock Digital Watch Life Waterproof,"₦ 2,550 - ₦ 2,671"
Full Touch Bluetooth Watch Health Detection Smartwatch.,"₦ 9,280"
Full Touch Bluetooth Watch Health Detection Smartwatch,"₦ 9,280"
Smart Fashion Watch With Detachable Strap,"₦ 27,690"
"Skmei Analog/Digital Watches,LED Multi Time Chronograph,","₦ 10,000"
LED Silicone Wrist Watches Bands Bracelet Strap,"₦ 1,982"
Ips Multi Function Smart Bracelet Heart Rate Stopwatch Timer,"₦ 29,850"
Smart Watch Camera Waterproof SIM Card Wrist Watch,"₦ 8,134"
Smart Watch Obsidian Wealth Bracelet Set,"₦ 4,982"
Fashion Quartz Watch 24-hour Display Alloy Case Sport Watch,"₦ 1,660 - ₦ 2,267"
Hand Decoration Business Watch,"₦ 3,234 - ₦ 3,253"
Smart Watch Wireless Bluetooth Headset Set,"₦ 4,982"
