Item,Price
Girls' One Piece Swimsuit Children's Climbing Suit Baby Swim,"₦ 22,100"
Girls Swimwear Kids Swimsuit Girls' Long Sleeve 3 Pieces Bab,"₦ 29,900"
Girls' Swimsuit Bikini Set Sunscreen Shirt 3pcs Swimwear For,"₦ 31,900"
Tablier Back Ribbon Children's One-Piece Swimsuit,"₦ 33,961"
Swimwear Thin Underwear,"₦ 9,760"
Girls Swimwear For Kids UV Protection Long Sleeves Toddler G,"₦ 31,900"
Swimsuit Kids Swimwear For Girls Long Sleeves Sun UV Protect,"₦ 29,900"
Kugi Girls' Zip-Up Short Sleeve Half Full Body Swimsuit KJ-M,"₦ 33,384"
Kid Girl One Piece Swan Print Ruffle Swimsuit,"₦ 9,570"
Women Swimsuit Drawstring Strapped Wireless Padded Bathing,"₦ 16,655"
Girls' Tantanyi Boom All-Over One-Piece Swimsuit 8-10843D242,"₦ 51,194"
Bathing Suit Thin Underwear,"₦ 4,246"
Kids Swimming Costumes Long Sleeve Swimwear For Kids Girls,"₦ 8,649 - ₦ 9,219"
New College Sports Competition Sunscreen Sleeve Short Sleeve,"₦ 36,600"
Nyx One Girls' Half Swimsuit NSJG-2952BK,"₦ 33,895"
Baby Girl Swimwear Two Piece Rash Guard Long Sleeves Unicorn,"₦ 26,200"
Spodino Girls' Balloon Rash Guard,"₦ 31,114"
Vivovinia Crown Infant Rash Guard SY117,"₦ 28,629"
Woman Jumpsuit Swimsuit Summer Surfing Swimming Polyester,"₦ 14,622"
Kugi Adventure Girls' Zip-Up Short Sleeve Half Body Swimsuit,"₦ 37,745"
MK Girls' Crowned Cloud Rash Guard 3-piece Set,"₦ 32,294"
2 Pieces/set Long Sleeve Lace Swimsuit Girl Summer,"₦ 15,588"
Vivovinia Watermelon Infant Swimsuit SY145,"₦ 34,623"
Vivovinia Girls' Rosemary Swimsuit 3-piece Set SY011,"₦ 31,628"
Little Mermaid Swimsuit,"₦ 28,657"
Tablier Cherish Children's One Piece Swimsuit,"₦ 32,683"
Jogs Girls' Coogee Sports Bag Pink Swimsuit 5020151,"₦ 44,585"
BAY-B Line Heart Children's Rash Guard Set,"₦ 29,420"
Kugi Adventure Girls' U-Back Two-Piece Swimsuit Set KJ-L512,"₦ 50,903"
El Inboa Girls' Indoor Swimming Long Sleeve Zip-Up Swimsuit,"₦ 37,430"
Bayb Toddler Kids Starfish Girls Rash Guard   Swimming Cap S,"₦ 31,378"
Kugi Girls' Zip-Up Short Sleeve Half Body Indoor Swimwear KJ,"₦ 33,384"
Tablier Summer Fruit One-Piece Swimsuit,"₦ 35,030"
