Item,Price
Women Casual Sweatpants Dance Hip Hop Pants,"₦ 10,446"
Women Tops Round Neck Contrast Color Long Sleeve Casual Pullover,"₦ 8,351"
Women Casual Sweatpants Jogger Hip Hop Pants,"₦ 11,013"
Knee Men Women High Long Socks Baseball Uni,"₦ 4,500"
Sock Pure Color Quality Flexible Women Girls Silk Socks,"₦ 13,900"
Women Sexy V-neck Embroidered Rose Short T-Shirt,"₦ 6,192"
Women Casual Sweatpants Hip Hop Pants,"₦ 10,480"
Toe Socks Casual Cotton Solid Sock,"₦ 13,900"
Women Fashion Long Sleeve V Neck Polka Dot Spotted Blouse,"₦ 8,756"
Lark 5 In 1 Sock For Girls,"₦ 6,000"
Women's Digital Printing Leggings Feet Pants,"₦ 10,233"
Casual Sports Fashion Sportswear Fitness Pants,"₦ 13,400"
Printing High Waist Pants Running Training Exercise Fitness,"₦ 10,564"
Double Layer Seamless Yoga Sports Bra,"₦ 7,108"
New Arrival Men Socks Tie-dye Breathable Cotton Socks,"₦ 10,600"
Women  Ankle Socks Princess Girl Cotton Sock,"₦ 14,200"
Heating Suit Unisex USB Heating Vest,"₦ 20,500"
Women Street Socks,"₦ 14,100"
Women's Elastic Waist Chiffon Harem Long Pants,"₦ 9,376"
Female Casual Funny Ankle Socks,"₦ 12,200"
1Pair 3D Animals Print Socks Uni Crew Long Socks,"₦ 12,200"
10 Pairs Ladies Women  Thin Socks,"₦ 13,600"
Women Fashion Long Sleeve V Neck Spotted Blouse,"₦ 8,756"
Color Cotton Casual Short Ankle Socks Hose,"₦ 8,500"
1 Pair Cotton Socks Ankle-High Casual Comfy Socks,"₦ 8,500"
Elasticity Lace Mesh  Elastic Hosiery,"₦ 13,900"
5pairs/lot=10pieces Comfortable Stripe Cotton Socks,"₦ 15,800"
Coque For IPad 9 9th 8 8th Generation 10.2 2020 Case Smart,"₦ 22,310"
Christmas Gift Warm Soft Comfortable Cotton Winter Sock,"₦ 10,600"
Hanes Boys Socks Double Tough Cushioned Ankle And No Show 12,"₦ 20,191 - ₦ 20,573"
1 Pairs Women Long Socks School Girls,"₦ 10,600"
Hanes Women S 10 Pair Value Pack Low Cut Socks,"₦ 114,190 - ₦ 114,285"
Transparent Socks Art Women Funny Glitter Socks,"₦ 10,600"
