Item,Price
"Bt5.0 Sleep Headphone Mask, Wireless Music Headphones","₦ 5,990"
Lixada Aluminum Alloy D-ring Locking Carabiner Screw Lock,₦ 865
Unisex Touchscreen Cycling Gloves Warm Mittens Hand Warmers,"₦ 3,703 - ₦ 3,861"
Ultra Light Thin Rain Skirt Waterproof Kilt Rain Pants,"₦ 7,030"
Hand Warmer USB Rechargeable Electric Hands Heater,"₦ 21,743"
Hand Warmer Atmosphere Lamp USB Rechargeable Hand Heater,"₦ 40,931"
Winter Mini Hand Warmer Heating Pad USB Rechargeable,"₦ 18,894"
Hand Warmer Sleeves Stove Warmers Rechargeable 6000mah,"₦ 37,807"
2L Hot Water Bottle Thick Rubber Warm Set Hot Water Bag,"₦ 6,799"
1 Set USB Electric Handwarmer Winter Night Lamp Function Mini USB Electric Hand Warmer Pink,"₦ 8,983"
10000mah Electric Hands Heater Mini Portable Usb Hand Warmer,"₦ 84,935"
1pc Mini Winter Reusable G E L Hand Warmer Warm-fitting,"₦ 8,333"
Outdoor 20W Multi-function Portable Manual Crank Generator,"₦ 35,151"
30.5M / 100FT Paracord 7 Strand Parachute Cord Lanyard Rope,"₦ 3,759"
Outdoor Swing Chair Mesh Net Water Resistant Patio Seater,"₦ 15,401"
USB Hand Heaters 3-speed Adjustable Reusable Hand Heating,"₦ 30,184"
Winter Silicone Hot-Water Bag Lovely Hand Warmer,"₦ 6,950"
20m Reflective Rope Paracord Cord Outdoor Gear Lanyard 1,"₦ 2,313"
Astronaut LED Flying Saucer Hand Warmer Night Light Spaceman,"₦ 23,430"
Mini Portable Hand Warmer Cute Winter Heater Quick Heating,"₦ 19,884"
Astronaut LED Flying Saucer Hand Warmer Night Light Bear,"₦ 23,430"
Case Cover Xiaomi Flip 9 Notes S9 Case Note 9s Redmi Note9s Xiomi Smart Readmi S Xaomi Redmy Note9 Note For 9s Coque S Mirror,"₦ 16,553"
Mini Cute Cat Claw Shaped Hand Warmer USB Rechargeable,"₦ 15,322"
Winter Mini Hand Warmer 2 In 1 3600mAh Rechargeable Pocket,"₦ 21,883"
Smart Flip Note Redmi Note Note9 Coque Note9s Xiaomi Case 9s Cover S9 Mirror S Readmi Xaomi 9 Notes Xiomi For Case S 9s Redmy,"₦ 15,941"
1 Set Electric Hand Warmer Winter Night Lamp Function Mini USB Electric Hand Warmer Pink,"₦ 11,442"
Note9s Redmy S Note Notes Smart Xiaomi Case Note9 Case Cover 9s Redmi Readmi For Mirror 9s Flip S Xiomi Coque S9 9 Note Xaomi,"₦ 16,553"
1 Set Hand Heater 2-in-1 Winter Outdoor Sports Hand Warmer Pink,"₦ 19,098"
For Pencil 2 1st 2nd Case Pencil Case Tablet Touch,"₦ 13,460"
12Pcs/Lot 7.5cm X 4.5m Self Adhesive Elastic Nonwoven Cohesive Bandage Adherent Wrap,"₦ 24,411"
