Item,Price
Ladies Sexy Cross Strap High Heels Black,"₦ 15,500"
Ladies Sexy Cross Strap High Heels Female Party Dress Shoes-Black,"₦ 6,999"
Women Fashion Sandals,"₦ 5,999"
High Heel Platform/open Heal - Nude,"₦ 10,000"
Women's High Heels - Black,"₦ 7,727"
Platform Open High Heel - White,"₦ 10,000"
Ladies Pointed Stiletto High Heel Sandals - Black,"₦ 13,200"
Ladies/women High Quality Sexy Mid Heels Black Multi Sandals,"₦ 6,500"
Ladies Pointed Pearl High Heel Slippers-White,"₦ 19,160"
High Heel Platform/open Heal - Black,"₦ 10,000"
Women High Quality Glass Heel Sandals/ Shoes,"₦ 8,999"
Black Women's 2022 New Pointed Satin Stilettos Heel Height 6cm,"₦ 7,660"
Classic Ladies Shoe,"₦ 15,500 - ₦ 16,500"
Ladies Fashion Chunky Heel Mesh Work Shoes-Black,"₦ 19,436"
"Women's Shoes, High Heels, Thin Shoes, 5CM Joker Fashion (black)","₦ 7,488"
Ladies Trendy High Heel Slippers - Black,"₦ 11,000"
Black Beautiful Sassy  Heels,"₦ 18,000"
Ladies Sandals Fashion Mid Heel Rhinestone Slippers - White,"₦ 14,600"
Women's High Heels Fashion Platform High Heel Sandals - Khaki,"₦ 16,286"
Ladies Sexy High Heels Female Party Sandal Shoes-multicolour,"₦ 18,000"
Women's Fashion Mesh Single Shoe (5cm) - Black,"₦ 15,779"
High Heel Platform/open Heal - White,"₦ 10,000"
Ladies High Heels - Black,"₦ 10,700"
Ladies Mesh High Heel Slippers - Black,"₦ 18,700"
Ladies Fashion Thick Heel Sandals And Slippers-Gold,"₦ 14,116 - ₦ 14,860"
Shoes Martin Boot Women Heels British Style Short Boots Ladies Shoes High-heeled,"₦ 6,999"
Female Sneakers Canvas - Ladies Shoe - High Heel Shoes,"₦ 4,999"
Ladies High Heels Slippers - Silver,"₦ 11,700"
Ladies Fashion Pointed High Heels (8cm)-Yellow,"₦ 18,200"
Gold Embellished Satin Pointed Slingback Heels,"₦ 9,900"
Peep Toe Chunky Sandals Platform Shoes Summer High Heels Pumps Sandals-BLACK,"₦ 15,899 - ₦ 16,899"
