Item,Price
Short-sleeved Pregnant Women In Summer Dress Large Size T,"₦ 13,900"
2021 Middle-aged And Elderly Large Size Mothers Wear Dres,"₦ 13,900"
Middle-aged And Elderly Mothers Wear New Fashion Cheongsa,"₦ 13,900"
Girls Women Kids Ice Skating   Stretch Glove Black Flower   S,"₦ 3,325"
120cm Children's Wear 2018 Summer New Girls Short-sleeved Dress In The Big Children Retro Ethnic Wind Graffiti Skirt Wholesale Color 120cm,"₦ 11,690"
Small Suit Dress Two-piece Spring Woman 2021 New Korean V,"₦ 13,900"
单件/套装2021夏季套装新款中长款长袖连衣裙风衣外套女两件套,"₦ 13,900"
120cm Children's Wear I 2018 Summer New Girls Short-sleeved,"₦ 11,504"
Parents And Children Wear Mother And Woman Dress Summer F,"₦ 29,990"
1pcs Fashion Pullover EVA Waterproof Child Raincoat Outdoor,"₦ 2,984 - ₦ 3,521"
Case For IPad 10.2 2020'' Clear Silicone With Airbag Back,"₦ 17,460"
2021 New Chinese Style Embroidered Noble Wife Flag Robe S,"₦ 29,990"
2021 New Summer Dress For Middle-aged And Elderly Mothers,"₦ 13,900"
"80-130 Jin Club Sexy Buttocks, Lace, Slim Dress, Low Ches","₦ 13,900"
Sister A's Couple Wear Summer Clothes And Design Love Sho,"₦ 13,900"
"Autumn And Winter Dress, Korean Version Of Shredded Flowe","₦ 13,900"
Swimsuit Woman's New Concatenated Skirt Belly Cover Shows,"₦ 13,900"
Genuine Spring And Autumn Short Coat Network Celebrity Go,"₦ 29,990"
Girls Women Kids Ice Skating  Magic Stretch Glove Black    S,"₦ 2,537"
Korean Version Loose Fat Big Size Fat Mm Wear Home Dress,"₦ 13,900"
Mother Wears Flag Robe Skirt Noble Atmosphere 2021 New Br,"₦ 13,900"
Large Size Women's Summer Dress 2021 New Foreign Gas Suit,"₦ 13,900"
Summer Dress Summer 2020 New Korean Version Of Broken Flo,"₦ 13,900"
Autumn Dress Woman Korean Version Solid Color Body Appear,"₦ 13,900"
Single / Suit Broken Chiffon Dress Woman Two-piece Set 20,"₦ 13,900"
"Different Couples Wear Summer Suits, Small Designs, 2021","₦ 13,900"
French Couple Wear Minority Design Summer Dress A Korean,"₦ 13,900"
Simple Floral Maxi Gown For Women,"₦ 6,999 - ₦ 7,500"
Rich Wife Lace Dress Woman 2021 Summer New Korean Version,"₦ 13,900"
Mother Wears Flag Robe Skirt Noble Atmosphere 2020 New Br,"₦ 13,900"
120cm Children's Wear R 2018 Summer New Girls Short-sleeved,"₦ 11,504"
New Cotton Silk Dress Short Sleeved Bohemian Skirt Beach,"₦ 29,990"
Big Size Woman Fat Mm New Fat Sister Summer Dress Korean,"₦ 13,900"
T-shirt Woman 2020 New Loose Summer Dress White T-shirt W,"₦ 13,900"
Zipper Fit And Flare Dress,"₦ 13,900"
Swimming Dress Woman Conservative Concatenated Skirt Long,"₦ 13,900"
120cm Children's Wear Q 2018 Summer New Girls Short-sleeved,"₦ 12,954"
