Item,Price
Kids/Children Tricycle (Age 1-4),"₦ 25,000"
Unisex Luxury Children/Kids Automatic Power Bike 1-5Yrs,"₦ 54,000"
Kids/Children Bicycle (Age 7-14years),"₦ 65,000"
Affordable Tricycle For Kids (Age 1-4),"₦ 24,999"
Unisex Luxuryy Dap Children/Kids Tricycle For Age 3-6,"₦ 36,999"
Unisex Luxury Children/Kids Automatic Power Bike 1-4Yrs,"₦ 65,000"
Unisex Modern Kids Tricycle 1-7Yrs,"₦ 35,500"
Unisex Kids Children Colorful Bicycle (2-5 Years) 12 Inches,"₦ 49,500"
Unisex Durable Kids Power Bike (Age 2-6years) +Free Gift,"₦ 92,000"
Paw Patrol Pedaless Bicycle For Kids AGE 3-8years,"₦ 10,000"
Children Kids Tricycle,"₦ 37,000"
Evergreen Children Tricycle (Age 1-4),"₦ 24,999"
Unisex Durable Kids Tricycle (Age 2-5years) + Free Jotter,"₦ 78,000"
Unisex Children  Kids Bicycle With Free Helmet  (2-5 Years) 12 Inches,"₦ 49,999"
Unisex Children Kids Blings Tricycle,"₦ 35,599"
Dream Girl Tricycle,"₦ 37,500"
Unisex Durable Kids Power Bike (Age 3-6years),"₦ 110,000"
Kids/Children Tricycle With Carrier (Age 1-5),"₦ 35,000"
Unisex Luxury Children/Kids Automatic Power Bike.. 2yrs To 4yrs.,"₦ 65,000 - ₦ 120,000"
Evergreen Modern Tricycle,"₦ 33,700"
Evergreen Modern Kids Tricycle 2,"₦ 35,000"
Evergreen Modern Kids Tricycle,"₦ 35,000"
Unisex Kids/Children Bicycle (Age 5-9years),"₦ 59,999"
Evergreen Kids Tricycle With Back Rest,"₦ 35,000"
Unisex Dapper Kids Tricycle With Lights,"₦ 37,500"
Unisex Kids Bicycle (2-5 Years) 12 Inches,"₦ 49,500"
Great Vision Tricycle,"₦ 35,000"
Unisex Luxuryy  Children/Kids Tricycle For Age 3-6,"₦ 37,000"
Light Musical Kids Tricycle,"₦ 35,000"
