Item,Price
Women's Casual Leather Slip On Outdoor Flat Loafers Comfort Antiskid Shoes,"₦ 9,500"
2022 Casual Shoes - Sneakers - Black,"₦ 4,999"
Women's Lace-up Work Business Leather Shoes-black,"₦ 19,500"
Black Women Flat Shoe,"₦ 12,000"
Women Casual Shoes Leather Shoes Ladies Flat Shoes,"₦ 31,990"
1551-16 Braided Women Low Heeled  Slides Ladies Flip Flops Female Flat Slippers,"₦ 14,475"
New Female Sneakers Canvas - Black,"₦ 4,999"
Women's Soft Casual Leather Shoes Lady Flats - Black,"₦ 28,949"
New Female Ladies Flat Women Shoe - Black,"₦ 7,000"
Women's Flat Shoes Fashion Cross Strap Soft Shoes,"₦ 29,868"
Female Sneakers Canvas - Women's Casual - Black,"₦ 4,999"
Catherine H Stoned Fashion Sneakers - Black,"₦ 7,000"
Animal Print Lace Up Sneakers,"₦ 7,000"
Leather Shoes Women Korean Fashion Loafers Flat Oxford Shoes Size 35-41 Moccasins,"₦ 25,961"
Leather Shoes For Women Heighten Loafers Casual Platform Shoes,"₦ 26,999"
Women's Flat Shoes AALP Cross Strap Soft Shoes,"₦ 26,108"
Women Soft Shoes Work Woman Hollowed Ladies Student Travel,"₦ 33,480"
Catherine H Stoned Flat Lady's Shoe - Grey,"₦ 8,000"
Cloth Shoes Casual Work Shoes Work Shoes-Black,"₦ 7,540"
"JAVING METALLIC CONTRAST SNEAKERS,WHITE,SILVER","₦ 27,461"
Ladies Business Work Casual Leather Shoes,"₦ 16,927"
Women's High Heel Shoes - Women Flat Shoe - Canvas,"₦ 4,999"
