Item,Price
Business Dress Shoes For Young Men England White Round Head Leisure Shoes,"₦ 9,870"
Black Plain Leather Lace Up Shoes,"₦ 15,900 - ₦ 17,900"
Fasfion Men's Business Pointed Shiny Shoes -Black,"₦ 6,555"
Business Dress Shoes For Young Men England Black Round Head Leisure Shoes,"₦ 13,150"
Mens Dress Shoes Formal Business Leather Shoes Men Office Shoes,"₦ 29,100 - ₦ 30,900"
Men's Black Fashion Sneakers - Lace Up,"₦ 5,999"
2023 Men Casual Sneakers Breathable Sport Running Shoes- Yellow,"₦ 6,500"
Men's  Black Patent Leather Smooth Pointed Shoe,"₦ 15,700 - ₦ 17,900"
Black Leather Monkstrap  2Lshoes,"₦ 17,900"
Clarks Classy Corporate Men's Shoe - Black,"₦ 40,000"
Brown Classy Corporate Shoe,"₦ 15,900 - ₦ 17,900"
Formal Shoes For Men Suede Leather Shoes Business Wedding Footwear,"₦ 27,200"
Brown Leather Class Mix Shoes,"₦ 15,800 - ₦ 17,900"
Flangesio High Quality Italian Men Soft Leather Shoes Fashion Black Lace Up Wedding Office Dress Formal Shoes,"₦ 30,800"
New ABB Black Patent Lace Shoes,"₦ 15,900"
Men's Italian Plus Size Smooth Leather Shoes Brown,"₦ 32,016"
Varrati Men's Patent Leather Smooth Pointed Shoe With Lace - Black,"₦ 8,299 - ₦ 8,500"
Brown Suede Classy Corporate Shoes,"₦ 16,900 - ₦ 17,900"
Men's Italian Plus Size Smooth Leather Shoes Black,"₦ 30,255"
Elegant Men Corporate Leather Shoe-Black,"₦ 9,980"
Male Shoes Formal Shoes Leather Office Shoes Oxford Business Shoes Lace Up,"₦ 33,900"
VOSTEY Men Formal Shoe Brown,"₦ 8,900 - ₦ 9,999"
Mens Formal Shoes Lace Up Brogue Leather Shoe Big Size-Black,"₦ 26,900 - ₦ 29,400"
Camel Men's Shoes Men's Business Leather Shoes Plus Size 37-47,"₦ 24,800"
Men Luxury Loafers - Party Shoes - Black,"₦ 5,999"
Clarks Executive   Cooperate Shoe,"₦ 45,000"
Clarks Clark   Brogue Lace,"₦ 45,000"
New Simple Black Leather Corporate Shoes,"₦ 15,800"
Clarks Wet Look Clarks Shoe,"₦ 45,000"
Men Corporate Walking Casual Shoe-Brown,"₦ 9,999"
XCST-BNZHO Men Shoes Top Quality Oxfords British Style Men Leather Dress Shoes Business Formal Shoes Men Flats Brown,"₦ 30,800"
Classic Black Office Shoes,"₦ 15,900 - ₦ 17,900"
Zriang Men Laceup Brogues In Brown,"₦ 13,500"
Clarks Exotic Men's Corporate Shoe - Brown,"₦ 40,000"
Varrati Patent Tuxedo Dress Shoes In Black,"₦ 8,500"
