Item,Price
Stretch Fast Drying Breathable Gym Shorts,"₦ 6,773"
Men's Fitness Fast Dry Breathable Athletic Shorts,"₦ 6,718"
Quick Drying Double Breathable Gym Shorts For Men,"₦ 9,055"
Byc Premium Round-Neck Vest White,"₦ 11,999 - ₦ 12,999"
Men's Quick Dry Ice Silk Cool Round Neck T-shirt,"₦ 5,000"
Men's Running Breathable Sports T-shirt,"₦ 6,236"
Men's Mesh Quick Dry Casual Sport T-shirt,"₦ 6,236"
Casual Athletic Breathable Athletic Shorts,"₦ 12,682"
Men's Sports Suit 2 Pieces (short Sleeves + Shorts),"₦ 12,864"
Sports 5-piece Set(coat+short Sleeves+long Sleeves+shorts+pants),"₦ 34,318"
Men's Sport Suit 2 Piece (short Sleeve + Long Pants),"₦ 12,373"
Men's Sport Suit 2 Piece (long Sleeve Jacket + Trousers),"₦ 16,836"
