Item,Price
Men's Quick Dry Ice Silk Cool Round Neck T-shirt,"₦ 5,000"
Men's Hawaii Beach Personality Short Sleeve Shirt,"₦ 6,955"
Fashionable Men Fashion Casual Printed Short Sleeve T-shirt,"₦ 5,364"
Men's Casual Fashion Plaid Long Sleeve Shirt,"₦ 7,400"
2 In 1 Stylish Men's Suit (short Sleeve + Shorts),"₦ 11,509"
3 In 1 Fashionable Men Fashion Casual Printed Short Sleeve T-shirts 3,"₦ 12,109"
Stylish Men's Casual And Stylish Short Sleeved Shirt With Standing Neck,"₦ 7,318"
4 In 1 Fashionable Men's Short Sleeve T-shirt (Red-black-Grey-Green),"₦ 13,555"
Men's Sports Casual Short Sleeved T-shirt - White,"₦ 4,091"
Men's Athleisure Sleeveless Hooded Short Sleeve,"₦ 9,345"
Stretch Fast Drying Breathable Gym Shorts,"₦ 5,391"
Men's Sport Suit 2 Piece (short Sleeve + Long Pants),"₦ 12,373"
Sports 5-piece Set(coat+short Sleeves+long Sleeves+shorts+pants),"₦ 34,318"
Casual Athletic Breathable Athletic Shorts,"₦ 7,918"
Rubber Pad-Breathable Athletic Shorts For Cycling,"₦ 6,364"
Men's Fitness Fast Dry Breathable Athletic Shorts,"₦ 6,718"
Men's Sports Suit 2 Pieces (short Sleeves + Shorts),"₦ 12,864"
Men's Sports Suit 2 Pieces (tank Top + Shorts),"₦ 10,345"
Men's Sport Suit 2 Piece (long Sleeve Jacket + Trousers),"₦ 16,836"
Small Leg Shorts For Outdoor Recreational Sports,"₦ 9,609"
Quick Drying Double Breathable Gym Shorts For Men,"₦ 8,082"
Men's Speed-dry Basketball T-shirt,"₦ 6,336"
