Item,Price
Men's Sport Suit 3 Piece (long Sleeve Top + Shorts + Trousers),"₦ 20,509"
Men's Sports Suit 2 Pieces (tank Top + Shorts),"₦ 10,345"
Irvine Men's Trovita Windproof Jacket,"₦ 142,138"
Men's Sport Quick Dry High Stretch T-shirt,"₦ 6,800"
Men's High Stretch Breathable Long Sleeve T-shirt,"₦ 7,336"
Irvine Men's Horny Jersey Top UHFMJT104,"₦ 71,069"
YKYWBIKE Pro Cool Universal Cycling Base Layer Bike Short Sl,"₦ 34,433"
Irvine Men's Ravenna Jersey Top UHFMJT103,"₦ 71,069"
YKYWBIKE Cycling Jersey Vest Men Summer Slim Breathable Slee,"₦ 37,272"
Irvine Men's Vetrina Jersey Top UHFMJT102,"₦ 71,069"
YKYWBIKE Cycling Jersey Men's Summer Slim Short Sleeve Cycli,"₦ 53,453"
WOSAWE Bike Bicycle Brushed Windproof Suspenders Pants Jacke,"₦ 76,597"
YKYWBIKE Cycling Jersey Mens MTB Mountain Bike Clothing Quic,"₦ 56,977"
Iris Padded Jacket For Men In Irvine,"₦ 91,374"
YKYWBIKE Men's Cycling Jersey Short Sleeve MTB Bike Shirt Do,"₦ 49,566"
High Visibility Safety Vest Neon 3 Sizes 2 Colors Available,"₦ 28,643"
Irvine Men's Carver Short Sleeve Jersey Top,"₦ 66,557"
Cycling Top And Bottom Set,"₦ 60,743"
NEENCA Men's 3D Padded Cycling Underwear Shorts - Bike Under,"₦ 35,960"
Men's Lip Protection Padded Vest Compression Shirt Training,"₦ 33,572"
Men's Speed-dry Basketball T-shirt,"₦ 6,336"
Cycling Jersey Bike Shirt Bicycle Jacket Motocross Road Ride,"₦ 30,267"
[Siyo] Men's Cycling Jersey Pantalong Pants Outdoor Fishing,"₦ 44,719"
Make It Cycling Clothing TREK Cycling Wear Top And Bottom Se,"₦ 33,895"
NEENCA Cycling Jersey 3D Brushed Knit Padded Pants Cycling C,"₦ 30,754"
NEENCA Cycling Jersey 3D Raised Knit Padded Pants Cycling Cr,"₦ 34,849"
Irvine Men's Darby Padded Jacket,"₦ 142,138"
THE WAROOM SHOP Cycling 3D Padded Shorts Bike Cycling Underw,"₦ 28,434"
NSR Men's Nexus Long Sleeve Bike Jersey,"₦ 72,761"
WOSAWE MTB Bike Windproof Windshield Road Brushed Jacket Coa,"₦ 50,903"
Irvine Men's Roslyn Jersey Top UHFMJT101,"₦ 67,685"
NSR Men's Step Up Part 7 Bike Tights 2.0,"₦ 111,680"
