Item,Price
Traditional Unique Igbo Cap,"₦ 8,500"
Unisex Fashionable And  Comfy Beanie Head Warmer,"₦ 2,999"
Unisex Stylish Black And White Beanie Head Warmer,"₦ 4,999"
Embroidered Letters Baseball Cap Visor Sports Cap Men's Fashion Cap,"₦ 4,500"
Outdoor Sports Skull Face Mask Scarf Bandana Motorcycle Balaclava,"₦ 1,632"
Women Egyptian Beaded Headdress Cleopatra Fancy Dress Costume Hair,"₦ 11,500"
Balaclava Neck Gaiter Face Cover Sun Shield Hood Bandana,"₦ 2,187"
Winter Fleece Half Face Windproof Cover With Warm Earmuffs For Outdoor,"₦ 2,492"
3 In 1 Unisex Fashionable And  Comfy Beanie Head Warmer,"₦ 6,999"
Cycling Mask Motorcycle Bicycle Half Facemask Dust Pollution Red,₦ 896
Gold Leaf Roman Greek Goddess Toga Laurel Wreath Fancy Dress Gold,"₦ 1,700"
Christmas Hat Santa Claus Hat Adults Christmas Hat  Green,"₦ 4,874"
Men Seamless Face Mask Bandana Headband For Dust Outdoors,"₦ 4,580"
Chinese  Oriental   With Ponytail Child Cosplay Hat Red,"₦ 3,257"
Funny  Hat Ear Moving Jumping Bear Hat Cute  Flap,"₦ 9,562"
3 In 1 Unisex Stylish Beanie Head Warmer,"₦ 6,999"
Head Warmer Beanie- Wine,"₦ 2,999"
Cycling Mask Motorcycle Bicycle Half Facemask Dust Pollution Black,"₦ 3,366"
Face Mask Sun Shield Hood Neck Gaiter Balaclava Bandana Purple Purple,"₦ 2,225"
Face Mask Sun Shield Hood Neck Gaiter Balaclava Bandana Pink Pink,"₦ 1,863"
Sun Protection Hiking Face Cover Breathable Scarf Silver,"₦ 14,800"
Face Mask Outdoor Hunting Protective Full Face Masks Black,"₦ 23,327"
Full Face Mask Neck Hood Hat Scarf Sun UV Protection Ski Jungle Color,"₦ 4,322"
"Bunny Ears Hat Hooded,  , Funny Props,  21.65x11.02inch Light Brown","₦ 8,006"
Royal Velvet Studded Red Hats,"₦ 31,999"
Sun Protection Hiking Face Cover Breathable Scarf Red,"₦ 15,200"
Anti-mosquito Insect Bug Head Face Net Mesh Face Protection,₦ 963
Full Face Mask Neck Hood Hat Scarf Sun UV Protection Ski Outdoor 01,"₦ 4,322"
Royal Velvet Exquisite Studded Hats,"₦ 31,999"
Ancient Chinese Oriental   With Ponytail For Kid Boy Party Yellow+Red,"₦ 3,150"
Unisex Beanie Head Warmer- Lemon,"₦ 3,500"
2 Pieces 3-Hole Balaclava Knit Knitted Full Face Ski Cover Mask Beanie,"₦ 28,000"
