Item,Price
Men's Elegant Designed Custom Sweatshirt - Black & White,"₦ 5,248"
Plain V-Neck Black Shirt,"₦ 2,500 - ₦ 3,500"
Men's Polo With Simple And Classy Designs,"₦ 5,499"
3in1 Plain White Round Neck,"₦ 7,000"
PK-BACK DESIGN BLACK Polo T Shirt Round Neck MEN/Women,"₦ 4,500"
WALK ALONE Round Neck Tee- White,"₦ 4,999"
Men's Short Sleeve Polo Shirt,"₦ 4,900"
New Mens Short Sleeve T-Shirt High-Quality Business Lapel Polo Shirt M-5XL Black,"₦ 16,200 - ₦ 17,200"
Set Of Four Classy Boss Men  Polo Shirts Button And Collar,"₦ 9,922"
"3PCS Polo T-shirt Breathable Short Sleeve - Navy, Blue, Green","₦ 13,900"
4 Polo(PK KING-PK FLOWER-CINQ LINES -HAPPY)T Shirt Round Neck MEN/Women,"₦ 14,999"
4 BACKWOODS ROUNDNECK Polo T Shirt RoundNeck MEN/Women-White Black Orange Cream,"₦ 13,999"
Five High Quality Plain Cotton Polo - Multicolour,"₦ 9,900"
Short Sleeve Round Neck Plain Shirt -White,"₦ 1,500"
（Black+White）=6499 100% Cotton 2 Pieces Men's Polo Solid Color B T-shirt Shirts,"₦ 12,635"
Men's Cotton Casual Short-sleeved T-shirt POLO Shirt -Red,"₦ 4,500"
Mens Polos Shirts Casual Tshirt,"₦ 4,800"
Men's Cotton Casual Short Sleeved T-shirt Polo Shirt - Black,"₦ 4,800"
Ifit Wears Men' Royalty Sprinter Golf Polo 5 In 1,"₦ 20,449 - ₦ 20,499"
Men's Polo Shirt Cotton Short Sleeve Shirt Stand Collar,"₦ 4,767"
Defacto Man Knitted Regular Fit Polo Neck Short Sleeve Polo T-Shirt -Purple,"₦ 5,320"
Distinct Design Golf Polo T-shirt,"₦ 9,499 - ₦ 9,899"
"4 In1 Men's Quality Plain T-shirts Button With Collar Fit Polo Black,grey,red And Royal Blue","₦ 8,960 - ₦ 8,999"
Mens Formal Shirts Casual Short Sleeved T-shirt Polos - White,"₦ 4,727"
Men Regular Fit Knitted Polo T-Shirt - White,"₦ 4,455"
3 Pieces Quality Men's Plain T-Shirts-Grey/Navy/Black,"₦ 6,800"
Mens High Quality Pure Cotton Shirt For Men Black,"₦ 5,999"
Defacto Man Knitted Regular Fit Polo T-Shirt -Black,"₦ 4,579"
Defacto Man Knitted Regular Fit Polo Neck Short Sleeve Polo T-Shirt -Blue,"₦ 5,997"
Seven Pieces Quality Men's T-Shirts Combo,"₦ 12,999"
DRIPPING SMILEY White Polo T Shirt Round Neck MEN/Women,"₦ 4,999"
Defacto Man Knitted Regular Fit Polo Neck Short Sleeve Polo T-Shirt -Yellow,"₦ 5,724"
2 Love Sym-Black White Polo T Shirt Round Neck MEN/Women,"₦ 7,500"
Men's POLO Shirt Casual T-Shirt Top - Pink,"₦ 4,765"
Defacto Man Knitted Regular Fit Polo Neck Short Sleeve Polo T-Shirt -Orange,"₦ 7,200"
Defacto Man Knitted Regular Fit Polo T-Shirt -Green,"₦ 7,496"
Unique Design Men's Polo T-shirts 3pcs,"₦ 13,299 - ₦ 13,499"
Mens Classy Designer's Polo Culture Or Nothing Unisex Shirts,"₦ 4,300 - ₦ 4,390"
Defacto Man Knitted Slim Fit Polo Neck Short Sleeve Polo T-Shirt -Green,"₦ 6,080"
Men's Short Polo-navy,"₦ 5,500"
Defacto Man Knitted Slim Fit Polo Neck Short Sleeve Polo T-Shirt -indigo,"₦ 6,080"
Defacto Man Knitted Regular Fit Polo Neck Short Sleeve Polo T-Shirt -Green,"₦ 5,724"
Stay Focus Pink Polo T Shirt Round Neck MEN/Women,"₦ 4,999"
Sequels Collection Black Long Sleeve Sweatshirt,"₦ 4,800 - ₦ 5,000"
