Item,Price
Casual Sweater Set Men's Long Sleeve Sweatshirt + Trousers,"₦ 8,311"
Defacto Man Knitted Oversize Fit Crew Neck Long Sleeve Sweatshirt -indigo,"₦ 4,800"
Defacto Man Regular Fit Hooded Knitted Sweat Shirt - Beige,"₦ 5,838"
Casual Round Neck Sweatshirt Men's Long Sleeve Top,"₦ 4,778"
Defacto Man - Zip-Up Turtle Neck Slim Fit Knitted Sweat Shirt-Black,"₦ 5,600"
Defacto Man Knitted Regular Fit Sweatshirt -Anthracite,"₦ 3,328"
Defacto Man Knitted Regular Fit Sweatshirt -Bordeaux,"₦ 6,400"
Defacto Man Oversize Fit Knitted Sweat Shirt -Anthracite,"₦ 7,200"
Danami Plain V Neck Sweatshirt- Black,"₦ 5,999"
"Valnaya Tshirt, Shorts And Joggers Set","₦ 18,000"
Defacto Man Regular Fit Knitted Sweat Shirt -Brown,"₦ 6,400"
Defacto Man Regular Fit Shawl Neck Long Sleeve Knitted Sweat Shirt -Beige,"₦ 5,663"
Danami Plain V Neck Sweatshirt- Dark Grey,"₦ 5,999"
Defacto Man Oversize Fit Crew Neck Long Sleeve Knitted Sweat Shirt -Black,"₦ 6,402"
Defacto Man Regular Fit Knitted Sweat Shirt -Turquoise,"₦ 6,400"
Defacto Man Oversize Fit Knitted Sweat Shirt -Black,"₦ 7,200"
Danami Plain V Neck Sweatshirt- Light Grey,"₦ 5,999"
Defacto Man Regular Fit Knitted Sweat Shirt -Blue,"₦ 6,472"
New Urban Red Bumper Jacket,"₦ 9,000"
Defacto Man Oversize Fit Knitted Sweat Shirt -Brown,"₦ 7,200"
Valnaya 4 In 1 Valnaya Joggers Set,"₦ 33,000 - ₦ 34,000"
Danami Plain V Neck Sweatshirt- Navy Blue,"₦ 5,999"
Defacto Man Regular Fit Shawl Neck Long Sleeve Knitted Sweat Shirt -Grey,"₦ 5,663"
Danami Plain Customisable Sweatshirt- Navy Blue,"₦ 5,999"
Defacto Man Regular Fit Knitted Sweat Shirt -Anthracite,"₦ 6,400"
Defacto Man Oversize Fit Knitted Sweat Shirt -Khaki,"₦ 7,200"
Defacto Man Knitted Regular Fit Sweatshirt -Black,"₦ 3,328"
Defacto Man Regular Fit Shawl Neck Long Sleeve Knitted Sweat Shirt -Black,"₦ 5,663"
Defacto Man Knitted Oversize Fit Crew Neck Long Sleeve Sweatshirt -Khaki,"₦ 4,666"
Defacto Man Standart Fit Zip-Up Turtle Neck Knitted Sweat Shirt - Dark Green,"₦ 6,915"
Danami Long Sleeve Contrast T-Shirt With Button - Wine & Dark Grey,"₦ 4,999"
Danami Long Sleeve Contrast Designed Sweatshirt- White & Navy Blue,"₦ 5,999"
Danami Plain Customisable Sweatshirt- Black,"₦ 5,999"
Danami Long Sleeve Contrast Designed Sweatshirt- Off-White & Wine,"₦ 5,999"
Plain V Neck Sweatshirt For Men And Women- Black,"₦ 4,999"
Defacto Man Knitted Oversize Fit Crew Neck Long Sleeve Sweatshirt -Beige,"₦ 4,666"
