Item,Price
Hockey/Inline Skate Shoes Plastic Display Rack Stand For Store Window,"₦ 2,807"
2x Diving Swimming Beach Shoes - Size 36-47 - Socks 43,"₦ 8,790"
Adult Water Shoes Barefoot Stripe Skin Socks Quick Dry  Beach Sport 38,"₦ 9,815"
Soft Water Shoes Stretchy Aqua Socks Yoga Swim Shoe Dive Sock Green XS,"₦ 1,046"
Soft Water Shoes Stretchy Aqua Socks Yoga Swim Shoe Dive Sock Pink L,"₦ 2,251"
Soft Water Shoes Stretchy Aqua Socks Yoga Swim Shoe Dive Sock Green L,"₦ 2,127"
Inline Skate Shoes Rack For Store Window Show/Sample Display And,"₦ 3,142"
Women Men Water Sport Shoes Diving Wetsuit Non-slip Swim Beach Aqua,"₦ 6,558 - ₦ 7,665"
Water Shoes Quick-Dry  Socks Dancing Yoga Barefoot Shoe  Red M,"₦ 3,104"
Diving Water Sports Shoes Wetsuit Non-slip Swim Yoga Practice  43,"₦ 2,840"
1 Pair Black Rubber Roller Road Drift Inline Skates Plate Edge Guard,"₦ 1,963"
Womens And Mens Water Shoes Quick-Dry  Socks  - Lightweight Comfort 47,"₦ 3,282"
Soft Water Shoes Stretchy   Socks Yoga Swim Shoe Dive Sock Green XS,"₦ 2,966"
1.5mm Water Sports Neoprene Snorkel Surfing Diving Wetsuit XL Blue,"₦ 30,300"
Men's Swimwear Bikini Swimming Briefs Pad Swimsuits Board Surf M,"₦ 6,220"
Soft Water Shoes Stretchy Aqua Socks Yoga Swim Shoe Dive  Red M,"₦ 1,569"
Diving Beach Shoes Barefoot Skin Socks Quick Dry Yoga Exercise 43,"₦ 2,840"
Unisex Barefoot Water Skin Shoes  Beach Swim Surf Yoga Exercise 41,"₦ 3,415"
Adult Youth Water Sports Shoes Quick Dry  Beach Swim Barefoot Skin 43,"₦ 2,840"
Lovoski 2pcs 184mm Lightweight Aluminum Alloy Longboard Black,"₦ 40,211"
Unisex 2.5mm Neoprene Wetsuit Top For Scuba Diving Snorkel Surf M,"₦ 57,054"
Soft Water Shoes Stretchy   Socks Yoga Swim Shoe Dive Sock  Red M,"₦ 3,231"
Unisex Barefoot Water Skin Shoes  Beach Swim Surf Yoga Exercise 47,"₦ 3,282"
Unisex Swimming Water Sports Shoes Non-slip Yoga Dancing Practice 47,"₦ 3,282"
Skin Water Shoes  Beach Socks Yoga Exercise Swim Unisex Barefoot 41,"₦ 2,878"
Soft Water Shoes Stretchy Aqua Socks Yoga Swim Shoe Dive  Blue XS,"₦ 3,477"
Surf Beach Sports Water Shoes Barefoot  Outdoor Wetsuit Yoga Gym 47,"₦ 3,282"
Lightweight Water Shoes Quick-Dry Beach  Socks Diving Ankle Green L,"₦ 3,518"
Soft Water Shoes Stretchy  Socks Yoga Swim Shoe Dive  Blue XS,"₦ 2,550"
Men Women Water Shoes Aqua Yoga Sock Exercise Pool Beach Dance Shoe,"₦ 6,595 - ₦ 9,953"
Water Sports Beach Shoes Swim Diving Barefoot Quick-Dry  Yoga Socks 43,"₦ 2,840"
Unisex 2.5mm Neoprene Wetsuit Top For Scuba Diving Snorkel Surf S,"₦ 56,774"
Fashion Low-rise Swimming Briefs Pure Color Bikini Waterproof L,"₦ 5,875"
184mm /  7 . 25 ''  Ultra - Light   Durable   Aluminum   Alloy   Black,"₦ 33,157"
1.5mm Water Sports Neoprene Snorkel Surfing Diving Wetsuit XL Black,"₦ 32,380"
Water Shoes Quick-Dry  Socks Dancing Yoga Barefoot Shoe Dive Pink L,"₦ 3,104"
