Item,Price
Mens Gift Sets 7 In 1,"₦ 19,500"
Jesou Collection Men's Wrist Watch With Gift Set,"₦ 19,500"
Men Male Plain  Underwear Soft Cotton S Shorts Mesh Bulge L Green,"₦ 1,444"
Unisex Fashion Velvet Bandana Hat Durag Long Tail Headwear Chemo Gray,"₦ 1,348"
Boyseen Anti-blue Myopia Glasses 6010,"₦ 2,550"
4pcs Women Mens Elegant Velvet Bandana Hat Durag Muslim Headwear Chemo,"₦ 4,671"
3x Unisex Velvet Bandana Durag Headwear Silk Pirate Hat Wrap Hat,"₦ 4,198"
2x Shirt Stays Suspenders Leg Garters Djustable Elastic Holders Men A,"₦ 2,013"
Men Sleepwear Pajamas Set Nightwear Full Length Sleeve Fashion Gray,"₦ 6,898"
Set Of Classy Unisex Braided Leather  Bracelet,"₦ 2,995"
Men Underwear T-back G-string Thongs Jockstrap With Glittering Red,₦ 736
Men's 3D Cotton Shorts Denim Jeans   Briefs Underwear Casual L L Green,"₦ 1,146"
Men's Turban Chemo Durag Beanie Headscarf Beanie Skull Hat Sweat Black,"₦ 1,973"
Men's Velvet Bandana Hat Durag Long Tail Headwrap Beanie Chemo Black,"₦ 2,894"
Shiny  Silky Chemo Scarf Cap Musilim Hat Durag Headwrap Gold,"₦ 1,687"
3D Cotton Shorts Jeans Briefs Underwear 2XL Blue,"₦ 1,404"
Silky Scarf   Musilim Hat  Durag   Headwrap For Cancer Patient Black,"₦ 1,052"
Fashion Graffiti Bucket Hat Men Women Sun Hat Summer Bucket White,"₦ 1,600"
Watch / Chain / Bracelet ( Iced Out Luxury 3-In-1 Silver ),"₦ 14,000"
2x Shirt Stays Suspenders Leg Garters Adjustable Elastic Holders Men B,"₦ 4,708"
Summer Plain Baseball   Trucker Mesh Blank Curved Visor Hat White,"₦ 1,636"
Bright Soft Silky Chemo Scarf   Muslim Turban Hat Durag Headwrap Blue,"₦ 1,790"
Boyseen Anti-blue Myopia Glasses,"₦ 4,570"
Silky Scarf   Musilim Hat  Durag   Headwrap For Cancer Patient Silver,"₦ 1,051"
Traditional Unique Igbo Cap,"₦ 8,500"
Shiny  Silky Chemo Scarf   Musilim Hat Durag Headwrap Purple,"₦ 1,221"
Silky Scarf   Musilim Hat  Durag   Headwrap For Cancer Patient Blue,₦ 939
Retro Style Smart Casual Mens Solid Skinny Knit Tie For Groom Red,"₦ 1,386"
Phenovo 8 Panel Tweed Newsboy Baker Boy Flat Cap Golf Sunhat Grey,"₦ 1,981"
Luxury Men's Plain Woven Tie Necktie Solid Men Knitted Casual Black,"₦ 1,386"
Sexy Mens Soft Briefs Underwear Thongs Bulge Pouch Bikini G-string,₦ 667
Mens Fashion Knitted Solid Necktie Casual Narrow Skinny Navy Blue,"₦ 3,549"
Mens Bulge Pouch G-String  Thong Low Waist Briefs Nightwear,"₦ 2,000"
2 Pieces Winter Hot Neck Warmer Scarf Snood Unisex Mens Ladies Neck,"₦ 1,773"
Unisex Bandana Hat Silky Durag Long Tail Headwrap Biker Navy Blue,₦ 992
10pcs Mens White Handkerchiefs 100 Cotton Square Super Soft Washable,"₦ 3,889"
Tattoo Arm Sleeve -1 Piece,"₦ 3,999"
