Item,Price
Lucabuciolli Men’s Summer Hawaiian Short Sleeves Stripe Shirts,"₦ 10,000"
Lucabuciolli Men Ethnic Tribal Printed Bishop Neck Long Sleeves Shirt- Red,"₦ 8,000"
Men's Fashion Cotton Long Sleeve,"₦ 14,999"
Men's Hawaii Beach Personality Short Sleeve Shirt,"₦ 8,955"
Men Print African Print Dresses Rich Bazin Dashiki Long Sleeve Henleys T-shirt,"₦ 12,599"
Men's Solid Smiling Face Pattern Short Sleeve Shirt,"₦ 8,555"
Lucabuciolli Men Ethnic Tribal Printed Bishop Neck Long Sleeves Shirt- Green,"₦ 8,000"
Men's Casual Fashion Plaid Long Sleeve Shirt,"₦ 7,272"
Men's Breathable Cotton Long Sleeve Henleys Plain Stand Collar Slim Shirt - Blue,"₦ 19,999"
AFA Sports Men's Henley T-shirt - Green,"₦ 9,900"
Lucabuciolli New Men Abstract Colour Printed Long Sleeves Bishop Neck Shirts,"₦ 10,000"
Charmkpr Casual Long Sleeve Shirts Corduroy Colorblock Patchwork With Pockets,"₦ 25,000"
Lucabuciolli Men Casual Summer Linen Long Sleeves Shirts- Black,"₦ 8,000"
AFA Sports Bishop Collar Polo - Yellow,"₦ 12,500"
Lucabuciolli Men Casual Summer Linen Long Sleeves Shirts- Yellow,"₦ 8,000"
Mens Henley Long Sleeve Shirts Casual Fitted T-Shirt,"₦ 19,199"
Lucabuciolli Men’s Summer Hawaiian Beach Short Sleeves Shirts,"₦ 8,000"
Lucabuciolli Men’s Summer Hawaiian Beach Long Sleeves Shirts Flora Colour,"₦ 8,000"
AFA Sports Bishop Collar Polo - Blue,"₦ 12,500"
Men's Henley Shirt Long Sleeve Top Casual Slim Fit T Shirts,"₦ 19,099"
AFA Sports Bishop Collar Polo - Red,"₦ 12,500"
Lucabuciolli Men’s Leaves Print Hawaiian Beach Holiday Short Sleeves Shirts,"₦ 8,000"
Men's Summer Blue Stripe Short Sleeve Shirt,"₦ 9,155"
Lucabuciolli Men Casual Summer Linen Long Sleeves Shirts- Mint Green,"₦ 8,000"
Lucabuciolli Men Multi Colour Casual Long Sleeves Shirts,"₦ 8,000"
Lucabuciolli Men Casual Summer Linen Long Sleeves Shirts - White,"₦ 8,000"
Lucabuciolli Men Multi Colour Casual Long Sleeves Shirt,"₦ 10,000"
Lucabuciolli Men’s Summer Hawaiian Beach Long Sleeves Flower Pattern Shirts-Blue,"₦ 8,000"
Lucabuciolli Men Ethnic Tribal Printed Bishop Neck Short Sleeves Shirt- Green,"₦ 8,000"
Lucabuciolli Men Abstract Colour Printed Short Sleeves Bishop Neck Shirts,"₦ 8,000"
Men's Breathable Cotton Long Sleeve Henleys Plain Stand Collar Slim Shirt -White,"₦ 19,999"
Lucabuciolli Men Fashion Plaid Printed Colourful Shirts,"₦ 8,000"
