Item,Price
Defacto Man Swimming Short - Navy,"₦ 4,763"
Defacto Men Swimwear Nathan Swimming Short -Blue,"₦ 4,560"
Men Swimming Trunks With Cap Short Swimwear,"₦ 4,000"
Summer Beach Shorts Men's Swimming Pants,"₦ 21,120"
2 In 1 Men's Swimming Trunks-black,"₦ 24,130"
Man Beach Wear Short Pants Branded Boardshorts With Pockets,"₦ 25,000"
2 In 1 Men Beach Wear Print Sets - Multi-color,"₦ 19,000"
Sexy Men Swimming Trunks Swimwear Beach Shorts Boxers Underwear ( Yellow ),"₦ 20,067"
Men Casual Plaid Swimming Trunks Beach Shorts-Blue,"₦ 22,425"
