Item,Price
Heated Vest For Men Women 15-Zone Winter Electric Heating,"₦ 30,350"
Winter Warm USB Heating Jackets Smart Thermostat Pure Color Hooded - Black,"₦ 25,999"
Heated Underwear For Men And Women Winter Warm 20 Areas,"₦ 110,120"
Winter Warm USB Heating Jackets Smart Thermostat Pure Color Hooded - Red,"₦ 30,999"
Intelligent Heating Thermal Underwear Set 8-Zone USB,"₦ 74,410"
Winter Ultra Lightweight Packable Waterproof Down Jacket Coat Men's Jacket Grey,"₦ 33,800"
-30 Degree Down Parkas Snow Jacket Men Woman Winter White Duck Down - Black,"₦ 38,999"
Down Jacket Men Ultralight Camping Trekking Waterproof Winter Coat - Black,"₦ 20,999"
Packable Down Jacket Men Casual Light Coat Windproof White Duck Down Jacket,"₦ 33,800"
-30 Degree Down Parkas Snow Jacket Men Woman Winter White Duck Down - White,"₦ 38,999"
Winter Ultra Lightweight Packable Waterproof Down Jacket Coat Men's Jacket Blue,"₦ 33,800"
Winter Ultra Lightweight Packable Waterproof Down Jacket Coat Men's Jacket Black,"₦ 33,800"
Hooded Down Jacket Ultralight Camping Trekking Hiking Waterproof - Orange,"₦ 30,899"
Washable Heated Vest USB Cold-Proof Waistcoat Far Infrared,"₦ 24,910"
Down Jacket Men Ultralight Camping Trekking Waterproof Winter Coat - Wine,"₦ 20,999"
Hooded Down Jacket Ultralight Camping Trekking Hiking Waterproof - Wine,"₦ 30,899"
-30 Degree Down Parkas Snow Jacket Men Woman Winter White Duck Down - Red,"₦ 38,999"
Hooded Down Jacket Ultralight Camping Trekking Hiking Waterproof - Blue,"₦ 30,899"
Gradient Down Jackets Men Ultra Light 90% Duck Down Jackets Fashion Coat,"₦ 34,999"
