Item,Price
Active Blue And White Hoodie,"₦ 15,000"
"Valnaya 3 In 1 Ash Jackets, Sweatpants And Sweatshirts","₦ 20,000"
Active Dark Grey And White Hoodie,"₦ 9,000"
Men's Print Anime Hoodie Long Sleeve Top-red,"₦ 26,805 - ₦ 27,718"
Praaaaempire Light Grey With Black Hoodie And Sweatpants,"₦ 15,000"
Axmvp Men's Fashion Hooded Zipper Coat And Sweatpants Two Piece Sets Casual Jogging Tracksuit Sets,"₦ 10,800"
Men And Women Plain Quality Hoodie ,"₦ 10,490"
Clothes Hooded Long-sleeved Fitness Clothes,"₦ 9,000 - ₦ 12,000"
Men's Contrast PU Jumper - Black,"₦ 16,500"
Men's Print Anime Hoodie Long Sleeve Top-black,"₦ 24,141"
Fashionable Men Fashion Casual Solid Color Short Sleeve T-shirt,"₦ 5,945"
Men's Casual Hoodie Stitching Fashion Hoodie - Black,"₦ 16,691"
ALTINYILDIZ CLASSICS Multicolore FLEECE SWEATSHIRT EU XXL,"₦ 39,752"
Praaaaempire Red With Black Hoodie And Sweatpants,"₦ 15,000"
ALTINYILDIZ CLASSICS Dark Grey SWEATSHIRT EU XXL,"₦ 44,976"
Men's Casual Hoodie Stitching Fashion Hoodie - Green,"₦ 16,691"
Sports Hooded T-shirt Men's Sports Top Fitness Running Training Short-sleeved Ice Silk Elastic Quick-drying,"₦ 25,899"
Adult Hooded Sleeveless T-shirt Men's Color-blocking Sports Casual Quick-drying Fitness Running Vest,"₦ 25,899"
ALTINYILDIZ CLASSICS Brown SWEATSHIRT,"₦ 32,000"
Sports Sweater Men's Trendy Loose Casual Sweater Hooded Sports Top Half Zipper Sweater,"₦ 26,999"
ALTINYILDIZ CLASSICS Dark Blue SWEATSHIRT EU S,"₦ 21,072"
Adult Hooded Sleeveless T-shirt Men's Sports Casual Quick-drying Clothes Light Fitness Running Boxing Training Vest,"₦ 26,099"
ALTINYILDIZ CLASSICS Dark Blue SWEATSHIRT EU XL,"₦ 23,800"
ALTINYILDIZ CLASSICS Navy Blue SWEATSHIRT EU XL,"₦ 30,112"
Praaaaempire 2 In 1 Wrangler Hoodies,"₦ 15,000"
ALTINYILDIZ CLASSICS Black SWEATSHIRT EU XL,"₦ 30,112"
ALTINYILDIZ CLASSICS Black SWEATSHIRT,"₦ 30,480"
ALTINYILDIZ CLASSICS Grey FLEECE SWEATSHIRT EU XXL,"₦ 44,832"
ALTINYILDIZ CLASSICS Multicolore FLEECE SWEATSHIRT,"₦ 14,312"
ALTINYILDIZ CLASSICS Black FLEECE SWEATSHIRT EU XXL,"₦ 44,832"
Men's Slim Sports Quick-drying Clothes Running Basketball Elastic Training Clothes Hooded Long-sleeved Fitness Clothes,"₦ 27,199"
Active Kroks Grey And Black Hoodie,"₦ 9,500"
ALTINYILDIZ CLASSICS Brown SWEATSHIRT EU XL,"₦ 30,112"
Two In One Men's Casual Sports Suit,"₦ 32,289"
Fashionable Men Fashion Casual Solid Color Printed Short Sleeve T-shirt,"₦ 5,364"
