Item,Price
"PVC Rubber Rain Boot Cover，Silicone Insole Non-slip Cover, Reusable","₦ 4,200"
All Black Covered Slip-on Pam Slippers- With Centre,"₦ 6,000"
Men Hot Clogs Beach/Summer Rubber Sandals - Black,"₦ 7,500 - ₦ 8,500"
"Yeldou Waterproof Rain Shoe Covers, Reusable Slip Resistant","₦ 2,500"
PVC RUBBER RAINBOOT,"₦ 8,500"
Flangesio Unisex Five-finger Beach Water Shoes Men Big Size 36-46 Outdoor Quick-drying River Trekking Lovers Swimming Shoes Comfortable Fitness Shoes Grey,"₦ 24,400"
Leisure Mens Leather Shoes Non-slip Formal Leather Shoes,"₦ 28,800 - ₦ 31,488"
New Men's Casual Plus Size Handmade Shoes -Black,"₦ 24,886"
Men's Casual Shoes Non-slip Rubber Waterproof Shoes-Black,"₦ 27,853"
Men Hot Clogs Beach/Summer Rubber Sandals - Grey,"₦ 8,500"
New Men's Outdoor Shoes Breathable Mesh Sneakers -Grey,"₦ 28,968 - ₦ 29,938"
New Men's Outdoor Shoes Breathable Mesh Sneakers -Brown,"₦ 32,900"
Quality RUBBER RAINBOOT Yellow,"₦ 6,500"
Men Rain Boots Short Tube Wear-resistant Waterproof-Black,"₦ 28,861"
Men's Shallow Rain Boots Slip Waterproof Rubber Shoes-Black,"₦ 15,800"
Women's Light Rain Boots Slippery Waterproof Rubber Shoes,"₦ 15,800"
Flangesio Unisex Five-finger Beach Water Shoes Men Big Size 36-46 Outdoor Quick-drying River Trekking Lovers Swimming Shoes Comfortable Fitness Shoes Black,"₦ 24,400"
Unisex Five-finger Beach Water Shoes Men Big Size 36-46 Outdoor Quick-drying River Trekking Lovers Swimming Shoes Comfortable Fitness Shoes Grey,"₦ 25,495"
Non Slip Latex Waterproof Rain Shoe Cover,"₦ 4,836"
Unisex Non-slip Hiking Shoes Large Size Leisure Wading Shoes,"₦ 17,300"
Men's Shallow Rain Boots Slip Waterproof Rubber Shoes-Blue,"₦ 13,800 - ₦ 15,800"
Men Rain Boots Short Tube Wear-resistant Waterproof-Blue,"₦ 28,861"
Silicone Shoe Cover,"₦ 3,200 - ₦ 4,200"
Original Thick Quality Ssfety Rainboot,"₦ 6,500"
Unisex Five-finger Beach Water Shoes Men Big Size 36-46 Outdoor Quick-drying River Trekking Lovers Swimming Shoes Comfortable Fitness Shoes Black,"₦ 25,200"
EsoGoal Long Anti-slip Waterproof Rain Boot ShoeS Cover,"₦ 17,130 - ₦ 20,075"
Men Barefoot Water Shoes Beach Aqua Socks Quick Dry,"₦ 21,499"
A4 Fashion Men Rain Boots Short Tube Wear-resistant Waterproof-Black,"₦ 28,196"
