Item,Price
Men's Long Cotton Collar Trench Coat,"₦ 39,841"
Winter Wool Jacket Men's High-quality Wool Coat,"₦ 35,400 - ₦ 46,600"
Gray Autumn Winter New Men Coat Casual Mid-length Woolen Double Breasted Windbreaker Belt,"₦ 46,506"
Men's Single-Breasted Cotton Jacket Windbreaker Trench Coat,"₦ 27,499"
New Style Double Breasted Men Jacket Coat Long Section Fashion Trench Coat,"₦ 24,615"
Mens Casual Sport Training Trail Convertible Pants-Khaki,"₦ 42,346"
Trendyol Collection Winter Jacket - Khaki - Basic,"₦ 53,592"
Trendyol Collection Winter Jacket - Black - Puffer,"₦ 118,392"
