Item,Price
Attack On Titan Anime Keychains,₦ 231
Anime Demon Slayer Acrylic Pendant Keychain Key Rings,₦ 252
Kpop Keychain Blackpink Exo Got8 Nct Twice,₦ 460
Japan Anime Naruto Uchiha Itachi Acrylic Key Ring,₦ 307
Cute Creative Cartoon Doll Key Chain,"₦ 1,590"
Wax Rhinestone Picker,₦ 447
Cute Cartoon Dinosaur Key Chain Animal,₦ 280
Anime Naruto Hatake Kakashi Acrylic Keychain,₦ 245
Kpop Keychain Blackpink Exo Got7 Nct Twice,₦ 464
SIX Teacher Gift Key Ring Heart Shaped Charm Jewelry Keychain,₦ 430
Game Console Key Ring,₦ 248
This Is Africa 11 Custom Branded Keyring / Key Holder,"₦ 2,000"
1 Pcs Keychains Cute Anime Figures,₦ 212
Anime Demon Slayer: Kimetsu No Yaiba Keychain Set,₦ 514
2pcs Drive Safe Car Keychain Keychain,₦ 306
Plapie Whistle Key Finder With Light And Alarm,"₦ 2,500"
Best Dad Custom Metal Aluminium Branded Keyholders,"₦ 1,700"
Stainless Steel Body Piercing Tool Kit Professional Ear Nose Navel Piercing Machine with Ears Studs Tools,"₦ 6,644"
New My Hero Academia Keychain Key Ring,₦ 287
Anime 19 Days Keychain,₦ 401
5pcs Cords Eyeglass Chains Silicone Eyeglass Holders For,"₦ 1,815"
Multiple colors Scrapbook Punches Earrings Card Punch  Craft Calico Printing DIY Flower Paper Craft Punch Hole Puncher Shape,"₦ 12,016"
I Love You Heart Key Valentine Chain Ring Keyring Cute,₦ 998
Anime Tokyo Ghoul Keychain,₦ 307
1 Pcs Tokyo Revengers Keychain,₦ 254
Anime Cartoon Acrylic Cute Character Key Ring,₦ 224
Haikyuu!! Keychain Clear Acrylic Key Ring Anime,₦ 210
"Dried Pampas Grass Phragmites,32PCS Reed Grass Plants Pompas Floral for Flower Arrangements,Wedding, Office,Home Decor","₦ 3,907"
Korean Creative Cute Panda Key Chain,"₦ 4,700"
Plapie Whistle Key Finder - Blue,"₦ 2,500"
