Item,Price
Military Tactical Clothing Hiking Pants,"₦ 39,850"
Tactical Pants Military Men Cargo Pants Full Many Black_S,"₦ 6,494"
Solid Heavy Zipper Combat Cargo Work Trousers Army Green_M,"₦ 14,971"
Cotton Soft Stretchy Slacks Outdoor Men Women Casual Pants,"₦ 21,000"
Men Sweatpants Striped Print Track Pants Men Skinny Red_M,"₦ 11,755"
Men Tactical Pants Male Outdoor Military Jungle Camo_W32,"₦ 20,992"
Tactical Pants Military Men Cargo Pants Full Many Green_S,"₦ 6,494"
Popular Men's Slim Fit Urban Straight Leg Army Green_M,"₦ 22,538"
Fleece Lined Warm Leggings Women Girls Warm Skin Color,"₦ 16,905"
Woodland Pants Combat Army Active Military Tactical WLDG_S,"₦ 17,294"
Military Tactical Pants With Knee Pad Woodland Shirt_S,"₦ 23,435"
Military Tactical Pants With Knee Pad Woodland Pants_S,"₦ 23,435"
Tactical Men Pants Military Autumn And Digital Woodland_S,"₦ 22,249"
New Combat Army Active Military Tactical Pants Army WLDG_S,"₦ 17,294"
Tactical Combat  Shirts,"₦ 36,330"
Military Tactical Pants With Knee Pad Hunting ACU Shirts_S,"₦ 23,435"
Woodland Pants Combat Army Active Military Tactical WL_S,"₦ 17,294"
Breathable Cool Thin Pants Summer Ice Silk Plus Black_L,"₦ 22,192"
Tactical Military Cargo Pants Men Couple Quick Purple_XS,"₦ 29,696"
Summer Thin Cotton Capri Pants Multi-Pockets For Brown_S,"₦ 29,505"
Solid Heavy Zipper Combat Cargo Work Trousers With Beige_M,"₦ 14,971"
6xl Plus Size Mens Leisure Sports Pants 11 Gray Summer_28,"₦ 23,188"
Tactical Pants Men Military Cargo Pants Green Ruins_S,"₦ 23,435"
Men Women Camping Climbing Trekking Fishing Dry Men Blue_L,"₦ 29,971"
Fg Tactical Combat Pant Hiking Hunting Airsoft Army WL_S,"₦ 17,294"
Children's Down Pants Winter Boys Girls Elastic Red_110,"₦ 21,875"
Hiking Pants Men Autumn Camping Sports Cargo Pants Beige_M,"₦ 12,783"
Hot Us Army Military Mens Mid-Waist Slim Army Tactics WL_S,"₦ 17,294"
Mens Waterproof Cargo Pants Elastic Multiple Black CP_S,"₦ 28,800"
Men Oversized Plus Xxl 3xl Size Winter Softshell Black_S,"₦ 30,225"
Unisex Children's One Piece Pants Casual Jumpsuit Red _104,"₦ 15,635"
Black Cargo Pants Army Military Tactical Pants Men Work S,"₦ 20,880"
Men Oversized Plus Xxl 3xl Size Winter Softshell Green_S,"₦ 30,225"
New Waterproof Military Tactical Pants Men Combat Gray_S,"₦ 30,832"
Mountainskin Kids' Winter Fleece Dark Blue_Asian Size XXL,"₦ 23,435"
Winter Thermal Warm Fleece Lined Leggings For Women S 2XL,"₦ 14,971"
Men Trousers Multi-Pocket Pants Military HZM_Photo Color_M,"₦ 23,018"
Men Outdoor Military Tactical Pants Breathable Black_S,"₦ 31,171"
Men Trousers Multi-Pocket Pants Military HT3_Photo Color_M,"₦ 23,018"
