Item,Price
Defacto Man SLIM FIT Blazer - Navy Blue,"₦ 20,000"
Defacto Man - Modern Fit Blazer- Brown,"₦ 20,800"
Business Forma Men Suit Set Lapel Formal Stylish Buttons Pockets Blazer 2 Piece Suit Male Slim Wedding Suit Coats Costume Homme Black,"₦ 22,790"
1 Set Men Suit Slim Single-breasted Korean Style Blazer Zipper Fly Pants Black,"₦ 22,127"
Defacto Man - Slim Fit Blazer-Brown,"₦ 17,567"
Classic Fashion  Mens Formal Business Slim Suit 3Pces Set Groom Wedding Dress Dark Gray,"₦ 48,500"
Mens Retro Wedding Party 2-Piece Set Embroidery Men Tang Suit 203 White,"₦ 70,520"
Man Suit Jacket Slim Fashion One Button Men Blazer,"₦ 34,400"
Retro Gentleman Classic Fashion Plaid Mens Formal Business Slim Suit 3Pces Set Groom Wedding Dress Dark Gray,"₦ 59,500 - ₦ 59,999"
Gaupucean Men Suit Jacket 100% Cotton Casual Street Slim Man Blazer,"₦ 41,300"
2 In 1 Men's Casual Zipper Sports Suit-Grey,"₦ 18,990 - ₦ 22,990"
2 In 1 Men's Casual Zipper Sports Suit-Black,"₦ 18,990 - ₦ 22,990"
Costume Homme Popular Clothing Party Stage Men's Suit Groomsmen Regular Fit Tuxedo Blue,"₦ 67,182"
Asian Size Men's Fashion Casual Slim Fit Suit Jacket Masculine Blazer 143A,"₦ 36,000"
Boutique Mens Business Formal Groom Wedding Dress White 3pces,"₦ 75,999"
Men's Autumn Winter Casual Corduroy Slim Long Sleeve Coat Suit Jacket Blazer Top Fovibery,"₦ 35,560 - ₦ 39,160"
Mens Retro Wedding Party 2-Piece Set Embroidery Men Tang Suit 206 White,"₦ 62,890"
Design Groom Tuxedos Prom Business Suit Party Suits Eening Dress Terno Masculino Mens Suits Ropa Hombre(Jacket+Pants) Gray,"₦ 75,636"
Men Spring Classic Blazers Suit Sets Men Business Blazer +Pants Suits Sets Autumn Men Wedding Party Set Black,"₦ 25,576"
2 In 1 Men's Casual Zipper Sports Suit-Black Grey,"₦ 18,990 - ₦ 22,990"
Mens Retro Wedding Party 2-Piece Set Embroidery Men Tang Suit 203 Navy,"₦ 70,520"
Men Wedding Suit Slim Business Office Pants Single-breasted Male Korean Style Jacket Zipper Fly Trousers Light Blue,"₦ 24,797"
Groom Wedding Suits For Men Fashion Slim Fit Best Man 3 Piec Brown,"₦ 43,500 - ₦ 46,500"
Men Long Sleeve Lapel Slim Button Business Suit Men's Wedding Office Meeting Sets Men's Clothing Navy Blue,"₦ 27,801"
Men Slim Fit Suits Fashion Double Breasted Peak Lapel Wedding Groom Party Prom Skinny Costume Mens Ensemble Costume Homme Black,"₦ 79,975"
Mens Retro Wedding Party 2-Piece Set Embroidery Men Tang Suit 203 Wine Red,"₦ 70,520"
Men Long Sleeve Lapel Slim Button Business Suit Men's Wedding Office Meeting Sets Men's Clothing Black,"₦ 27,801"
Men Slim Fit Dinner Party Wedding Blazer Suit,"₦ 23,000 - ₦ 31,600"
Men Wedding Suit Slim Business Office Pants Single-breasted Male Korean Style Jacket Zipper Fly Trousers Light Navy,"₦ 24,797"
Great Formal Suit 3piece Red,"₦ 39,999 - ₦ 45,999"
Men's Suit Jacket Big Size Man Business Corduroy Men Blazer,"₦ 39,800"
Men's Animal Suit White Sports Two-piece Sweatshirt,"₦ 18,800"
Luxury Men Wedding Suit Male Blazers Slim Fit Suits,"₦ 16,650"
"Men's Suit Tuxedo, Banquet Nightclub Show Sequins Fashion Design Men's Suit","₦ 28,900"
Men Suits Slim Fit Casual Business  Or Wedding Suit 3piece Purple,"₦ 85,500 - ₦ 88,599"
Men's Double Breasted Tuxedo Suede Men's Slim Fit Groomsmen B Classic-khaki,"₦ 72,516"
Men Wedding Suit Slim Business Office Pants Single-breasted Male Korean Style Jacket Zipper Fly Trousers Grey,"₦ 24,797"
