Item,Price
Luxury Non Pierce Men's Earring Ice Cubic Zirconia Clip Earrings For Men Women Non Pierced Fashion Zirconium Crystal Stone Ear Clips Party Jewelry,"₦ 7,000"
Arm Cuff Stylish Clothes Accessory Elastic Spring Upper,"₦ 1,769 - ₦ 2,047"
6 Pieces Classic Silver Gold Black Unisex Magnetic Shape Ear Clip Stainless Steel Men Ladies Non Piercing Earrings Fashion Jewelry Punk Rock Style,"₦ 5,200"
Non Pierce Trendy Brilliant Zircon Ice Ear Cuffs Clip Earrings Clear Daisy Flower No Piercing Earcuff Earring For Men Wedding Jewelry,"₦ 7,000"
2021 Trendy Brilliant Zircon Ice Ear Cuffs Clip Earrings Clear Sunflower No Piercing Earcuff Earring For Men Wedding Jewelry,"₦ 7,000"
Clip On Punk Men's Black Earring,"₦ 3,000"
Feather Ear Clips Earrings Men's Trend No Pierced Simple Female Ear Bone Clips,"₦ 8,030"
Simple Palm A Shape Alloy Earring Personality Hand-s,"₦ 4,157"
Embossed Ethnic Male National Trend Earrings Female Trend Ear Jewelry Black,"₦ 8,030"
Ear Bone Clips Without Pierced Earrings Men's Trendy Personality Single Ins,"₦ 8,030"
Men's Stud Earrings Hypoallergenic Moisture Personality Creative Ear Jewelry,"₦ 8,030"
ER0449-J-B New Fashion A Zircon Hoop Earings Crystal Earring,"₦ 27,475"
