Item,Price
Unisex Water Shoes Outdoor Climbing Shoes-Blue,"₦ 32,825"
SocNoDn Men's Casual Climbing Hiking Retro Trend Leather Shoes-Blue,"₦ 35,128"
SocNoDn Mens Casual Chelsea Leather Trekking Ankle Boots Shoes-Black,"₦ 32,920"
Stainless Steel Carabiner Spring Snap Hook Eyelet & Screw Lock,"₦ 516 - ₦ 1,882"
Mens Outdoors Wear-resisting Shoes Males Non-slip Climbing Shoes Black,"₦ 64,080"
SocNoDn Mens Casual Sports Leather Trekking Ankle Boots Shoes-Khaki,"₦ 27,452"
SocNoDn Men's Fashion Casual Leather Trekking Walking Sneakers Shoes,"₦ 26,522"
SocNoDn Men's Casual Climbing Hiking Leather Shoes Boots-Black,"₦ 37,699"
SocNoDn Men's Casual Hiking Leather Sneakers Low-top Boots Shoes,"₦ 32,591"
Mens Outdoors Wear-resisting Shoes Males Non-slip Climbing Shoes Brown,"₦ 64,080"
Men's Fashion Casual Hiking Worker Leather Ankle Boots Shoes,"₦ 32,220"
SocNoDn Men's Casual Fashion Hiking Leather Ankle Boots Shoes-Brown,"₦ 29,529"
SocNoDn Men's Casual Fashion Hiking Leather Ankle Boots Shoes-Black,"₦ 30,459"
Breathable And Comfortable Hiking Shoes,"₦ 13,730"
118cm 18mm Chalkbag Belt Replacement Chalk Bag Adjustable Waist Belt,₦ 714
SocNoDn Mens Casual Sports Leather Trekking Sneakers Shoes-Black,"₦ 28,107"
SocNoDn Men's Casual Fashion Hiking Leather Ankle Boots Shoes-Beige,"₦ 29,038"
Big Size Mens Outdoor Hiking Climbing Shoes-Grey,"₦ 28,500 - ₦ 30,000"
SocNoDn Men's Trend Casual Hiking Leather Sneakers Socks Boots Shoes,"₦ 28,107"
Men's Fashion Casual Hiking Leather Sneakers Boots Shoes,"₦ 27,178"
Men's Fashion Casual Hiking Leather Ankle Boots High-top Shoes Black,"₦ 16,999"
Men's Recreational Sports Running Breathable Sneakers,"₦ 22,818"
Stainless Steel Scuba Diving Snap Hook Bungee Carabiner Screw 4cm,"₦ 1,299"
SocNoDn Men's Casual Climbing Hiking Leather Shoes Boots-Khaki,"₦ 37,699"
SocNoDn Men's Trend Casual Hiking Leather Sneakers Boots Shoes-Grey,"₦ 33,511"
Big Size Mens Outdoor Hiking Sandals-Black,"₦ 23,300 - ₦ 24,900"
SocNoDn Men's Casual Wedding Formal Cow-Leather Boots Shoes-Black,"₦ 37,054"
SocNoDn Mens Casual Sports Leather Trekking Sneakers Shoes-Beige,"₦ 25,811"
"2x Climbing Chalk Bag For Climbing, Bouldering, Gymnastics, Cross Fit","₦ 13,295"
Men Running Shoes Fashion Sneakers Lace Up Beige,"₦ 9,898"
Big Size Mens Outdoor Hiking Water Shoes-Black,"₦ 21,500 - ₦ 23,100"
Stainless Steel Hiking Climbing Snap Hook Kayak Non-slip Carabiner 4cm,"₦ 1,491"
