Item,Price
Beret Hat Men Flat Peaked Cap Autumn Beret Hat Black,"₦ 6,999"
New Snapback Baseball Hiphop Ajusted Flat Caps Adjustable Outdoor Casual Hat,"₦ 11,200"
New Foldable Fisherman Hat Washed Denim Bucket Hats Unisex Bob Caps Hip Hop Hat,"₦ 9,700"
Men Hats Sailor Captain Hat Black White Uniforms Costume Party Cosplay Hat,"₦ 7,700"
Scrub Cotton Nurse Hat Floral Bouffant Sanitary Cap With Sweatband Cartoon Hat,"₦ 9,200"
1pc Embroidery Balaclava Face Mask 3 Hole For Cold Weather Winter Ski Mask Hat,"₦ 9,800"
Cold Weather Windproof Thermal Fleece Neck Warm Balaclava Waterproof Hat,"₦ 9,700"
New Snapback Baseball Hat Ten Times Embroidery Adjustable Hats For Youth Hat,"₦ 9,700"
UNISEX FASHION WOOL THREE HOLE BALACLAVA FASHION THREE HOLE FACE MASK,"₦ 5,000 - ₦ 29,000"
Women And Men Caps Beret Kangaroo Beret Hand Knitted Thin Breathable Mesh Hat,"₦ 9,900"
Solid Color Octagonal Cap Hats Female Autumn Winter Leather Panama Stylish Hat,"₦ 9,600"
Octagonal Hat Winter Male Artist Solid Color Newsboy Hat Coffee,"₦ 6,424"
Cotton Baseball Cap Men Women Military Enthusiasts Tactical Cap Snapback Hat,"₦ 9,200"
Fs Red Green Washed Denim Baseball Caps For Men Women Winter Trucker Hats Hat,"₦ 9,200"
Winter Ski Warm Hat Balaclava Hat Men Women Knitted Full Face Cap Neon Color-2-1hole,"₦ 12,003"
Friendly Men's Full Face Balaclava,"₦ 8,000"
New Brand Nyc Denim Baseball Cap Men Women Embroidery Letter Jeans Snapback Hat,"₦ 9,200"
Men Beret Hat Coldproof Anti Sun Beret Coffee,"₦ 3,265"
Men Beret Hat Coldproof Anti Sun Beret Dark Gray,"₦ 3,265"
Unisex Beanie Hat Winter Stretchy Knitting Beanie Hat Wine Red,"₦ 4,300"
Men Berets Street Newsboy Hat Spring Autumn Winter Retro British Beret Hats Hat,"₦ 8,800"
1 2 3 Hole Men Women Adult Spandex Balaclava Open Mouth Face Eye Head Mask Hat,"₦ 8,700"
Octagonal Hat Winter Male Casual Plain Octagonal Newsboy Hat Beige,"₦ 6,424"
Beret Cap Pure Color Wool Beret Hats Caps Red,"₦ 7,826"
2PcsSet Female Hat Neck Warmer Windproof Winter Female Cap Scarf Kit Grey,"₦ 11,427"
New Brand 62 Styles Disney Minnie Mickey Snapback Cotton Baseball Cap Men Hat,"₦ 9,700"
New Brand Disney Minnie Mickey Snapback Cotton Baseball Cap Men Women Hip Hat,"₦ 9,700"
Octagonal Hat Winter Male Artist Solid Color Newsboy Hat Beige,"₦ 6,424"
