Item,Price
Mens Shoes Boots Outdoor Hiking Desert Sneakers - Black,"₦ 11,500"
Mens Shoes Boots Outdoor Hiking Desert Sneakers,"₦ 36,258"
Fashionable Non Slip Large Size Hiking And Cross-country Boots,"₦ 43,934 - ₦ 52,286"
EXECUTIVE  AND DIGNIFYING MAT-LIKE MEN SHOE,"₦ 13,000"
Men's Fashion High Top Work Boots,"₦ 24,833"
Men Ankle Boots Casual Work Shoes Retro Martin Boots,"₦ 24,299"
Northside Monroe Low Waterproof Suede Hiking,"₦ 37,500"
Mens Ankle Top  Boots Hiking Booties-Black,"₦ 29,604"
Men's Recreational Sports Running Breathable Sneakers,"₦ 19,255"
Men's Casual Sports Breathable Sneakers,"₦ 13,864"
