Item,Price
Scarf Outdoor Multi-use  Warmer Unisex Scarves,"₦ 26,336"
Women Scarf Winter Solid Color Thickened Imitation Cashmere Thermal Scarf Beige,"₦ 3,420"
Plush Scarf Winter Thickened Double-sided Furry Scarf Wrap Black,"₦ 3,870"
Face Cover Scarf Fall Winter Fishing Skating Running Sport Scarf Face Cover Navy Blue,"₦ 2,281"
Cycling Face Mask UPF50+ Helmet Ice Silk Protection Headgear,"₦ 3,250"
Male Hood Cloak Pirate Scarf Halloween Cosplay Accessories Blue,"₦ 17,828"
Women Winter Shawl European Style Lady Shawl Beige,"₦ 8,245"
Face Cover Scarf Fall Winter Fishing Skating Running Sport Scarf Face Cover Red,"₦ 2,281"
Women Winter Shawl Comfortable Ladies Scarf Khaki,"₦ 8,360"
Furry Scarf Wrap Winter Thickened Double-sided Furry Scarf Wrap Beige,"₦ 4,204"
Collar Scarf Windproof Winter Men Ladies Scarf Neck Warmer Red,"₦ 8,363"
Face Cover Scarf Fall Winter Fishing Skating Running Sport Scarf Face Cover Dark Gray,"₦ 2,281"
Pullover Neckerchief Windproof Close Fit Pullover Neckerchief Wine Red,"₦ 4,682"
Furry Scarf Wrap Winter Thickened Double-sided Furry Scarf Wrap White,"₦ 4,453"
Scarf Comfortable Ladies Scarf Khaki,"₦ 8,761"
Pullover Neckerchief Windproof Close Fit Pullover Neckerchief Khaki,"₦ 4,682"
Plush Scarf Winter Thickened Double-sided Furry Scarf Wrap Beige,"₦ 3,800"
Cross Scarf Cold Winter Female Cross Scarf White,"₦ 3,603"
Women Winter Shawl Comfortable Ladies Scarf Beige,"₦ 8,360"
Women Winter Shawl Comfortable Ladies Scarf Grey,"₦ 8,360"
