Item,Price
Men's Round Neck Casual Jacquard Bottomed Sweater.,"₦ 24,173"
Men's 2022 Medium-length Loose Cardigan Knitted Sweater Jacket,"₦ 25,396"
Men's Autumn And Winter New Long-sleeved Single-breasted Sweater Cardigan Sweater,"₦ 28,852"
High Collar Sweater Knitted Pullover Men's Warm Sweater,"₦ 31,300 - ₦ 48,700"
ALTINYILDIZ CLASSICS Dark Blue KNITWEAR EU XXL,"₦ 39,680"
ALTINYILDIZ CLASSICS White & Blue KNITWEAR EU XXL,"₦ 44,488"
ALTINYILDIZ CLASSICS Dark Blue KNITWEAR BASIC EU XXL,"₦ 13,656"
ALTINYILDIZ CLASSICS Grey & Blue KNITWEAR EU S,"₦ 15,928"
ALTINYILDIZ CLASSICS Black KNITWEAR BASIC EU XXL,"₦ 38,296"
ALTINYILDIZ CLASSICS Grey & Blue KNITWEAR EU XXXXL,"₦ 21,600"
Men's Long-sleeved Knitted Cardigan Casual Wear Sweater Jacket,"₦ 20,913"
ALTINYILDIZ CLASSICS Dark Grey KNITWEAR EU XXL,"₦ 39,864"
ALTINYILDIZ CLASSICS Red KNITWEAR BASIC EU XXL,"₦ 36,000"
ALTINYILDIZ CLASSICS Grey & Blue KNITWEAR EU XXL,"₦ 38,936"
ALTINYILDIZ CLASSICS Navy Blue KNITWEAR EU XXL,"₦ 39,520"
ALTINYILDIZ CLASSICS Multicolore KNITWEAR,"₦ 38,936"
ALTINYILDIZ CLASSICS Dark Green KNITWEAR BASIC EU XXL,"₦ 44,376"
ALTINYILDIZ CLASSICS Grey KNITWEAR EU XL,"₦ 11,184"
ALTINYILDIZ CLASSICS Black KNITWEAR BASIC,"₦ 45,152 - ₦ 75,256"
ALTINYILDIZ CLASSICS Blue KNITWEAR BASIC EU S,"₦ 16,416"
ALTINYILDIZ CLASSICS Dark Blue KNITWEAR EU S,"₦ 22,304"
ALTINYILDIZ CLASSICS Multicolore KNITWEAR EU XXL,"₦ 32,072"
ALTINYILDIZ CLASSICS Beige KNITWEAR EU M,"₦ 39,864"
