Item,Price
Wrist Smart Watch Bands Bracelet Strap,"₦ 4,173"
Full Touch Bluetooth Watch Health Detection Smartwatch,"₦ 10,500"
"Polished Full Hunter Quartz Pocket Watch, Dual Case, 14"" Length Chain","₦ 4,651"
Vintage Skeleton Steampunk Mechanical Black Alloy Pocket Watch Hand,"₦ 16,480"
Cool Smart Bluetooth Motion Detection Smart Bracelet,"₦ 3,360"
"Michael Kors Backpack Handbag, Blue","₦ 591,050 - ₦ 955,522"
Vintage Flip Reversible Quartz Pocket Watch Boscia Casual Pocket Watch,"₦ 8,000"
Woman Men\\\'s Watches 7 Color Light WristWatch,"₦ 15,000"
Smart Watch + Bluetooth Headset Waterproof Sports Combination Affordable Set,"₦ 5,911"
Sonia Jewels Charles Hubert 925 Sterling Silver Quartz,"₦ 2,834,029"
Smart Watch Wireless Bluetooth Headset Set,"₦ 5,566"
Touch Pedometer Health Sport Watch For Android IOS,"₦ 35,400"
"Steampunk Mechanical Pocket Watch Skeleton Hand Winding Watch, Up To","₦ 17,516"
LED Silicone Wrist Watches Bands Bracelet Strap,"₦ 4,482"
"Rainbuvvy DM101 4G Smart Watch For Men 2.41"" Display Android","₦ 418,745 - ₦ 517,808"
Curren 8355 Luxury Classic Business Watch Quartz Men Watch,"₦ 16,370"
Mart Watches Bluetooth Smartwatch Touch Smart Bracelet Fitness Connected Watches,"₦ 3,878"
Cool Original Design Black Technology Watch+bracelet,"₦ 5,221"
Victorinox I.N.O.X. V Watch With Mini Champ Alox Pocket,"₦ 762,856"
Vintage Digital Wristwatch LED Digital Waterproof Quartz Wristwatch,"₦ 3,815"
Silicone LED Watch Student Watch Fashion Watch,"₦ 2,482"
Waterproof  Led Electronic Watch,"₦ 2,315"
