Item,Price
2021 Car Cradles Wireless Car Charger OJD-33 Black Color,"₦ 8,999"
Ar Top  Over Guard For R   Ar  Rawler Model Wrangler Spare Parts A  Essories-Black,"₦ 4,010"
Obsta Le De Oration Tools For 1/10 R   Rawler  Ar D90 D110  Ar-Blue-4pcs,"₦ 10,220"
IPX8 Waterproof ABS Motorcycle Stand Holder 360 Degrees,"₦ 24,705"
Front Armor Prote Tion Guard For 1/10 R   Rawler  Ar D90 D110  Ar-Silver-4pcs,"₦ 6,370"
Gravity Car Holder Car Air Vent Clip Mount No Magnetic Stand,"₦ 2,008"
Shockproof Silicon Case For Samsung Galaxy Tab A8 10.5,"₦ 17,800"
Portable Hanging Air Cooling USB Hand Fan With Strong Wind,"₦ 14,385"
