Item,Price
Slim Hard Pc Case For Samsung Galaxy A7 S10 5g S10e Matte,"₦ 17,898 - ₦ 20,145"
3Pcs Lanyard Mobile Phone Wrist Straps Hand Lanyard Yellow,₦ 862
Phone Neck Cord   Smart Phone Safety Tether Light Grey,₦ 935
Phone Strap Crossbody Universal Adjustable Length Hand-Black,"₦ 1,778"
Phone Lanyard Universal Adjustable Wear-resistant-Purple,"₦ 1,065"
Backpack Pendant   Bell 3D Simulation Fruit 1,₦ 513
Ransitute R1247 Cartoon Power Rangers Beast Morphers Id Id,"₦ 11,944"
110cm Colorful Acrylic Bead Long Mobile Phone Strap Lanyard,"₦ 12,478 - ₦ 16,958"
Coque Cover Sfor Nokia 1 Case For Nokia 1 2 2.1 Nokia1 Plus,"₦ 7,261 - ₦ 7,712"
100pcs Cell Phone Braided Lanyard Cords DIY Rope Lariat Straps Coffee,"₦ 1,620"
Chocolate Milka Phone Case For Xiaomi Redmi Note 4 4x 5 6 7,"₦ 21,153"
For Lg V40 Thinq Lgv40 V 40 Anti-Knock Phone Case For Lg V,"₦ 20,544"
Phone Case Pouch For Huawei Mate 40 30 Pro Y9a Y9p Y8p Y6p,"₦ 25,401 - ₦ 25,878"
Coque For Ulefone Armor 7 Black Soft Case For Ulefone Armor,"₦ 23,400"
10pcs/lot Diy Jewelry Cell Phone Lanyard Cord Strap Holder,"₦ 12,020"
Running Jogging Gym Sport Holder Bag Cover Arm Band Phone 9,"₦ 23,514 - ₦ 24,429"
Magnetic Shockproof Phone Case For Vivo Y91c Y91i Y93 Y93s,"₦ 25,437"
Led Flash Transparent Tpu Case For Iphone 8 7case 6 6s 11 X,"₦ 21,933"
Eternal Art Oil Painting Lanyard Keys Phone Holder Funny Id,"₦ 11,980"
Mercedes Luxury Car Amg Phone Tempered Glass Case Cover For,"₦ 23,916"
Dabieshu Wang Yibo Xiao Zhan The Untamed Phone Case For A01,"₦ 19,326"
Jujutsu Kaisen Yuji Itadori Anime Keychain Lanyard For Keys,"₦ 14,064"
Luxury Uflage Cute Cartoon Neck Strap Lanyard For Keys,"₦ 12,998"
Lx659 Anime Appointment Of Neverland Lanyard For Keys Phone,"₦ 11,980 - ₦ 13,504"
Anime Tokyo Ghoul Keychains Lanyard Phone Keys Full Color,"₦ 15,486"
Blinghero My Hero Academia Lanyard Cool Keys Phone Id Badge,"₦ 11,958"
Anime My Hero Academia Lanyard Neck Strap Keys Id Card Pass,"₦ 11,980 - ₦ 13,252"
Colorful Acrylic Bead Long Mobile Phone Chain Cellphone For,"₦ 11,932"
Anime Haikyuu Lanyards For Key Chain Id Card Badge Holder,"₦ 14,064"
Rugged Shield Back Case For Google Pixel 3 -,"₦ 5,000"
Blinghero Lanyards Cartoon Keys Id Badge Phone Holder Keys,"₦ 11,958"
Factory Outlet Design Mobile Phone Lanyard Keychain Sling,"₦ 13,164"
100pcs Black Mobile Cell Phone Lanyards Cords Straps Lariat,"₦ 14,138"
Square Grid Style Mobile Phone Hanging Rope Id Card Student,"₦ 11,932"
New Long Phone Chain Color Bead Chain Soft Pottery Smiley,"₦ 11,222 - ₦ 12,490"
Lanyard For Key Durable Round Cord Metal Hook Military Duty,"₦ 13,124"
Fhnblj Mm's Chocolate Nutella Bottle Mobile Phone Case For,"₦ 19,536"
For Relx Infinity Hemp Rope Braid Phone Lanyard Necklace,"₦ 11,792"
Beaded Phone Charms Strap For Y2k Phone Charm Indie Phone S,"₦ 12,236"
Portefeuille Nylon Wrist Hand Cell Phone Mobile Chain Charm,"₦ 11,232"
