Item,Price
Car Suction Cup Mount Stand Tablet PC Holder For IPad Pro,"₦ 14,775"
360° Adjustable Suction Cup+Air Vent Car Phone Holder,"₦ 4,495"
Magnetic Car Phone Holder Mini Strip Shape Stand With Free Gift,"₦ 3,900"
Universal 360 Degree Rotatable Car Dashboard Cell Phone GPS,"₦ 8,693"
1PC Headrest Premium Car Back Seat Mount Adjustable Holder,"₦ 7,598"
Tablet Car Stand For Headrest Phone Back Seat Holder Mount,"₦ 27,865"
Car Magnetic L Shape Magnetic Air Vent Mount With Free Gift,"₦ 4,500"
Auto Tachograph Car Camera DVR Camcorder Video Recorder 2.7,"₦ 10,197"
Universal Full Motion Tv Mount Retractable TV Rack Wall,"₦ 16,415"
Universal 55~85mm Steering Wheel Socket Holder Car Support,"₦ 7,275"
Universal Magnetic Car Phone Holder Stand In Car For IPhone,"₦ 25,740"
Car Holder Stand Back Auto Seat Headrest Bracket Support,"₦ 8,827"
White New Car Holder Car Sale Universal Balck,"₦ 13,709"
Multifunctional Car Cup Holder With Attachable Tray 360° Swivel Adjustable Car Food Eating Tray Table For Cup Holders Expander 2 IN 1 Large Size,"₦ 34,809"
Lazy Shelf Bedside Mobile Phone Holder Clip For Smart Phone,"₦ 5,963"
2020 New Desk Monitor Notebook Laptop Stand Space Bar,"₦ 20,860"
Magnet Gun PCS Gun Magnetic 1 Holster 25LB Holder Concealed,"₦ 24,197"
Phone Holder For Iphone Universal 7 6 5S Mount Car Holder,"₦ 8,866"
Car Air Vent Mount Holder Stand For 7 To11inch Ipad Samsung,"₦ 8,464"
Backseat Holders Universal New Adjustable Car Seat Headrest,"₦ 11,405"
New Stainless Steel Vehicle Mounted Cup Heated Travel Mug,"₦ 6,346"
Adjustable Car Holder Universal 360° Rotating Backseat,"₦ 12,415"
Universal Car Seat Gap Organizer Side Pocket Storage Box,"₦ 6,998"
Yi Dash Cam Mount 360 Degree Rotation 3M Sticky Pad Mount,"₦ 8,181"
360 Degree Rotatable Car Magnetic Phone Holder Dashboard,"₦ 7,590"
Pocket Camera Car Handheld Gimbal Stabilizer For Oo Mount,"₦ 21,655"
301 208 For 407 Peugeot 308 307 Phone Holder Car 206 207,"₦ 15,064"
2020 New 12 Inch 3D Phone Screen Magnifier Stereoscopic,"₦ 17,591"
GloryStar Universal Car Cup Holder For Hanging Air Vent,"₦ 5,963"
Infrared Light Sensor Automatic Opening And Closing Car,"₦ 11,341"
And Infrared Opening Closing Car Light Automatic Sensor,"₦ 22,308"
Mount Handheld Talkie Cb Holder Microphone Mic Radio Walkie,"₦ 27,940"
Car Laptop Desk Car With Multifunctional Chair Back Dining,"₦ 14,662"
Universal Car Seat Gap Filler Catcher Organizer Console,"₦ 9,888"
Curved 3D HD 12 Inch Magnifier Enlarge Movie Screen,"₦ 16,982"
Car Suction Cup For Yi 4k Go Pro Auto Sucker Holder Mount,"₦ 10,785"
NEW-6 Pcs Eco Solar Panel Corner Side Mounting Bracket Kit,"₦ 26,502"
Universal Adjustable Cell Phone Holder Mount Car Phone,"₦ 17,793"
Baseus Car Humidifier 300ml Air Purifier Freshener Aroma,"₦ 25,116"
TFT Screen 6 LED HD Car Camera DVR Video Recorder Night,"₦ 13,810"
