Item,Price
"Otter Box Galaxy A73 5G Defender Case, Heavy Duty Drop Protection","₦ 14,999"
Phone Oxford Cloth Waist Bag For 6.7-6.9 Inch,"₦ 6,470"
Creative Luminous Mobile Phone Protection Soft Shell For Iphonex,₦ 870
"Phone Screen Replacement Case Cover Frame Shell For IPhone 6S Plus 5.5""-multicolor-5.5inch",₦ 360
S22 Case With Stand Dual Layer Military Grade Dro Protection,"₦ 15,500"
S22 Ultra Case With Kickstand Military Grade Drop Protection,"₦ 15,500"
JTX Buckle Wireless Earphone Protector Anti-lost Wear-resistant Accessories,₦ 530
Pudding Sleeve Mobile Phone Case For Samsung Note 9 Cover TPU Phone Shell,₦ 700
Oxford Cloth Phone Waist Bag For 6.7-6.9 Inch,"₦ 6,230"
Stone Texture Card Zipper Bag With Long Strap,"₦ 9,910"
Summer Fruit Cute Phone Case Drop Protection Anti-fall Cover For IPhone,₦ 980
Litchi Texture Phone Case For 6.7-6.9 Inch Phone,"₦ 4,890"
MSC-20D Radio Holder Case  Bag Radio Walkie Accessories Durable,"₦ 1,684"
Smart Stay Window Mirror Surface Flip Type Mobile Phone Protective Cover Case,"₦ 1,520"
Bluetooth Headset PRO-3 Protective Case,"₦ 2,999"
Universal Crazy Horse Texture Touch Screen Wallet Style PU Shoulder Bag,"₦ 8,300"
Clear Mirror Case Flip Stand Case Phone Protective Case Cover For Samsung,"₦ 1,790"
Folding Mobile Phone Waist Bag,"₦ 5,380"
Creative Graffiti Phone Case Color Printing TPU Phone Cover For IPhone Series,₦ 610
Sky Blue Clear Mirror Flip Stand Case Phone Protective Case Cover For Xiaomi,"₦ 2,170"
Purple Clear Mirror Flip Stand Case Phone Protective Leather Cover For Xiaomi,"₦ 1,710"
Clear Mirror View Phone Protective Case Cover Flip Stand Case For Samsung,"₦ 1,680"
MSC-20D Radio Holder Case  With Sling Radio Walkie Accs Durable,"₦ 5,705"
Multi-Function Radio Holder Case Pouch Radio  Nylon Material,"₦ 5,452"
MSC-20D Radio Holder Case Bag For  Yausu Radio  Radio,"₦ 4,460"
Premium MSC-20D Radio Holder Case  Pouch Radio Walkie Accs,"₦ 4,810"
Mobile Phone Bracket Ipad Tablet Live Support Frame Retractable Adjustment,"₦ 11,650"
Radio Holder Case Pouch With Sling For BaoFeng Radio  Accessory,"₦ 3,039"
