Item,Price
5 Pockets Neon Green High Visibility Reflective Multi Construction Safety # M M,"₦ 18,590"
Elastic LED Cycling Vest Adjustable Visibility Reflective Vest Gear,"₦ 14,999"
Comfortable Heated Vest 10 Hours Battery Life For Winter XL,"₦ 22,390"
Rain Poncho Hiking Coat Jacket Outdoor Raincoat Sunshade Tarp Travel,"₦ 7,429"
Hooded Rain Poncho Waterproof Raincoat Jacket For Men Women Adults,"₦ 4,990"
Mens Multi Pocket Denim Utility Vest Waistcoat  XL,"₦ 27,065"
"Ladies Steampunk Gothic Long Coat, Retro Red Jacket Punk Clothes M","₦ 24,594"
"Women's Steampunk Dovetail Coat Red, Women's Long Trench Coat XL","₦ 28,452"
Unisex Hooded Raincoat Poncho Outdoor Waterproof Rain Jacket Black,"₦ 6,410"
Womens Steampunk Gothic Long Tailcoat Punk Medieval Tail XXL Red,"₦ 26,922"
Security Tactical Jacket,"₦ 30,000"
Men's Rain Jacket Lightweight Waterproof Raincoat For Cycling XL,"₦ 21,355"
Waterproof Rain Poncho Bike Bicycle Rain Cape Jacket Rain Coat Rain,"₦ 12,490"
Rain Poncho Rain Cape Coat Jacket Outdoor Raincoat Tarp Cycling Rain,"₦ 22,213"
Director Photography Mesh Fly   Vest Jacket Outdoor With Red,"₦ 39,786"
Vest Multi-pocket Detachable Hood Photography Quick-Drying M,"₦ 26,261"
Women Girls Transparent Clear Fashion EVA Raincoat Coat Jacket,"₦ 23,165"
Multi-pocket Fly  Mesh Vest Trout Fish Gear   Green,"₦ 42,739"
Men Down Coat Winter   Imitation Leather For Climbing Sports Black L,"₦ 47,998"
Men's Vest  Hunting Photography Multi-pocket Jacket Casual 4XL,"₦ 26,496"
Men Tops Party Medieval Vest Blouse Steampunk Gothic XL Black,"₦ 16,800"
Men's  Frock Coat Gothic Steampunk Jacket Vintage Tailcoat XL Black,"₦ 22,808"
Woman Jacket Waterproof Three-in-one Snow Ski Hooded Winter Red S,"₦ 11,815"
Long Vintage Tailcoat 2XL Red,"₦ 24,723"
Women Rain Jacket Raincoat Waterproof Winter Trench Coat For 4XL Black,"₦ 23,576"
Stylish Retro Men's Gothic Jacket Knee-length Frock Coat XL Black,"₦ 22,808"
Woman Jacket Waterproof Three-in-one Snow Ski Hooded Winter Red XXXXXL,"₦ 30,530"
"Ladies Steampunk Gothic Long Coat, Retro Red Jacket Punk Clothes XL","₦ 24,594"
Denim Leisure Vest Top Zipper Jacket  Hunting Photographer 2XL,"₦ 11,425"
Fly  Vest Mesh Vest Pack Free Size,"₦ 19,620"
Summer Cooling Vest Men Women Workwear Cooling Vest For Green XL,"₦ 19,602"
Men Coat Jacket Long Steampunk Gothic Fashion Tailcoat Jacket XXXL Red,"₦ 22,262"
Electric Heating Pads Pain Relief Warmer Clothes Heating Pad 5 In 1,"₦ 13,390"
Hi-Vis Safety Reflective Jacket Security Waistcoat New 62*6CM L,"₦ 10,090"
