Item,Price
Lumbar Support Back Belt Air Traction Waist Belt(black),"₦ 46,980"
Unisex Adjustable Corrector I Back Shoulder Lumbar Brace Bel,"₦ 10,715"
Banggood Car Seat I Belt Two Point Seatbelt For Van School B,"₦ 9,096"
Black Shadow Magic Stick Outdoor Tactics Special Training Belt Pure Nylon Durable Men's Belt 4.3cm 125cm Black (black),"₦ 13,690"
"3"" 5 Point I Car Racing Bucket Seat Belt Safety Harness Quic","₦ 75,189"
Warming Belt RHEUMATIC Back Pain Thermal Brace Radiculitis Warmer Kidney M,"₦ 12,090"
Unisex Adjustable Corrector M Back Shoulder Lumbar Brace Bel,"₦ 7,426"
"3"" 5 Point H Car Racing Bucket Seat Belt Safety Harness Quic","₦ 76,378"
Kidney Belts Protect I The Waist Breathable And Sweaty,"₦ 13,365"
Unisex Adjustable Corrector H Back Shoulder Lumbar Brace Bel,"₦ 10,495"
"3"" 5 Point M Car Racing Bucket Seat Belt Safety Harness Quic","₦ 61,655"
Kidney Belts Protect M The Waist Breathable And Sweaty,"₦ 10,711"
Unisex Adjustable Corrector A Back Shoulder Lumbar Brace Bel,"₦ 7,378"
"3"" 5 Point A Car Racing Bucket Seat Belt Safety Harness Quic","₦ 62,718"
"3"" 5 B Point Car Racing Bucket Seat Belt Safety Harness Quic","₦ 74,535"
Kidney Belts Protect F The Waist Breathable And Sweaty,"₦ 10,759"
Kidney Belts Protect H The Waist Breathable And Sweaty,"₦ 13,387"
Black Shadow Magic Stick Outdoor Tactics Special Train Belt Pure Nylon Durable Men's Belt 4.3cm 125cm,"₦ 11,122"
Unisex Adjustable B Corrector Back Shoulder Lumbar Brace Bel,"₦ 10,164"
Kidney Belts B Protect The Waist Breathable And Sweaty,"₦ 12,965"
