Item,Price
5 Pockets Neon Green High Visibility Reflective Multi Construction Safety # M M,"₦ 18,590"
Comfortable Heated Vest 10 Hours Battery Life For Winter XL,"₦ 22,390"
Rain Poncho Hiking Coat Jacket Outdoor Raincoat Sunshade Tarp Travel,"₦ 7,429"
Hooded Rain Poncho Waterproof Raincoat Jacket For Men Women Adults,"₦ 4,990"
Mens Multi Pocket Denim Utility Vest Waistcoat  XL,"₦ 27,065"
Unisex Hooded Raincoat Poncho Outdoor Waterproof Rain Jacket Black,"₦ 6,410"
Security Tactical Jacket,"₦ 30,000"
Waterproof Rain Poncho Bike Bicycle Rain Cape Jacket Rain Coat Rain,"₦ 12,490"
Rain Poncho Rain Cape Coat Jacket Outdoor Raincoat Tarp Cycling Rain,"₦ 22,213"
Vest Multi-pocket Detachable Hood Photography Quick-Drying M,"₦ 26,261"
Men Down Coat Winter   Imitation Leather For Climbing Sports Black L,"₦ 47,998"
Men's Vest  Hunting Photography Multi-pocket Jacket Casual 4XL,"₦ 26,496"
Men Tops Party Medieval Vest Blouse Steampunk Gothic XL Black,"₦ 16,800"
Men's  Frock Coat Gothic Steampunk Jacket Vintage Tailcoat XL Black,"₦ 22,808"
Woman Jacket Waterproof Three-in-one Snow Ski Hooded Winter Red S,"₦ 11,815"
Long Vintage Tailcoat 2XL Red,"₦ 24,723"
Stylish Retro Men's Gothic Jacket Knee-length Frock Coat XL Black,"₦ 22,808"
Woman Jacket Waterproof Three-in-one Snow Ski Hooded Winter Red XXXXXL,"₦ 30,530"
Denim Leisure Vest Top Zipper Jacket  Hunting Photographer 2XL,"₦ 11,425"
Summer Cooling Vest Men Women Workwear Cooling Vest For Green XL,"₦ 19,602"
Men Coat Jacket Long Steampunk Gothic Fashion Tailcoat Jacket XXXL Red,"₦ 22,262"
Electric Heating Pads Pain Relief Warmer Clothes Heating Pad 5 In 1,"₦ 13,390"
Woman Jacket Waterproof Warm Snow Ski Outdoor Running Red XXXXL,"₦ 30,601"
Multi Pocket Jacket  Photography Director Casual Detachable L,"₦ 26,501"
Men's Outdoor  Denim Vest Waistcoat Multifunctional Camera 2XL,"₦ 27,919"
Men Down Coat Winter   Imitation Leather For Climbing Sports XXXL,"₦ 15,402"
Reusable Raincoats Womens Mens Rain Ponchos Hooded Rainwear Rain Black,"₦ 4,887"
Refrigeration Air Conditioned Cooling Vest Shirt For Summer Gray XXL,"₦ 21,670"
Woman Jacket Waterproof Three-in-one Snow Ski Hooded Winter Black M,"₦ 12,340"
Kids Rain Coat Ponchos With Hoods And Sleeves Durable For Boys Girls 4,"₦ 4,297"
Steampunk Aristocrat Punk Rave Men's Vest Waistcoat Black Gothic L,"₦ 25,909"
Woman Jacket Waterproof Warm Outdoor Running Hunting Sports Pink XL,"₦ 18,045"
Wearable Fan Vest For Workwear Summer Sun Air Conditioning Green L,"₦ 7,933"
Woman Three-in-one Two-piece Waterproof Coat Outdoor Hiking Yellow L,"₦ 18,095"
Woman Three-in-one Two-piece Waterproof Coat Outdoor Hiking Black XXXL,"₦ 18,095"
Woman Three-in-one Two-piece Waterproof Coat Outdoor Running Pink 5XL,"₦ 19,004"
