Item,Price
Doohan New Motorcycle I Racing Pants Waterproof Pants DK201,"₦ 114,101"
Motorcycle Racing Pants Motorcycle Riding Jeans Pants Male Knight DK-018 Black M,"₦ 101,290"
Doohan New D Motorcycle Racing Pants Waterproof Pants DK201,"₦ 94,555"
Doohan New Motorcycle M Racing Pants Pants Network DK201B,"₦ 63,317"
#r28 Motorcycle Accessories Repair Tool For Honda Msx 125,"₦ 8,210"
Doohan New Motorcycle M Racing Pants Waterproof Pants DK201,"₦ 96,967"
Doohan New Motorcycle I Racing Pants Pants Network DK201B,"₦ 77,508"
Pant Waist Expander Waistband,"₦ 933 - ₦ 1,041"
Doohan New B Motorcycle Racing Pants Waterproof Pants DK201,"₦ 113,109"
Doohan New Motorcycle H Racing Pants Waterproof Pants DK201,"₦ 112,839"
Car Transmission Oil Pan for Hyundai Accent Elantra Kia K5,"₦ 23,364"
Men's Cycling Riding I Padded Shorts Bicycle Wear Bike Pants,"₦ 22,048"
Doohan New Motorcycle A Racing Pants Waterproof Pants DK201,"₦ 94,555"
Doohan New Motorcycle H Racing Pants Pants Network DK201B,"₦ 79,193"
Suitable For Apple 13 Cube Straight Edge Liquid Silicone Mobile Phone Case Iphone11 12 Mobile Phone Case,"₦ 2,800"
"1 Pair 7 8"" 22 Mm Round Aluminum Rear View Mirror Handle","₦ 15,310"
0.5mm 500G Stainless Steel Wire For Beekeeping Beehive,"₦ 10,220"
Doohan New Motorcycle A Racing Pants Pants Network DK201B,"₦ 64,636"
Men's Cycling Riding F Padded Shorts Bicycle Wear Bike Pants,"₦ 18,068"
Doohan New B Motorcycle Racing Pants Pants Network DK201B,"₦ 76,692"
