Item,Price
Bike Crankset Colorful Durable Hollow Crank Replacement Tool,"₦ 28,259 - ₦ 37,355"
Mens Padded Mountain Bike Shorts Breathable Cycling Underwear,"₦ 4,950 - ₦ 5,192"
Universal Phone Holder Silicone Bicycle Mobile Phone Riding Bracket 360 Degree Rotatable Mobile Phone Riding Bracket Black,"₦ 6,290"
Suspension Seatpost With Shock Absorber,"₦ 15,140 - ₦ 18,382"
Universal Phone Holder Silicone Bicycle Mobile Phone Riding Bracket 360 Degree Rotatable Mobile Phone Riding Bracket Grey,"₦ 6,290"
RD-M390 Rear Derailleur 9/27 Speed,"₦ 7,928"
Waterproof Metal Motorcycle Smart Phone Mount With QC 3.0 USB Quick Charger Black,"₦ 38,790"
Bicycle Pedal Holder Quick Release Aluminum Alloy Bike Rack Mount Bike Pedal Holder,"₦ 2,318 - ₦ 2,362"
Bike Tube Frame Bag Waterproof Large Capacity Cycling Accessories Pack,"₦ 1,978 - ₦ 2,583"
32 Hole Hub Set Ultralight,"₦ 48,077 - ₦ 54,978"
Mount Bracket Action Camera Protective Frame Frame Mount Pro,"₦ 4,524"
Bicycle Code Table Holder Set Aluminum Alloy,"₦ 9,576"
Electronic Anti-theft Bike Locks 110 DB Anti-theft Alarm Sui,"₦ 16,055"
Mobile Phone Holder Mount Bicycle Phone Navigation Aluminum Alloy For Phone GPS Fixed Bracket Moto Handlebar 1pcs Black,"₦ 4,400"
Bike Phone Mount Bag High Sensitive Touch Screen For Cycling,"₦ 5,258"
