Item,Price
"2 Pack Ceiling Hook Hanging Chair,400KG Ceiling Hook,360°","₦ 31,926"
Pregnancy Maternity Body Pillow,"₦ 46,330"
Female Male Portable Mobile Toilet Car Journeys Travel Camping Boats Urinal,"₦ 17,390"
10PCS/Set Vacuum Compressed Q Bags Transparent Clothing Spac,"₦ 10,951"
SC25UU 25mm Linear Axis Ball Bearing Block Motion Slide For,"₦ 23,098"
Scooter 1T3 Dashboard Controller Data Cable For 10Inch,"₦ 11,986"
10PCS/Set Vacuum Compressed Bags Transparent Clot Light Gree,"₦ 14,042"
Stainless Steel Hammock Swing Hook Fixed Plate Hanging Ch M5,"₦ 5,976"
Portable Ultralight Inflatable Air Pillows Camping Sleep Cushion,"₦ 20,918"
Multifunctional Hanger Hook Tent Light Hangers Outdoor,"₦ 1,610"
Massage Acupressure Pillow M /Yoga Sit Lying Mats Cut Pain S,"₦ 20,486"
"Diving Mask with Anti-Fog Tempered Glass, Anti-Leak Dry","₦ 17,266"
Outdoor Travel Portable Inflatable Pillow Soft Flocking Inflatable Pillow Aircraft Train Essential Portable Pillows Sweat Comfort,"₦ 5,016"
7S 24V 20A Lithium Li-Ion Lifepo 4 18650 Battery Bms Pcb,"₦ 9,557"
Portable Family Outdoor P Camping Shelter Backpacking Up Ten,"₦ 66,042"
Outdoor Camping Shower Portable Electric Shower Pump,"₦ 55,200"
Pink Slow Back Memory Cotton Physiotherapy Lumbar,"₦ 14,661"
Portable Outdoor Automatic Inflatable Pillow,"₦ 29,950"
7 Pcs/Set Sand Wedge Golf Club Head Cover Set 48 50 52 54,"₦ 6,653"
New Tennis Elbow Brace With Compression Pad For Both,"₦ 4,272"
U Shaped Neck Rest Memory Foam Car Travel Comfort Light Purp,"₦ 11,302"
Hooded Microbead Neck U Pillow Cushion Airplane Travel Office Car Rest Sleeping # Black Black (black),"₦ 23,890"
White Mosquito Net Indoor Outdoor Camping Portable Netting With Storage Bag,"₦ 19,290"
Fishing Bite Alarms Electronic Wireless Fishing Bite Alarm LED Light Feeder Fishing Bite Alarms Fishing Accessories,"₦ 4,968"
Diving Cylinder Oxygen Tank Anti-Lost Lanyard Emergency Rescue Rope,"₦ 10,314"
"E Bike Throttle for Wuxing Ebike Twist Throttle Left and Right Hand Throttle with 3 Pin Connector Ebike Parts,SM","₦ 8,968"
Outdoor Camping Portable Mosquito Net Nylon Hammock Hanging Bed Sleeping Swing,"₦ 35,790"
White Mosquito Net Indoor Outdoor Camping Portable Netting,"₦ 17,034"
Hooded Microbead Neck U Pillow Cushion Airplane T Black (bla,"₦ 13,914"
Paddle Boards Stand Up Paddle Board Handle White,"₦ 5,896"
Contour Memory Foam Comfort Cooling Pillow Hypoallergenic Sleep Care,"₦ 51,990"
U Shaped Comfort Microbead Travel Neck Pillow Cushion Sleep Pain Relief Blue Blue,"₦ 32,890"
Folding Clamp for Dualtron Electric Scooter Rugged,"₦ 36,221"
4PCS Double Sided Inflatable Pillow Mat Cushion For Outdo,"₦ 10,561"
Ice Snow Mud Shoes Spike Grip Boots Chain Crampons Grippers Anti Slip Ice Cleats Orange,"₦ 17,890"
