Item,Price
Foldable Camp Mattress-Portable Travel Bed,"₦ 20,000"
Foldable Camp Mattress,"₦ 20,000"
Uni  Men Women Memory Foam Shoe Pad Insoles Foot  Are Pain Relief Pad-white,"₦ 1,210"
6-Level Electric Heating Warming Pad Heat Mat Body Pain,"₦ 104,720"
1 Usd Price Difference Link How Much To Make Up How Much To,"₦ 12,176"
Folding Foam Mats Waterproof For Outdoor Camping Picnic,"₦ 1,376"
Mini Outdoor Camping Folding Mat Portable Collapsible Dirty,"₦ 13,442"
XPE Foldable Camping Foam Cushion Outdoor Hiking Picnic Mat,"₦ 1,112"
150x200cm Picnic Mat Extra Large Family Camping F Blue Strip,"₦ 22,431"
Magic Beach Mat Outdoor Travel Magic Sand Free Mat Beach Picnic Camping Waterproof Mattress Blanket Foldable Sandless Beach Mat,"₦ 6,136"
Inflatable Travel Footrest Leg Foot Rest Air Plane Pillow,"₦ 16,602"
Net Red Lazy Couch Inflatable Sofa Foldable Recliner Sofa,"₦ 71,780 - ₦ 104,720"
Foldable Camping Mat Foam Mattress Waterproof Outdoor Beach,"₦ 14,435 - ₦ 25,044"
Outdoor Camping Single Sleeping Pad Can Be Stitched Double,"₦ 22,469"
Camping Mat Waterproof Folding Mat Baby Crawl,"₦ 16,451 - ₦ 18,145"
Portable Picnic Beach Seat Pad Outdoor Damp Proof Camping,"₦ 1,304"
Inflatable Mattress Eva Foam Mattress Tent Yoga Mat Camping,"₦ 12,952"
Pilates Workout Mat Thick 60X25X1.5Cm Yoga Knee Pad Cushion,"₦ 4,334"
Portable Backrest Chair Outdoor Camping Beach Folding Blue,"₦ 32,167"
Electric Air Pump Home Inflate Deflate For Air Mattress Mat,"₦ 57,755"
Reusable Foam Pad Outdoor Camping Travel Mats Cushion Foam,"₦ 30,465"
Waterproof Camping Mat Ultralight Foam Camping Mat Seat Mat,"₦ 96,565"
Single Person 270*80cm Mesh Nylon Hammock Portable For Bed,"₦ 19,974"
Portable Beach Mat Foldable Adjustable Backrest Lounge Mat,"₦ 32,555"
5v 7a Usb Electric Carbon Fiber Electric Cloth Heating Pad,"₦ 55,850"
Extra Large Outdoor Picnic Blankets Waterproof Sand Proof,"₦ 31,742"
Pilates Workout Mat Thick 60X25X1.5Cm Yoga Pad For,"₦ 5,606"
Ultralight Sun Shelter Roof Camping Mat Beach Tent Pergola,"₦ 25,051 - ₦ 32,470"
6p S / Lot Repla Ement  Ear Pads Ear Pads Soft Foam  Ushion /  For Koss PARA Porta  Pro   PX100 Headphones-black,"₦ 6,290"
View Original Magnetic YAL-L21 Phone 20 YAL Case Honor20 Smart Honor Huawei Cover Leather Flip On Mirror L21 Fundas For Luxury,"₦ 15,941"
Swimming Pool Inflate Deflate Lightweight Usb Powered Quick,"₦ 37,457"
Graffiti Art Slim Tablet Hard Shell Cover Case For Huawei,"₦ 15,820"
46x30cm Portable Inflatable Pillows Mat Thicken Solid Color,"₦ 17,318"
