Item,Price
Bicycle Seat Saddle,"₦ 7,999"
Extra Comfort Bicycle Seat Saddle Pad Case Padding For Mountain Bike,"₦ 17,685"
Mountain Bike Seat Cushion Silicone Seat Saddle Mountain Bike Seat Bag Riding Equipment Bicycle Saddles Black,"₦ 3,190"
Bicycle Saddle With Dual Spring Suspension Shock Absorbing Leather Bike Seat Foam Padded Cycling Seat Breathable Cushion,"₦ 18,612"
Bicycle Saddle Road Bike Seat Mtb Mountain Cycling Bycicle Saddles Racing Cycle For Journey Cushion Route Parts Chair Bench Seat,"₦ 25,821"
Elegant Bed Side / Desk Lamp,"₦ 18,999"
Nose Less Extra Soft Bicycle MTB Saddle Cushion Bicycle,"₦ 29,304"
Universal 3D  Pad Soft Thick Bike Bicycle Saddle Cover Cycling Cycle Seat Cushion Bike Riding Seat Sitting Protecter,"₦ 13,806"
as description,"₦ 3,098"
Bicycle Seat Breathable Bicycle Saddle Seat Soft MTB Bike Bicycle Seat Cushion Cycling PU Leather+Sardine Bow Cushion Cover,"₦ 20,814"
Seat Saddle Cover Soft Bike Cushion Pad Thick Cycling B Blue,"₦ 10,679"
"3D Silicone Lycra Nylon & Gel Pad Bicycle Seat Saddle Cover, Soft Cushion Fits For Kinds Of Bikes(Red)","₦ 3,320"
Velo Mountain Road Bike Saddle Ultralight Soft Comfortable Microfiber Leather Seat Bicycle Parts Accessories Selim De Bicicleta,"₦ 48,447"
Bike Seat Cover Memory Foam Padded Saddle Cushion With Reflective Strip Ultra Soft Silicone 3D  Pad Cushion Cover,"₦ 15,908"
3D Soft Thickened Bicycle Seat Breathable Bicycle Saddle Seat Cover Comfortable Foam Seat Mountain Bike Cycling Pad Cushion Cove,"₦ 13,005"
LED Light Extra Wide Big Comfort Bicycle Saddle Bike S Black,"₦ 26,435"
Aluminium Alloy Bicycle Seatpost Bike Seat Post Saddle Tube Black 400,"₦ 5,473"
Full Carbons Fiber Saddle Ultralight Italia Tekno Flow High Performance Open Saddle Super Flow MTB Road Race Bicycle Saddle XR,"₦ 23,418"
Bicycle Front Seat Soft Cycle Accessories Thick Seat Road MTB Bike Comfort Cushion Local Shipment From Russian Federation Stock,"₦ 20,714"
Comfy 3D Bike Seat Cushion Inflatable Pad Bike Saddle Cover Blue S,"₦ 9,810"
Cow Leather Vintage Multiple Styles Outdoor Cycling Saddle For Retro City Bicycle Road MTB Fixed Gear Bike Cushion,"₦ 55,756"
Breathable Bike Saddle Bicycle Seat Hollow Seat Cushion Red Black,"₦ 5,019"
Aluminum Alloy Mountain Bike Seatpost Head Single Nail Head Seat Black,"₦ 2,103"
Hot Carbon Fiber Road Mtb Saddle Use Carbon Material Pads Super Light Leather Cushions Ride Bicycles Seat,"₦ 29,925"
Mountain Bike Seat Cushion Silicone Seat Saddle Mountain Bike Seat Bag Riding Equipment Bicycle Saddles,"₦ 3,190"
Extra Wide Bike Seat Cushion Cruiser Saddle Big Bum Road Bicycle Seat,"₦ 16,647"
Motorcycle Seat Passenger Sissy Bar Backrest Cushion Pad For Harley Honda Suzuki Kawasaki Electric Scooter Seats,"₦ 22,416"
Mountain Bike Saddles Bicycle Saddle Padded Waterproof,"₦ 5,863"
WILDSIDE Ultralight Bicycle MTB Cushion Bicycle MIMIC Widened Saddle Cycling Road Mountain Bike,"₦ 23,617"
Comfort Bike Saddle Solid Steel Rail Double Big Bum Spring Blue,"₦ 8,656"
Comfortable Road Bike Seat Soft Wide Thicken Bicycle Saddle Vintage  Black Leather Pad With Spring Cycling Parts,"₦ 30,726"
ROCKBROS Bicycle Saddle Cover Cycling Liquid Silicone S Pad Cushion MTB Bike Seat Cover Soft Breathable Bike Accessories,"₦ 24,418"
Full Carbons Fiber Saddle Ultralight Italia SLR Tekno Flow High Performance Open Saddle SuperFlow MTB Road Race Bicycle Saddle,"₦ 31,428"
SELLE ROYAL 5130 5131 Cycling MTB Bike Bicycle Rail Hollow Saddle Breathable Soft ROYAL 5131 Silica  Cushion SR Bicycle,"₦ 71,776"
Road Folding Bike Saddle Racing Hollow Saddle EVA Seat Parts Women Red,"₦ 7,128"
Bicycle Seat Cushion High Density Sponge Seat Cushion ,"₦ 3,370"
25.4 X 250mm Durable Lightweight Bike Seat Post Tube Seatpost Fixed,"₦ 5,612"
