Item,Price
Standard Fast Cooking Kerosene Stove,"₦ 9,500"
Kerosene Stove - Medium,"₦ 7,632"
Dessini Double Sided Non-Stick Grill Pan 40CM,"₦ 14,500"
Gino Tomato Paste 65g X 50 Sachets (A Carton),"₦ 7,000"
8 Wicks Kerosene Stove,"₦ 6,900"
Butterfly Double Burner Durable Standard Kerosene Stove,"₦ 24,000"
Smokeless Stove-Top/Gas-Top Grill Indoor And Outdoor,"₦ 6,500"
Mini Spirit   Stove Aluminum  For Silver Stainless Steel,"₦ 8,476"
Kitchen + Home Stove Top Smokeless Indoor BBQ Grill,"₦ 5,333"
Smart Flame Foreign Charcoal  Stove,"₦ 40,000"
Jikokoa Charcoal Cook Stove,"₦ 34,999"
Butterfly Premium 22-wick Aluminium Kerosene Stove - VA-816,"₦ 34,999"
Firewheel Double Burner Durable Standard Kerosene Stove,"₦ 21,999"
Original Standard  Durable  Kerosene Stove,"₦ 9,999"
Smart Flame Foreign Charcoal Grill Stove Only,"₦ 32,500"
Hock Kerosene Cooking Stove,"₦ 26,999"
Butterfly Kerosene Stove - Red/White,"₦ 29,999"
Butterfly Double Burner Kerosene Stove,"₦ 24,000"
Home Stove Top Smokeless Indoor BBQ Grill.,"₦ 5,900"
Portable  Stove Kitchen Equipment For Camping Backpacking,"₦ 3,769"
Cooking Kerosene Stove,"₦ 9,999"
Portable Outdoor Camping Mini Gasoline Stove LiquidFuel,"₦ 40,900"
Smokeless Stove-Top Gas-Top Grill Indoor And Outdoor,"₦ 6,000"
Round Gas Stove Energy Saving Cover Heat Resistant Mount Collect,"₦ 2,980 - ₦ 9,143"
Camping Stove Survival Gas Stove  Outdoor Cooking Coal Stove,"₦ 9,173"
Burn Jikokoa Charcoal Cook Stove,"₦ 35,999"
Outdoor Mini Camping Gas Stove Portable  Picnic Foldable Square,"₦ 17,492"
Single  Camping Stove Mini Alcohol Stove For Backpacking Hiking,"₦ 18,317"
Home Stove Top Smokeless Indoor BBQ Grill,"₦ 6,500"
5800W Windproof Camping Stove With Carrying Case 3 Furnaces Heads For,"₦ 22,261"
Stainless Steel Alcohol Stove & Rack Combo Set Mini  Alcohol,"₦ 7,361"
Mini Spirit   Stove Aluminum  Type 2 Rose Gold 17.5x17.5x6.8cm,"₦ 26,115"
"Camping Stove With One , Mini Alcohol Stove For Backpacking,","₦ 16,389"
