Item,Price
Jones Wears The System Quality Customized Hoodie,"₦ 6,499 - ₦ 8,999"
Jones Wears Death Note Amine Trendy Hoodie Black,"₦ 6,499 - ₦ 9,499"
Jones Wears Cactus Jack Premium Hoodies -Black,"₦ 5,999 - ₦ 9,499"
Jones Wears Titan Quest  Quality Hoodie Black,"₦ 5,999 - ₦ 8,499"
Jones Wears Blackwoods Printed Hoodie Black,"₦ 6,499 - ₦ 8,499"
Jones Wears XXXTENTACION Customized Hoodie,"₦ 6,499 - ₦ 8,499"
Jones Wears Backwoods Notorious Bart Customized Hoodie- Black,"₦ 6,400 - ₦ 9,499"
Jones Wears Tsugikuni Michikatsu Amine Customized Hoodie Black,"₦ 6,999 - ₦ 9,499"
Danami Printed Hoodie- Off White/Cream Orange Contrast,"₦ 7,999"
Unisex White Hoodie,"₦ 7,288 - ₦ 9,990"
Danami NY New York Printed Hoodie- Cream,"₦ 7,999 - ₦ 9,999"
Jones Wears Rick And Morty Backwoods Trendy Hoodie,"₦ 6,999 - ₦ 15,000"
BTS Black Hoodie,"₦ 7,999"
Unisex Multicolored Sweatshirt,"₦ 7,000"
Jones Wears Astroworld Customized Hoodies Black,"₦ 6,999 - ₦ 8,999"
Black Casual Hoddie,"₦ 8,000"
Jones Wears Lovers Customized Hoodies Black,"₦ 5,999 - ₦ 7,999"
Quality Multi Color Sweatshirt,"₦ 16,999"
Jones Wears Zoro Roronoa Amine Printed Hoodie,"₦ 6,499 - ₦ 8,900"
Jones Wears Haikyuu Cosplay Customized Printed Hoodie,"₦ 6,499 - ₦ 8,900"
Plain Hoodie- Light Grey,"₦ 5,000"
Unisex Designer 100% Cotton Cool Breathable Sleeveless Hoodie,"₦ 6,550"
Danami White On Sleeve Contrast Sweatshirt Hoodie- Wine (Burgundy),"₦ 7,999"
Off White Hoodie Shirt & Joggers,"₦ 11,999 - ₦ 16,998"
BACKWOODS Blue Hoodie,"₦ 6,999"
Men Hoodies Casual Long Sleeve Sweatshirts,"₦ 3,900"
Danami NYC New York City Printed Hoodie- Navy Blue,"₦ 7,900 - ₦ 9,900"
Grey Casual Hoddie,"₦ 9,000"
Danami Plain Hoodie- Sky/Light Blue,"₦ 7,999"
Jones Wears Backwood Printed Quality Hoodies Black,"₦ 6,499 - ₦ 9,000"
Danami Off White/Cream Orange Contrast Hoodie,"₦ 6,999"
Mfed Mens Sleeveless Hoodie,"₦ 4,500"
Grey And White Up And Down Hoodie,"₦ 13,000 - ₦ 13,500"
R Mens Sleeveless Hoodie,"₦ 4,500"
White Cap Blue Hoodie,"₦ 8,800"
DREW CLASSIC HOODIE.,"₦ 8,000"
Backwoods Urban Classic Hoodie,"₦ 5,999 - ₦ 6,200"
