Item,Price
Swimming Fins Diving Swimming Set Foot Swimming Fins Duck,"₦ 16,756"
3MM Diving Suit Surfing Swimming Warm Thicken Swimwear Diving Suit Black,"₦ 65,690"
Kids Girl Swimmable Mermaid Tails Monofin Mono Fi Blue And W,"₦ 27,199"
Fin Blue Mermaid Tail Monofin Swimmable Kids Girls Women - L,"₦ 18,858"
2Pcs Portable Scuba Diving Swim Fin Strap Quick Release Buckles,"₦ 2,647"
Fin Blue Mermaid Tail Monofin Swimmable Tail Kids Girls Women Swimming Costumes One Hundred And Twenty,"₦ 27,590"
Diving Fins Swim Footsteps Silicone Snorkeling Diving Swimming Sports Blue S Blue S,"₦ 39,890"
Fin Blue Mermaid Tail Monofin Swimmable Tail Kids Girls Women Swimming Costumes Pink 110,"₦ 29,390"
Fin Blue Mermaid Tail Monofin Swimmable Tail Kids Girls Women Swimming Costumes One Hundred And Thirty,"₦ 27,590"
3mm Neoprene D Swim Diving Socks Scuba Surfing Water Swimmin,"₦ 7,469"
Baby Handle Safety Seat Float Pink,"₦ 12,890"
Scuba Diving Swim Fins Flippers Swimming Anti-slip Snorkeling Under Water Sport Yellow,"₦ 20,390"
1 Pair Premium Black Plastic Scuba Diving Snorkeling Swimming Fin,"₦ 1,350"
Professional Scuba Diving Snorkeling Swim Spare Fin Strap & Quick,"₦ 13,692"
2PCS Surfboard Fins for G7 FUTURE Surfing Fins Surfing,"₦ 12,848"
"14""X6"" Car Rear Bumper Lip Chassis Diffuser Spoiler 3 Fin Shark Fin Style Gloss Deflector + Double-sided Tape","₦ 35,390"
Diving Fins Swim Footsteps Silicone Snorkeling Diving Swimming Sports Blue M Blue M,"₦ 45,090"
3mm Neoprene Swim P Diving Socks Scuba Surfing Water Swimmin,"₦ 9,106"
Snorkeling Diving Swimming Fins Adult Kids Flippers,"₦ 20,352"
3MM Diving Suit Surfing Swimming Women Warm Thicken Sw Black,"₦ 54,118"
Unisex Water Sport I Diving Swimming Snorkeling Yoga Socks A,"₦ 6,531"
3MM Diving Suit Surfing Swimming Warm Thicken Swimwear Black,"₦ 46,798"
Fin Blue Mermaid Tail Monofin Swimmable Tail Kids Girls Women Swimming Costumes Pink L,"₦ 27,590"
2Pcs Spare Replacement Scuba Diving Swimming Fin Strap Quick Release,"₦ 3,157"
Unisex Water Sport Diving Swimming Snorkeling Yoga Socks A L,"₦ 6,584"
Unisex Water Shoes Aqua Socks Diving Wetsuit Non-sli Black M,"₦ 6,130"
3mm Neoprene Swim M Diving Socks Scuba Surfing Water Swimmin,"₦ 7,316"
Scuba Diving Boots Silicone Water Swim Fins Adult Red,"₦ 29,885"
Scuba Diving Quick Release Fin Strap For Most Dive Snorkeling Swimming,"₦ 11,686 - ₦ 12,517"
1 Pair S/M/L Scuba Diving Snorkeling Silicone Fin Keeper/ M Pink,"₦ 5,015"
Unisex Water Sport Diving Swimming Snorkeling Yoga Socks A S,"₦ 6,453"
3mm Neoprene Swim A Diving Socks Scuba Surfing Water Swimmin,"₦ 7,423"
Unisex Water Sport A Diving Swimming Snorkeling Yoga Socks A,"₦ 5,466"
