Item,Price
Polo T-shirt Breathable Fashionable And Comfortable - Red,"₦ 4,900"
Polo T-shirt Breathable Fashionable And Comfortable - White,"₦ 4,900"
6 SET PLAIN ROUND NECK POLO T SHIRT  PLAIN TEES,"₦ 10,999"
Polo T-shirt Breathable Fashionable And Comfortable - Orange,"₦ 4,200 - ₦ 4,900"
Polo T-shirt Breathable Fashionable And Comfortable - Pink,"₦ 4,200 - ₦ 4,900"
MENS White Quality Single Round Neck T-shirt With Design Keyboard,"₦ 4,220 - ₦ 4,620"
Polo T-shirt Breathable Fashionable And Comfortable - Yellow,"₦ 4,200"
White  Graphic Designed Round Neck,"₦ 4,999 - ₦ 5,999"
5 IN 1 UNISEX PLAIN ROUND NECK POLO T-SHIRT,"₦ 9,999"
Defacto Man SLIM FIT Knitted Polo T-Shirt-Beige,"₦ 6,472"
MENS Quality Single Round Neck T-shirt Black With Design,"₦ 5,500"
Polo T-shirt Breathable Fashionable And Comfortable,"₦ 4,290 - ₦ 4,790"
Unisex Quality 3in1 Round Neck T-shirt Black With Design,"₦ 9,999 - ₦ 10,999"
Defacto Man Polo T-Shirt - Black,"₦ 4,000"
Quality Single Round Neck T-shirt Black With Design,"₦ 4,999"
4 SET PLAIN ROUND NECK POLO T SHIRT  PLAIN TEES,"₦ 7,999"
Defacto Man Regular Fit Knitted Polo T-Shirt - Beige,"₦ 4,285"
Men’s Branded 3-in-1 Polo T-Shirt,"₦ 13,499 - ₦ 13,899"
Men’s Ash Classy Collar Neck Polo,"₦ 3,210"
Two Plain Unisex High Quality Black And White Round Neck Polo,"₦ 5,999"
Designed Black Back And Front Round Neck,"₦ 5,500 - ₦ 5,999"
Defacto Man Polo T-Shirt - White,"₦ 5,320"
Defacto Man Slim Fit Knitted Polo T-Shirt -Grey,"₦ 5,600"
White Graphic Designed Round Neck,"₦ 4,999"
3 IN 1 UNISEX PLAIN ROUND NECK POLO T-SHIRT,"₦ 5,999 - ₦ 6,999"
Gamer Way Quality Designed Black Round Neck,"₦ 6,500 - ₦ 6,999"
Unisex Polo Tee-shirt Round Neck Polo For Men And Women,"₦ 2,700"
Men’s Black Classy Collar Neck Polo,"₦ 3,210"
Think Big Round Neck Polo -  Wine,"₦ 4,500 - ₦ 4,999"
"6 In 1 Pocket Designed Round Neck Polo - (X,flame,S,chef,slank,bull)","₦ 14,999 - ₦ 15,999"
Men’s Quality Golf Polo T-Shirt With Unique Design,"₦ 13,499 - ₦ 13,899"
Simpson Quality Black Designed Round Neck,"₦ 4,999 - ₦ 5,500"
Grace And Favor Black Design Round Neck,"₦ 4,999 - ₦ 5,999"
3in1 Pocket Simpson Graphic Designed Tee,"₦ 9,999"
Up And Down Quality Designed Round Neck And Short,"₦ 6,999"
