Item,Price
Defacto Man Slim Fit Blazer Collar Coat -Grey,"₦ 15,271"
Defacto Man Slim Fit W/O Hoodıe Coat -Turquoise,"₦ 9,677"
Defacto Man Slim Fit Stand- Up Collar Coat -White,"₦ 23,238"
Defacto Man Slim Fit Blazer Collar Coat -Brown,"₦ 15,200"
Defacto Man Slim Fit Stand- Up Collar Long Sleeve Knitted Coat -Grey,"₦ 16,000"
Defacto Man Slim Fit Stand- Up Collar Coat -Black,"₦ 23,200"
Praaaaempire Black Armless Puffer Jacket With Zip,"₦ 20,000"
Defacto Man Slim Fit Stand- Up Collar Coat -Grey,"₦ 23,200"
Defacto Man - Slim Fit Mont-Black,"₦ 16,800"
Men's Winter Warm Down Jacket,"₦ 70,000"
Praaaaempire Dark Green Armless Puffer Jacket With Zip,"₦ 20,000"
Praaaaempire Black Long Sleeve Puffer Jacket,"₦ 24,000"
Halloween Skull Human Skeleton Print Long Sleeve Hooded Men's Sweatshirt-black,"₦ 23,988"
Halloween Skull Human Skeleton Print Long Sleeve Hooded Men's Sweatshirt-brown,"₦ 23,988"
