Item,Price
Motorbikes Ride On Power Bike Motorcycle,"₦ 115,000"
"Raleigh 26"" Adult Bicycle_raleigh Dual Suspension Mountain Bike","₦ 117,900"
Motorbikes Kids Children Power Bike Motorcycle Tricycle Bicycle,"₦ 120,000"
Mirror View Smart Flip Case For Huawei P40 Lite E Luxury Original Magnetic Fundas P 4,"₦ 17,555"
Bike Front Tube Bag Waterproof Bicycle Phone Holder Case Bracket Rack,"₦ 6,240"
"Bicycle Light USB Rechargeable,Adjustable Focus","₦ 7,643"
Motorbikes Ride On Kids Power Bike Triicycle,"₦ 105,000"
Bottle P  Holder Bi Y Le Water Bottle Holder Bike Drink MTB Road Bike-black-7*14.4cm,"₦ 9,190"
TWITTER Carbon Fiber Road Bike,"₦ 950,000"
Bicycle Seatpost Aluminum Alloy Fixie,"₦ 5,996 - ₦ 8,187"
Mountain Bike Seat Tube Aluminum Seat Post,"₦ 9,732 - ₦ 10,488"
Bike Bicycle Frame Tube Mobile Phone Holder Mount Handlebar 5.8 inch,"₦ 5,760 - ₦ 9,120"
TWITTER Carbon Fiber,"₦ 950,000"
Motorbikes Ride On Power Bike Motorcycle Tricycle Bicycle,"₦ 110,000"
Mountain Bike Pedal Parts Shimano PD M520 SPD Clipless Pedals,"₦ 37,344 - ₦ 39,644"
Bike Disc Brake Rotor Bolts Alloy Steel T25 Bicycle Bolts Screw,"₦ 1,787 - ₦ 1,920"
ART-L29N Phone Flip Fundas Luxury Magnetic Cover For P40Lite 40 360 P40 Smart E Mirror Lite View P Original Huawei Case LiteE On,"₦ 16,553"
1 P S MTB Road Bike Bi Y Le Inner Brake  Able  Ore Wire 1.5m Brake Line-sivler,₦ 440
LED Bike Light USB Rechargeable Mountain Road Bike Flashlight Headlight,"₦ 12,841"
Titanium Alloy Bike Water Bottle Cage Durable And Lightweigh,"₦ 12,307"
Mountain Bike Road Bike 13T Aluminum Jockey Wheel Rear Derai,"₦ 2,103 - ₦ 2,175"
Bicycle Transmission Set 2-3Speed,"₦ 17,297 - ₦ 17,413"
Bike Stem Raiser Bicycle Fork Stem Extender,"₦ 4,701"
For New Kobo Nia 2020 Release Tempered Guard Screen,"₦ 15,960"
Bike Front Frame Bag Storage Phone Case Holder Handlebar Organzier,"₦ 31,498"
