Item,Price
Tactical Chest Bag Outdoor Sport Army Chest Bag Daypack Light Brown,"₦ 13,935"
Tactical Chest Bag Outdoor Sport Army Chest Bag Daypack Black,"₦ 13,935"
SALEM Mattress Protector/Blue,"₦ 7,000"
Tactical Chest Bag Outdoor Sport Army Chest Bag Daypack Brown,"₦ 13,935"
Business Backpack Fidget Anti-stress Business Computer Bag Pink,"₦ 19,736"
Food Container Outdoor BBQ Storage Container Green,"₦ 28,627"
1 Set Travel Spice Bag Leakproof Spice Salt BBQ Sauce Oil A,"₦ 9,038"
Insulation Basket Washing Clothes Laundry Basket Bin Yellow and Green,"₦ 20,495 - ₦ 24,218"
Jogging Fanny Pack Solid Color Sports Fanny Pack ,"₦ 11,475"
Insulation Basket Washing Clothes Laundry Basket Bin Red,"₦ 20,495"
Food Container Outdoor BBQ Storage Container Yellow,"₦ 24,229 - ₦ 28,627"
Heated Sleeping Bag Pad Mattress Usb Warm Heating Mat With,"₦ 28,090"
Storage Box Multifunctional Brass Outdoor Waterproof Organizer ,"₦ 7,171 - ₦ 10,488"
Work Apron Skin-touching Multi-pockets Apron Orange,"₦ 14,133"
1 Set Heating Lunch Pouch Electric Heating Bag with Mesh Pocket Grey,"₦ 14,951"
Campsite Storage Strap Abrasion Resistance Camping Clothesline Black,"₦ 15,074"
Business Backpack Fidget Anti-stress Business Computer Bag Blue,"₦ 19,736"
Outdoor Container Brass Outdoor Waterproof Storage Container ,"₦ 8,446 - ₦ 17,226"
Bag Wear-resistant First Aid Bag Black,"₦ 27,095"
1 Set Electric Heating Bag Camping Picnic USB Thermal Bag Grey,"₦ 14,951"
Bag Wear-resistant First Aid Bag Grey,"₦ 27,095"
Bag Wear-resistant First Aid Bag Khaki,"₦ 27,095"
Storage Basket Waterproof Rope Storage Basket Yellow,"₦ 19,192"
Storage Basket Waterproof Rope Storage Basket Rose Red,"₦ 19,440"
Auto Car 58 X 42 Cm Leather Seat Back Storage Bag Organizer,"₦ 15,569"
Storage Basket Waterproof Rope Storage Basket Ash grey,"₦ 19,440"
Storage Basket Waterproof Rope Storage Basket Black,"₦ 19,440"
Graffiti Art Slim Tablet Hard Shell Cover Case For Huawei,"₦ 15,140"
For Pencil 2 1 Case Soft Silicone Carrot Holder,"₦ 13,420"
Storage Basket Sundries Storage Basket Ash grey,"₦ 19,440"
