Item,Price
Gold Collagen Pure For People Aged 25 Years And Above. 10 Days Program,"₦ 34,000"
"Fairhaven Health FertilAid For Men, Motility Boost & Count Boost Combo","₦ 80,000"
"Fair Haven FertilAid,motility Boost,count Boost","₦ 70,000"
"Piping Rock Hyaluronic Acid, 100 Mg","₦ 7,500"
"Piping Rock Bitter Melon 1200 Mg, Maintains Blood Sugar - 100 Capsules","₦ 6,900"
Rabbit Litter Box Plastic Bunny Hamster Toilet Bedding Cage Yellow,"₦ 16,699"
"Mason Natural Ultra Collagen With Horsetail Concentrate Supports Healthy Hair, Skin And Nail","₦ 13,000"
Mason Natural Beta Carotene 25000iu,"₦ 5,200"
Natureworks Swedish Bitters 250ml....,"₦ 45,000"
Plastic Hamster And Bath Container Pet Bathing Bowl Hamster Toilet S,"₦ 4,164"
Mason Natural Ultra Collagen With Horsetail Concentrate,"₦ 15,900"
Hamster Sand  Pet Bathroom Acrylic Toilet Bathtub Pentagonal,"₦ 15,176"
Lick Lick Pad Dog Washing Distraction Device blue,"₦ 3,186"
Rabbit Litter Box Corner Potty Trainer Pet Toilet For Hamster Yellow,"₦ 17,306"
Bunny Litter Box Open Training Tray Corner Potty For Squirrel White,"₦ 11,209"
Pet Litter Pan Trainer Bunny Litter Box Cleaner Yellow,"₦ 18,663"
Hamster Bathroom Hamster Andbox Pet Bathing Bowl For Gerbil Guinea S,"₦ 4,341"
Natureworks Swedish Bitters 250ml..,"₦ 50,000"
Rabbit Litter Box Corner Potty Trainer Small Animal Litter Tray Yellow,"₦ 20,251"
Rabbit Litter Box Corner Potty Trainer Toilet For Guinea Pig Yellow,"₦ 16,133"
Bunny Litter Box Rabbit Toilet Triangle Potty For Ferret Squirrel Blue,"₦ 7,420"
Clear Hamster Bathroom Cage Toilet Hamster Andbox For Gerbil S,"₦ 4,001"
Rabbit Litter Box Corner Potty Trainer Bedding Cage Potty Box Yellow,"₦ 18,306"
Triangle Potty Trainer Corner Toilet Rabbit Litter Box For Guinea Pig,"₦ 6,630"
Rabbit Litter Box For Hamster Guinea Pig Pet Toilet Small Yellow,"₦ 20,251"
Rabbit Litter Box Corner Potty Trainer Plastic Pet Toilet For Yellow,"₦ 18,663"
Rabbit Litter Box Potty Trainer Small Animal Litter Tray For Yellow,"₦ 17,959"
Corner Large Toilet Guinea Pig Rats Small Animal Yellow,"₦ 17,959"
Hamster Sand  Pet Bathroom Toilet Sand Bath Rectangular,"₦ 21,112"
Hamster And Bath Container Digging And Container For Mall Animals S,"₦ 1,656"
Wooden Platform Station Exercise Toy For Pet Parrot Rat Hamster Mouse,"₦ 3,441"
Wooden Pet Parrot Platform Stand Rack Toy Hamster Perches For Bird,"₦ 3,441"
Rabbit Litter Box Potty Trainer Bedding Cage Potty Box Toilet Yellow,"₦ 20,251"
Small Animal Toy Toilet Rabbit Cage Corner Type 1 -  Color,"₦ 6,403"
Plastic Hamster Bathroom Hamster Andbox Hamster Litter Box For S,"₦ 4,529"
Bunny Litter Box Triangle Potty Pet Toilet For Small Animals White,"₦ 10,662"
