Item,Price
Small Pet Breathable Mesh Harness Leash For Hamsters Rabbits Gray M,"₦ 1,961"
Small Pet Breathable Mesh Harness Leash For Hamsters Rabbits Red S,"₦ 1,696"
Tactical Dog Harness Leash Metal Buckle MOLLE German Shepherd Pet Large Big Dogs Military Training,"₦ 52,137"
Hamster Rabbit Guinea Pig Rat Ferret Breathable Mesh Harness Pink S,"₦ 1,040"
Hamster Rabbit Guinea Pig Rat Ferret Breathable Mesh Harness Blue S,"₦ 1,705"
Rabbit Vest Harness Breathable Leash Set Jacket Coat For Bunny L Red,"₦ 6,672"
Dog Sled Harness Pet Weight Pulling Sledding Harness Mushing X Back Harness For Large Dogs Husky Ca,"₦ 25,409"
Rabbit Harness Breathable Soft Denim Jacket Coat For Walking L Yellow,"₦ 7,561"
Rabbit Harness Multipurpose Breathable Denim Jacket Coat For L Yellow,"₦ 6,542"
Nylon Heavy Duty Dog Pet Harness Collar Adjustable Padded Extra Big Large Medium Small Dog Harnesse,"₦ 14,716"
Cute Bunny Pet Vest Accessories Outdoor Leash Rabbit Clothes Harness Strap Leash For Rabbit Dress C,"₦ 12,200"
Luminous Pet Leash Adjustable Puppy Harness Dog Vest Collar Dogs Traction Rope With Safety Reflecti,"₦ 10,023"
Pet Dog Harness And Leash Set Reflect Light Adjustable Puppy Harness No Pull Outdoors Travel Harnes,"₦ 10,644"
Hamster Rabbit Guinea Pig Rat Ferret Breathable Mesh Harness Blue M,"₦ 2,085"
Pattern Pet Chest Strap Explosion Proof Punch Pet Traction Rope Dog  Chest Strap Pet Products Dog A,"₦ 9,708"
Pet Dog Harness Small Dog Chain Teddy Vest Puppies Chest Strap Breathable Mesh Harness Leash Pet Se,"₦ 8,130"
Chest Strap Nylon Waterproof Adjustable Customize Dog Name For Vest Collar Small Large Chihuahua Hu,"₦ 24,542"
Cat Accesories Pink PU Leather XS S M L XL Safety Name Personalized Chihuahua Necklace Small Cat Le,"₦ 8,099"
1pc Vest Harness Leash Adjustable Mesh Vest Dog Harness Collar Chest Strap Leash Harnesses With Tra,"₦ 8,477"
Hamster Rabbit Guinea Pig Rat Ferret Breathable Mesh Harness Pink L,"₦ 2,146"
Small Pet Breathable Mesh Harness Leash For Hamsters Rabbits Red M,"₦ 1,967"
Reflective Dog Collar Harness For Medium Large Dogs Breathable Adjustable Pet Harness Vest Pasted P,"₦ 24,402"
Small Pet Breathable Mesh Harness Leash For Hamsters Rabbits Peach M,"₦ 1,498"
Small Animal Walking Jacket Harness Leash Small Critter With Hat L Red,"₦ 6,066"
Pet Hamster Chest Straps Leashes Small Animal Harness Training Peach M,"₦ 1,498"
1pc Durable Dog Leash Nylon Pet Noose Loop Lock Clip Rope Harness Dogs Grooming Table Arm Bath Rest,"₦ 5,994"
Dog Leash Nylon Pet Leash For Dog & Cat Running Or Training Collar And Harness(#collar Harness YEL),"₦ 13,652"
Big Bow_knot Dog Harness And Leash Set French Bulldog Plaid Vest Small Dog Clothes Supplies Pitbull,"₦ 13,231"
