Item,Price
"Edifier TWS1 PRO True Wireless Earbuds,Bluetooth V5.2 Headphone,CVC8.0 Noise Canceling, IP65 Dustproof & Waterproof,One-Step Pairing","₦ 17,766"
"Edifier X5 Wireless Headphone, Bluetooth 5.0 Headset Earpiece,Noise Cancelling,Touch Contro,IP55 Dustproof & Waterproof, Deep Bass","₦ 11,100"
Wireless Fingerprint Touch Noise Cancelling Headphones,"₦ 4,190"
Edifier G2000 32W PC Computer Speakers Bluetooth USB 3.5mm AUX Inputs RGB Lights Multimedia Speaker,"₦ 27,264"
Pro3 In-Ear Wireless Sports Headphones Stereo Headphones,"₦ 3,324"
V9 Earhook Wireless Bluetooth Earphone Headset Noise Cancelling,"₦ 3,660"
Nail Art Kit Nail Dryer Nail Drill Machine With Accessories,"₦ 10,500"
WiFi Adapter - 600Mbps 5Ghz USB - Ethernet - Black,"₦ 4,190"
True Wireless Earphones Bluetooth 5.0,"₦ 4,100"
Laptop Tablet Stand Foldable 10 Level Adjustable Computer Notebook Holder Bracket,"₦ 3,999"
Smart Watch Touch Screen Sports Waterproof Fitness Tracker,"₦ 9,990"
Women Wallet Long Purse Love To You Solid Color Clutch Vintage Fashion Money Clip Coin Pocket,"₦ 1,350"
Tripod Stand Holder Bluetooth Remote Control Stretchable Adjustable Camera Phone Stand Mount Holder,"₦ 4,999"
Women Gothic Heart Rhinestone Pendant Velvet Choker-Black,₦ 581
1 Pair Women Necklace Best Friends Letters Engraved Jewelry Freinds Matching,₦ 735
1 Pair Couple Bracelet Chic Adjustable Resin Key Heart Lock Chain Bangle For Dating-Black,₦ 535
Ear Rings Dangle Exquisite Eye-catching 2 Colors Imitation Pearl Tassel Earrings Dangle For Banquet-Silver,₦ 440
1 Pair Iron Eardrops Strong Magnetic Health Pierced Round Magnetic Iron Eardrops Earrings Gift For Women-White,₦ 441
Bracelet Braided With Magnetic Buckle Faux Leather Versatile Men Hand Chain For Anniversary-Coffee,₦ 555
His Queen Her King Couple Bracelet Matching Bangles Lovers Jewelry Gift,₦ 498
1 Pair Ear Studs Heart-shaped Easy To Match Alloy-Golden,₦ 570
Ear Rings Dangle Exquisite Eye-catching 2 Colors Imitation Pearl Tassel Earrings Dangle For Banquet-Golden,₦ 446
Multi-Layer Heart Pendant Anklet Women-Silver,₦ 715
Lady Elegant Multi-Layer Round Long Drop Dangle Hook Earrings Jewelry Gift-Silver,₦ 606
Bracelet Braided With Magnetic Buckle Faux Leather Versatile Men Hand Chain For Anniversary-Black,₦ 517
Ethnic Silver Plated Bead Braided Red Rope Bracelet Unisex Lucky Wrist Decor-Red,₦ 221
For OPPO A53 Transparent TPU Case,₦ 860
Camera Precision Hole PP Protective Case For IPhone 13 (Gray Blue),"₦ 1,010"
For Xiaomi Redmi Note 10S Shockproof Soft TPU Case,"₦ 1,780"
For Apple AirPods Pro Ultra-thin Silicone Wireless Earphone Protective Case(Yellow),₦ 900
For Samsung Galaxy A32 4G Protective Case (Transparent),"₦ 1,010"
For Tecno Spark 7 Pro Camon 17 Sunrise Phone Back Cover,"₦ 1,818"
Protective Case For Huawei Honor 9 Lite (Transparent),"₦ 1,040"
For Itel P38 Pro TPU Phone Case(Black),"₦ 1,160"
For Google Pixel 4a TPU Ultra-Thin Transparent Mobile Phone Case,"₦ 1,080"
For Xiaomi Redmi 9C TPU Case,₦ 840
For Samsung Galaxy M11 / A11 TPU Case,₦ 890
TPU Phone Case For Tecno Spark 7P,"₦ 1,310"
For Redmi Note 5A Prime Case Cute Superman Phone Back Cover,"₦ 1,863"
For Infinix Note 12 VIP TPU Phone Case(Pudding Black),"₦ 1,190"
TPU Case For Tecno Pova 5G,"₦ 1,290"
Adjustable Laptop Tablet Stand Multi-angle Laptop Holder,"₦ 7,790"
4.4/6.5/8.5/10/12 Inch LCD Drawing Tablet For Children's Toys Painting Tools Electronics Writing Board Boy Kids Educational Toys,"₦ 3,500 - ₦ 8,980"
3.5mm AUX Audio Cable Speaker Receiver Adapter Dongle USB Bluetooth,"₦ 2,440"
Yvonne YT601-2 USB2.0 U Disk 16GB OTG Double Ports,"₦ 2,760"
2x Micro USB Female To USB2.0 A Male Converter Connector Adapter For,₦ 549
DP To Mini DP Adapter DisplayPort Male To Mini Display Port Female,₦ 704
Portable USB Hub USB Adapter 4-in-1 Aluminum Alloy Hub With,"₦ 2,550"
PIX-LINK USB Wi-Fi Range Extender Wireless Wifi Repeater,"₦ 12,510"
External Hard Drive Disk Case Shockproof EVA Case 2.5in HDD,"₦ 3,440"
2.4G Wireless Optical Mouse Vertical Mouse 6 Keys Ergonomic,"₦ 10,620"
2.4G Wireless Mouse Portable Ultra-thin Mute Mouse 4 Keys,"₦ 2,580"
Oraimo 27000mAh Massive Power Charing Bank Traveller 3 Byte,"₦ 19,000"
Eaget Pen Flash Drive 3.0 32GB - Metal OTG Micro USB Type-C,"₦ 2,718"
Fingerprint Touch Bluetooth Headset Noise-cancelling Stereo Headset,"₦ 3,500"
Men's Trendy Zipper Comfort Hoodie Jacket Sweatshirts - White,"₦ 2,999"
Yemlays Men's Casual Shoe -blue,"₦ 4,980"
Men Breathable Outdoor Casual Shoes -black,"₦ 7,800"
Edifier M206BT 68Watts Channel Bluetooth Multimedia Speakers,"₦ 36,355"
Mens Patterned Vintage T-shirts Floral Short Sleeve Shirts,"₦ 3,500"
Blackview FS-Android Smartphone Oscal C20 Dual-SIM 3G 1+32GB 6.088 Inch Screen -Black,"₦ 50,545"
4 In 1 Set Handbags Single Shoulder Messenger Bag-Brown,"₦ 6,200"
"UMIDIGI A13S (4GB,64GB ROM) 6.7"" HD+ 5150mAh Global Version (16MP+8MP+5MP)+8MP-Galaxy Blue","₦ 86,900"
Edifier W800BT PLUS Wireless Bluetooth Headset,"₦ 22,718"
Blackview Oscal C20Pro 32GB+2GB 4G Android 11 Smartphone 6 Inch Screen 8MP+2MP Camera-Blue,"₦ 56,973"
4 In 1 Women Crossbody Handbag -Pink,"₦ 6,990"
Eaget Pen Flash Drive 3.0 64GB - Metal OTG Micro USB Type-C,"₦ 2,900"
Big Size Men Glossy Tassel Brogue Leather Shoes-black,"₦ 24,500 - ₦ 27,300"
Crocodile Pattern Mens Bullock Leather Shoes Oxford Formal Shoes Retro Big Size,"₦ 18,703 - ₦ 26,481"
Children's High-end Sports Shoes Leather Shoes School,"₦ 17,888"
Luxury Fashion Large Size 38-46 Loafers Men's Wedding Shoes Casual Rivet Leather Shoes Black,"₦ 27,000 - ₦ 28,900"
Top Quality Mens Shoes - Brown,"₦ 27,500 - ₦ 28,900"
Work Safety Steel Toe Slip-on Breathable Puncture-proof Shoe,"₦ 23,333 - ₦ 31,111"
Children's Sports Leather Shoes Boys And Girls Flat Running Shoes White,"₦ 20,450"
Men's Fashion Anti Slip Flip Flop - Blue,"₦ 16,850"
Mens Casual Leather Wedding Dress Formal Shoes Loafers-Black,"₦ 27,000 - ₦ 29,900"
Men's Formal Shoes Alligator Leather Loafers Tassel Business Casual Moccasins,"₦ 26,000 - ₦ 27,900"
EUR Size 38-44 Mens Shoes Brogues Slip-On Loafers British Style Tassel Leather Shoes Black,"₦ 27,000 - ₦ 28,900"
Men's New Fashion Breathable Leather Shoes -black,"₦ 19,963"
HOT Mens Dynamic Formal Leather Shoes-Brown,"₦ 24,900 - ₦ 25,900"
2020 Big Size Men Glossy Tassel Brogue Leather Shoes-Black,"₦ 24,900 - ₦ 26,900"
Skmei Top Luxury Brand Watch Men's Sports Watch Fashion Digital Watches Gift For Male SKM1142,"₦ 7,100"
Yazole Top Luxury Brand Watch Famous Fashion Sports Cool Men Quartz Watches Wristwatch Gift For Male YZL281H-A-Brown,"₦ 3,220"
Skmei 1503 Men Sport Watches Waterproof Outdoor Wristwatch,"₦ 10,440"
Yazole Brand Watch Sports Men Watches Male Wristwatch YZL509,"₦ 5,490"
Wlisth Mens Watches Waterproof Quartz Luxury Wristwatch Steel Strap,"₦ 7,600"
Business Men's Watch Blue-ray Plexiglass Quartz Watch,"₦ 2,688"
Nibosi Sport Watch Men Business Waterproof Quartz Watch Man Mens Watchs Clock,"₦ 24,853"
Yazole Top Luxury Brand Watch Famous Fashion Sports Cool Men Quartz Watches Wristwatch Gift For Male YZL271X-Black,"₦ 4,930"
Charm Bracelets Handmade Wrap Bracelets Stainless Steel Love Leather Bracelet Gold,"₦ 3,500"
Olevs Ultra Thin Quartz Watch Men OLEVS Luxury Rose Gold Men Watch,"₦ 11,660"
Yazole Brand Watch Sports Men Watches Male Wristwatch YZL448,"₦ 4,350"
Mini Focus Watch Fashion Men Sport Watches Male MF0052G.02,"₦ 12,510"
1 Pair Couple Watch Automatic Quartz Romantic Watch,"₦ 11,920"
Men Ultra Thin Quartz Watch Luxury Wrist Watches Business Leather Watches Rose Waterproof  -Gold,"₦ 8,520"
Mini Focus Watch Fashion Men Sport Watches Male MF0244G.01,"₦ 16,570"
Fingerprint Touch Bluetooth 5.0 Earphones Wireless 9D Stereo Professional Headset.,"₦ 3,634"
Fingerprint Touch Bluetooth 5.0 Earphones,"₦ 3,220"
Bluetooth Headset +  Smart Watch Waterproof Sports Combination Affordable Set,"₦ 8,640"
"10"" LED Selfie Ring Light Circle Fill Light Dimmable Round Lamp Makeup Photography RingLight","₦ 9,190"
Bluetooth Speaker Subwoofer Portable ABS 3W HiFi Sound-Green,"₦ 7,446"
Smart Watch Full Touch Screen Watch - For Android & IOS.,"₦ 5,470"
IOS Smart Watch Fitness Sleep Watch - For Android & IOS,"₦ 3,300"
Bluetooth 5.0 PRO3 Wireless Earphone Waterproof Earbuds Air3 Business Big Batteries Headset,"₦ 3,270"
"Wireless Earbuds, Bluetooth 5.0 Headset Earpiece,Noise Cancelling,Touch Contro..","₦ 3,550"
"10"" Live Ring Light LED Ringlight With Tripod Stand And Phone Holder.","₦ 14,260"
Bluetooth Headset +  Smart Watch Waterproof Sports Combination Affordable Set.,"₦ 9,970"
Bluetooth Sport Pedometer Watch  Smartwatch For All Phone,"₦ 3,250"
S8 Mini Wireless In-ear Stereo Earbuds,"₦ 1,600"
Men's Cotton Short Sleeve Casual Shirt - Brown,"₦ 12,999"
Incerun Men Trendcy Leisure Hit Color 3/4 Sleeve Top Shirt,"₦ 6,020"
Fredd Marshall Men's Fashion Denim Short Sleeve Shirt - Blue,"₦ 12,999"
Men Design Shirt Plus Size Long Sleeved Plaid Casual Classic Shirt Slim Shirt,"₦ 8,399"
Incerun Men Casual Coconut Tree Print Shirts Short Pant Set,"₦ 9,280"
100% Ick Cotton Men's Gold High-end Embroidery Cotton Party Work Shirt Long Sleeve,"₦ 18,999"
2 Piece Set Men's Linen Print Long Sleeve Shirt With Casual Long Pants,"₦ 29,944"
Men's Printing Check Line Polka Dot Business Shirt Long Sleeve Wholesale,"₦ 11,499"
Men Shirt Long Sleeve New Palace Printed Flower New,"₦ 12,999"
3 In 1 Men's Casual Office Short Sleeve Shirt - Multicolor,"₦ 22,330"
New Men's Grey Shirt Long-sleeved Solid Color Slim Shirt,"₦ 8,800"
Incerun Men Leisure Stand Collar Short Sleeve Pants-Grey,"₦ 5,020"
Summer Short Sleeve Linen Vintage Shirts,"₦ 7,810"
2 Pieces (White+Black)= 6999 Men's Printed Rose Flower High-end Business Shirt,"₦ 18,999"
Plus Size Vintage Beach Hawaiian Shirt Long Sleeves Printed Floral Shirt,"₦ 8,399"
4FT Black Dustproof Double Layer Rabbit Cage Hutch Cover 210D Waterproof Oxford Item Condition:New With Tags,"₦ 33,790"
1 Litre Calf Milk Bottle Good Quality Feeder With Teat For Cattle,"₦ 5,738"
Cat Dog Cage Storage Bag Washable Pet Supplies Durable Canvas Green,"₦ 10,596"
Dog Universal Playpen Cover Sun Rain Proof Top Fits All Cage Octagonal,"₦ 16,817"
Wattle Leak Proof Portable 780ml Travel Water Bottle / Clear,"₦ 3,307 - ₦ 3,959"
Foldable Pet Playpen Iron Fence Puppy Kennel House Exercise Training Puppy Kitten Space Dogs Supplies rabbits guinea pig Cage,"₦ 48,224"
Small Pet Breathable Mesh Harness Leash For Hamsters Rabbits Gray M,"₦ 1,961"
10/12/15/20cm Rabbit Feeder Nipple Drinker Bowl Hutch-,"₦ 3,395"
Water Pump 220V 5W/20W/35W/45W/80W Motor Submersible 0.9-3.6M 500-3500L/H-5W,"₦ 11,469"
Same Size Ratio Smartphone Model Of IPhone 6 (Gold),"₦ 30,190"
Reptile Red/White Heat Lamp Light Holder Poultry Chicken Brooder,"₦ 5,459"
20pcs Automatic Bird Coop Feed Poultry Chicken Fowl Drinker Water Drinking Cups,"₦ 8,590"
160L/H 7V Solar Powered Fountain Water Pump Panel Fish Tank Garden Bath Patio 60cm Height,"₦ 18,687"
"100cm/39.37"" Tease Cat Scratching Rodent Wand Toy, Black Short Rod Built-in Squeaky Tube, Cartoon Plush Replacement Head,","₦ 14,299"
Pet Cat Toothbrush I Puffer Fish Shape Pet Toy Kitty Teeth C,"₦ 6,908"
Plastic Comb Foundation I Comb Beehive Frames Honey Bee Beek,"₦ 18,061"
Apple IPhone XS Of Same Size Ratio Smartphone Model(Silver),"₦ 41,790"
Automatic 56 Chicken Egg Turner Tray Quail Duck Incubator With 110V/220V Motor-220V,"₦ 16,314"
14pcs Rabbit Chew Toys Set Wooden Timothy Hay Sticks Flower Lollipops,"₦ 5,345"
Apple IPhone XR Of Same Size Ratio Smartphone Model(Black),"₦ 45,090"
Terminator Lice Nit Free Kids Hair Rid Headlice Comb,"₦ 3,899"
Bluetooth Smart Anti-lost Alarm Factory Foreign Trade Explosion Models Promotional Gifts Christmas Gifts Household Items Intelligent-Black (black),"₦ 7,156"
Portable Solar Powered Air Pump Pond Fish Tank Oxygenator Aerator,"₦ 16,153"
Bird Nest Colorful Print Parrot Cage Navy Blue,"₦ 4,695 - ₦ 7,949"
Brooder Lamp,"₦ 2,545"
Reptile Poultry Basking Light Bulb Infrared  Lamp Breeding Heat,"₦ 4,517"
Small Pet Breathable Mesh Harness Leash For Hamsters Rabbits Red S,"₦ 1,696"
Fish Feeder Digital Fish Tank Electrical Timer Feeder A,"₦ 18,564"
Foldable Small Animals Playpen Cage For Hamster Rabbit Gerbil Sky Blue,"₦ 6,031"
Queen Bee Excluder Brood Hive Box Worker Honeybee,"₦ 17,190"
Pet Harness Vest Set Pet Walking Leash For Small Animals Cat Dog,"₦ 1,956 - ₦ 6,014"
0.9-1.8L/min Solar Powered Fish Tank Air Pump Aquarium Oxygenator Pool Aerator,"₦ 18,601"
HOOPET Pet Dog Samurai Sword Sound Toy Puppy Teeth Chew Training Toys  Cat Scratch Product,"₦ 7,099"
2pcs  12V 1000L/H Electric / Solar Brushless Motor Water Pump Aquarium Fountain New,"₦ 21,099"
Cat Toys Scratching Post Cat Scratcher Sisal For Needlework Rope Desk Foot Chair Legs Binding Natural Material Sharpen Claw,"₦ 13,799 - ₦ 14,599"
Vacuum Gravel Cleaner Fish Tank Water Change Siphon Pump,"₦ 14,390"
13mm 14-26'' NEW Pet Collar Gold 316L Stainless Steel Dog Chain Cuban Curb Link # 26 Inch-26 In,"₦ 12,202"
30ml Feeding Syringe Nozzle Reusable Livestock Veterinary Supplies Plastic Steel,"₦ 7,652"
50ml Feeding Syringe Luer Lock Tip Reusable Livestock Supplies Veterinary,"₦ 7,709"
