Item,Price
4FT Black Dustproof Double Layer Rabbit Cage Hutch Cover 210D Waterproof Oxford Item Condition:New With Tags,"₦ 33,790"
Reptile Red/White Heat Lamp Light Holder Poultry Chicken Brooder,"₦ 5,459"
Plastic Comb Foundation I Comb Beehive Frames Honey Bee Beek,"₦ 18,061"
20pcs Automatic Bird Coop Feed Poultry Chicken Fowl Drinker Water Drinking Cups,"₦ 8,590"
Reptile Poultry Basking Light Bulb Infrared  Lamp Breeding Heat,"₦ 11,820"
Pet Cooling Mat Tapis Rafraichissant Matelas Pour Chien Chat Summer Coolcore Fabric 50X40,"₦ 25,490"
Queen Bee Excluder Brood Hive Box Worker Honeybee,"₦ 17,190"
Brooder Lamp,"₦ 2,545"
154/132/56/48 Eggs Automatic Incubator Hatcher Tray Incubation Accessory 12/220V Chicken Duck Goose Pigeon Parrot Breeding Hatching Home 220V 56 Eggs,"₦ 31,490"
Flexible Reptile Lamp Holder Light Bulb Clip Table Lamp Holder Black,"₦ 15,597"
E27 Reptile Heating Lamp IR No Lights Chicken Coop Brooder 250W White,"₦ 13,846"
Pets Infrared Heat Emitter Reptile Basking Heat Light Bulb Brooder,"₦ 5,670"
7 Eggs Incubator I Poultry Incubator Brooder Digital Tempera,"₦ 33,597"
Reptile Food Dish Water Bowl Supplies For Tortoise  Spider Type Type 2,"₦ 2,287"
Pet Poultry Infrared Heat Emitter Reptile Basking Heat Light Brooder,"₦ 16,763"
Waterproof Large Bird I Cage Cover Parrot Canary House Prote,"₦ 25,813"
Waterproof Large Bird Cage Cover Parrot Canary House Protect,"₦ 20,884"
156/56/42 Egg Incubator Incubation Turner TrayHatchery Machine Hatching For Small Domestic Chicken Duck Goose Pigeon Parrot Breeding Home 220V 56 Eggs,"₦ 34,290"
20pcs Automatic Bird I Coop Feed Poultry Chicken Fowl Drinke,"₦ 6,223"
3 X Livestock I Cattle Goat Sheep Pig Animal Cow Ear Tags ID,"₦ 52,645"
3 X D Livestock Cattle Goat Sheep Pig Animal Cow Ear Tags ID,"₦ 43,335"
LCD Electronic Digital Baby Scale Newborn Pet Weighing 1G-5000G HD Display Black,"₦ 18,790"
Reptile Heat Light Clamp Lizard Lamp UVA UVB Bulb With Clip Turtle,"₦ 7,855"
220V Poultry Infrared Heat Emitter Reptile Basking Heat Light Brooder,"₦ 14,838"
Queen Bee Excluder M Brood Hive Box Worker Honeybee,"₦ 12,480"
Reptile Plastic Cage Breeding Habitat Lizard Snake Amphibian Frog,"₦ 1,151"
20pcs 20ML Plastic Jug Pour Spout Surface Kitchen Tool Measuring Cup,"₦ 3,331"
Reptile Tank Spiders Turtle Lizard Acrylic Breeding Box Vivarium Black,"₦ 7,256"
Bee Entrance Feeder Beekeeping Beehive Honey Beekeeper Bee Hive Keeping Equip,"₦ 6,590"
A Beekeeping Flow Auto Honey Hive Beehive Frames Food-grade BPA-free Plastic,"₦ 43,481"
5 X Livestock K Cattle Goat Sheep Pig Animal Cow Ear Tags ID,"₦ 75,610"
22 Egg Automatic Digital Incubator Chicken Poultry Hatcher Temperature Control,"₦ 62,990"
Hog Ring Pliers J Tool M Clips Staples Bird Chicken Mesh Cag,"₦ 9,612"
Livestock Cattle Goat Sheep Pig Animal Cow Ear Tags ID Lables Tag 1-100Pc Number,"₦ 21,490"
Electric Heating Mat Pad Heat Heater Heated Warming Pet Cat Dog Timed Payment 9W Square:40cm,"₦ 14,890"
4FT Black Dustproof Double Layer Rabbit Cage Hutch Cover 210,"₦ 26,818"
