Item,Price
Recht Becker Walkabout FreeStyle Sneakers- Black/White Strip,"₦ 4,890"
Soft Sole Joker Jogging Shoes-purple,"₦ 3,480"
Soft Sole Joker Jogging Shoes-red,"₦ 3,480"
Korean Fashion Casual Shoes For Teenagers-black,"₦ 3,780"
Women's Fashion Casual Sports Shoes-black,"₦ 3,480"
Personalized Mesh Rubber Soft Sole Ladies Sneakers,"₦ 5,888"
Soft 12 Golden Fit WM Sneakers,"₦ 6,980"
New High-Quality  Sneakers-white.,"₦ 8,000 - ₦ 8,400"
"Ladies Sneakers Shoes, Breathable Mesh Sock","₦ 7,899"
Air Mesh Breathable Ladies Footwear Women Flat Sneakers,"₦ 5,888"
Soft Bottom Versatile Casual Shoes-purple,"₦ 3,480"
Bullock Ladies Patent Sneakers,"₦ 12,999"
Female Lightweight Running Shoes Slip On Tennis Sneakers,"₦ 7,699 - ₦ 7,799"
Unisex White Lovely Sneakers- White,"₦ 7,999 - ₦ 8,550"
Ladies Lovely Trendy Sneakers- Pink,"₦ 8,550"
Ladies Lian Light Feel Sneakers- Black,"₦ 5,550"
Unisex Black Smart Sneakers - Black,"₦ 7,650 - ₦ 7,799"
"Women Sneakers Shoes, Breathable Mesh Sock","₦ 9,000 - ₦ 10,000"
Ladies Light Vulcanised  Sneakers _ White,"₦ 6,000"
Ladies Lovely Trendy Sneakers- White,"₦ 8,550"
"Ladies Sneakers Shoes, Breathable Kiok Sock","₦ 7,899"
Women's Sneakers-pink,"₦ 2,990"
"Unisex Sneaker, Breathable Black","₦ 7,999"
Classic Sneakers For Ladies-Grey,"₦ 8,000"
Soft Bottom Versatile Casual Shoes-white,"₦ 3,480"
Ladies Flat Platform Shoe Sneakers Female Women Shoe-black,"₦ 14,500"
Ladies Cute Unique Sneakers- White & Grey,"₦ 7,500"
Ladies Classic Comfortable Fashion Sneakers,"₦ 7,499"
Soft Bottom Versatile Casual Shoes- Black and Red,"₦ 3,480"
"Ladies Sneakers, Breathable Black","₦ 8,000 - ₦ 8,500"
Daisy Flying Weaving Running Shoes-pink,"₦ 3,480"
Ladies Breathable Mesh Sock Sneakers -White,"₦ 5,550"
Ladies Yell Feel Sneakers- Black,"₦ 5,000"
Ladies Light Weight Casual  Sneakers,"₦ 12,599 - ₦ 13,099"
"Ladies Sneakers Shoes, Breathable Mesh Sock-Black","₦ 5,550"
Women's Sneakers-black,"₦ 2,990"
Ladies Flat Platform Shoe Sneakers Female Women Shoe-white,"₦ 14,500"
Ladies Flat Platform Shoe Sneakers Female Women Shoe-grey/pink,"₦ 14,500"
Classic Sneakers For Ladies -black,"₦ 8,000"
