Item,Price
Hips High Waist Womens Sports Breathable Yoga Shorts Girl,"₦ 5,520"
Hips High Waist Womens Sports Breathable Yoga Shorts,"₦ 4,718"
Women's Running Sports Shorts Workout Yoga Shorts,"₦ 8,380"
"Women High Waist Leggings Yoga Shorts,Running Tights Sports Shorts（Blue）","₦ 9,380"
DAGi BLUE Women Shorts Activewear,"₦ 9,120"
Women's Graffiti Print Casual Sports Short Sleeve Tracksuit,"₦ 18,944"
Women's Running Sports Shorts Workout Yoga Shorts（Navy Blue）,"₦ 8,380"
"Women High Waist Leggings Yoga Shorts,Running Tights Sports Shorts（Purple）","₦ 9,380"
"Women High Waist Yoga Shorts,Women's Running Tights Sports Shorts","₦ 8,680"
DAGi BLACK Women Skirts,"₦ 9,600"
