Item,Price
"Original Pregnancy Support Abdomen, Waist, Back, Abdominal Support, Pelvic Support, Maternity Belt","₦ 11,220 - ₦ 12,230"
Pregnancy Belt Prenatal Special Belly Support Belt,"₦ 12,999"
"Pregnancy Support Belly, Waist Back, Maternity Belt WHITE","₦ 12,000"
"Original Pregnancy Support Belly,waist,back,Maternity Belt","₦ 12,500"
Upgraded 3 -in-1 Pregnancy/maternity/ Pelvis Support Belt,"₦ 12,799"
"Pregnancy Support Belly,waist,back,Maternity Belt","₦ 12,000"
"Pregnancy Support Belly,waist,back,Lumber Maternity Belt","₦ 19,999"
Pregnancy/nursing Mom Support  Belly Band/ Extension Belt,"₦ 7,699 - ₦ 7,999"
3 In 1 BELLY/ABDOMEN/PELVIS POSTPARTUM BELT (XXL),"₦ 10,000"
Maternity Belt With Detachable Shoulder Straps Pregnancy,"₦ 14,000 - ₦ 18,000"
Pregnancy Support Elastic Soft Waist Back Abdomen Belly Band Brace Maternity Belt Extra Strong,"₦ 19,999"
Pregnancy Support Maternity Belt,"₦ 10,000"
Pregnancy Support Belly Maternity Belt,"₦ 10,000"
"Black Pregnancy Support Belly,waist,back,Maternity Belt","₦ 9,910"
3 In 1 BELLY/ABDOMEN/PELVIS POSTPARTUM BELT (XL),"₦ 10,000"
Single Postpartum Girdle Support Post Partum Belly Belt Body Shapewear,"₦ 8,999"
Pregnancy/Maternity Belt With Detachable Shoulder Straps,"₦ 15,000"
"Maternity Belt With Detachable Shoulder Straps,Belly Band Lower Back Support, Pregnancy Belt ,Comfortable Pelvic Support","₦ 19,999"
3 In 1 Postpartum Girdle Recovery Belly Postnatal Post Pregnancy Tummy Belt,"₦ 15,500"
"PINK Pregnancy Support Belly,waist,back,Maternity Belt","₦ 9,910"
"White Pregnancy Support Belly,waist,back,Maternity Belt","₦ 9,910"
Pregnancy Support Waist Back Abdomen Belly Band Maternity,"₦ 12,000"
"Pregnancy Support Belly,waist,back,Maternity Belt WHITE","₦ 14,500"
Leopard Print Maternity Belly Wrap Durable Abdominal C-secti,"₦ 6,026 - ₦ 7,316"
Pregnancy Support Waist Abdomen Belly Brace Maternity Belt,"₦ 15,000 - ₦ 19,000"
Maternity Belt With Detachable Shoulder Straps,"₦ 15,000"
