Item,Price
Women's High Heels - Black,"₦ 7,727"
Ziling European Transparent Ladies Heel,"₦ 28,000"
PU Ankle-wrap Strap High Heels Pointed-on Stiletto Sandals,"₦ 21,890"
New Look Green Flocked Leopard Print Courts,"₦ 19,500"
Women's Heels Wedding Court Crystal Word Band Shoes Sliver,"₦ 31,890"
Women's High Heels Stiletto New Pointed Single Shoes,"₦ 21,556"
Women's Trendy All Match Wedding Shoes-gold,"₦ 22,814"
24 7 FASHION PU Ankle-wrap Strap High Heels Pointed-on Stiletto Sandals,"₦ 21,890"
Women's Pointed Dress Party Sexy Nightclub Thin Shoes White,"₦ 31,572"
Nine West Marisa Ankle Strap Pumps - Black,"₦ 49,500"
Bigtree Women's Pointed Dress Party Sexy Nightclub Thin Shoes White,"₦ 24,065"
Women's Shoes Bow Bridesmaid Shoes High Heels Stiletto Crystal Fashion High Heels,"₦ 31,167"
Trending Transparent High Heels,"₦ 25,000"
Ladies High Heel Bow Fashion Sandals-black,"₦ 25,463"
Women's Hollow Wedge Mesh Sandals Sandals,"₦ 19,556"
