Item,Price
4pcs Gas Cooker Protector Gas Stove Burner Protectors - Reusable,"₦ 3,495"
Golden Barber Chair Pendant Necklace Sweater Bag Car Chain For,"₦ 2,151"
Hypertension Patch Clean  Vessel Plaster Patch Sticker 12 Pcs/2,"₦ 4,207"
Sitz Bath For Toilet Electric Folding For Pregnant Women Cleanse,"₦ 25,847"
12 Pcs/2 Bag Hypertension Patch Plaster Sticker Hypertension Care,"₦ 4,270"
12 Patch High  Pressure Plaster Herbal Patch Hypertension Clean,"₦ 5,516"
Sitz Bath Tub Basin Electric Bathroom Portable For Cleanse Elderly,"₦ 10,536"
50x Candles Drip Protectors Protective Disk Plate Parts For Ear Care,"₦ 6,109"
Premium Golden Alloy Car Barber Chair Pendant Necklace Adjustable Seat,"₦ 2,534"
Herbal 12 Pcs/2 Bag Hypertension Patch Plaster Patch Sticker Health,"₦ 1,762"
Sitz Bath Tub Basin Electric Foldable For Pregnant Women Soothes,"₦ 25,847"
50pcs Candles Drip Protectors Personal Protective Disk Supplies For,"₦ 5,417"
Palm Chest Percussion Aids Mucus For Expectoration Clear For Adult L,"₦ 5,149"
Palm Chest Percussion Aids Percussion Treatment For For Adult Large,"₦ 13,965"
Professional Silicone Chest Physical  Aids For Children Small,"₦ 11,079"
12 Pcs/2 Bag Hypertension Patch Natural Herbs Clean  Vessel Patch,"₦ 4,355"
50pcs Candles Drip Protectors Protective Disk Supplies For Ear Care,"₦ 5,630"
Aids Break Up Mucus Percussion Treatment For For Adult Large,"₦ 11,025"
50pcs Candles Drip Protectors Protective Disk Drip Guard For Ear Care,"₦ 5,037"
Chest Physical  Aids For Expectoration Problem For Adult Large,"₦ 11,025"
Physical  Aids Mucus Removal Device Nursing Clear For Adult L,"₦ 5,956"
Palm Chest Percussion Aids Percussion Treatment For For Children Small,"₦ 12,784"
Professional Chest Physical  Aids Mucus Removal For Adult Large,"₦ 13,371"
Palm Chest Percussion Aids Mucus Removal Device For For Adult Large,"₦ 10,652"
Palm Chest Percussion Aids Percussion Treatment For Clear For Adult L,"₦ 6,750"
Chest Physical  Aids Break Up Mucus Phlegm For Children Small,"₦ 10,819"
Physical  Aids Mucus Removal Device Nursing For Children Small,"₦ 8,618"
Flip X1 Cover Style C9A Neffos Phone C9s Lite Silicone Stand C7 Case TP-Link N1 For Leather Case Protection C9 Y7 Wallet Back,"₦ 16,474"
50pcs Candles Drip Protectors Protective Disk Plate Accessories For,"₦ 4,866"
Sitz Bath Tub Basin Electric Folding For Pregnant Women Fits Most,"₦ 25,353"
50-Pack Candles Drip Protectors Candling Protective Disk For Ear Care,"₦ 6,380"
Sitz Bath For Toilet Electric Bathroom For Pregnant Women Fits Most,"₦ 23,820"
50-Pack Candles Drip Protectors Personal Protective Disk For Ear Care,"₦ 2,367"
Professional Silicone Chest Physical  Aids For For Adult Large,"₦ 12,322"
50x Candles Drip Protectors Personal Protective Disk Drip Guard For,"₦ 5,417"
50x Candles Drip Protectors Protective Disk Accessories For Ear Care,"₦ 6,109"
