Item,Price
Trendyol Collection Swim Shorts - Multi-color - Textured,"₦ 6,747"
Trendyol Collection Swimshorts - Multi-colored - Tropical,"₦ 6,747"
Trendyol Collection Swim Shorts - Navy Blue - Striped,"₦ 6,747"
Defacto Men Swimwear Nathan Swimming Short -Blue,"₦ 4,560"
Trendyol Collection Swim Shorts - Gray - Striped,"₦ 6,747"
Trendyol Collection Swimshorts - White - Geometric Pattern,"₦ 6,747"
DAGi FUCHSIA Men Swimming Trunks,"₦ 7,680"
Men's 2 And 1 Short Sleeved Shirt And Shorts Suit-Multicolore,"₦ 16,400"
Colins Green Men Swim Short,"₦ 15,200"
Men's Beach Pants-Paint Blue,"₦ 4,889"
DAGi BLACK Men Swimming Trunks,"₦ 5,760"
DAGi NEON Men Swimming Trunks,"₦ 7,680"
Men\'s Beach Pants-Black BackGround + Leaves,"₦ 5,999"
Men's Beach Pants-Black And White MIX,"₦ 4,889"
Men\'s Beach Pants-Rainbow Stripes,"₦ 5,999"
Men's Beach Pants-Colorful Paint,"₦ 4,889"
DAGi BLACK Men Slips Underwear,"₦ 4,320"
DAGi Turquoise Swimming Trunk - Plain - Beachwear For Men,"₦ 7,680"
Men's Beach Pants- Black Pattern On White,"₦ 5,999"
Men's Beach 2 In 1 Short Sleeve T-shirt And Shorts Suit - Black,"₦ 11,818"
Swimming Trunks Plus Size 6XL Mens Swimsuit  Summer Swimmming Shorts,"₦ 19,800"
DAGi Navy Blue Swimming Trunk - Striped - Beachwear for Men,"₦ 7,680"
Men's Cotton And Linen Long Sleeve Shirt In Solid Color - Red,"₦ 12,109"
Men's Vintage Oil Painting Shirt - Black,"₦ 7,518"
DAGi GREEN Men Swimming Trunks,"₦ 8,160"
Men\'s Beach Pants-Orange,"₦ 5,451 - ₦ 5,599"
Men's Plaid Long Sleeved Loose Shirt - Black,"₦ 7,545"
Men's Beach Pants-American Flag,"₦ 4,889"
Men's Cotton And Linen Solid Long Sleeve Shirt - Brown,"₦ 12,109"
Men's Cotton And Linen Long Sleeve Shirt In Solid Color - Gray,"₦ 12,109"
Black - Men's 2 In 1 Short Sleeved T-shirt And Shorts Trouser Suit,"₦ 9,736"
Men\'s Beach Pants-Paint Color 1,"₦ 5,999"
Men Shark Skin Water Repellent Professional Competitive Swimming,"₦ 20,200"
Men's Beach 2 In 1 Short Sleeve T-shirt And Shorts Set - Blue,"₦ 11,818"
Men's Beach Pants-Colorful Stripes,"₦ 4,889"
Men\'s Beach Pants,"₦ 5,441"
