Item,Price
Baofeng 6 Pcs - Walkie Talkie Two Way Radio BF-888S,"₦ 51,000"
Baofeng BF-888S Walkie Talkie Two Way Radio,"₦ 10,000"
Microphone 3.5mm Home Stereo MIC Desktop Stand For PC YouTub,"₦ 10,810"
Baofeng Radio Baofeng Bf-888s C2,"₦ 47,600"
"Motorola Talkabout T800 Two-Way Radios, 2 Pack, Black/Blue","₦ 205,600"
Walkie Talkie Earpiece - 1 Piece,"₦ 8,500"
Baofeng BF-C5 5W Walkie Talkie Two Way Radio,"₦ 15,000"
2P S Rt-388 Walkie Talkie 0.5W 22 H Two Way   For Kids  Hildren Gift-blue,"₦ 14,410"
Baofeng BF-888S Walkie Talkie Two Way Radio-2 Pcs,"₦ 23,000"
Baofeng BF-888S Walkie Talkie Two Way Radio - 6 Pieces,"₦ 75,000"
Baofeng BF-A5H Walkie Talkie Two Way Radio,"₦ 15,000"
T388 UHF Two Way    Hildren's Walkie Talkie Mini Toy Gifts For Kids-black-US Version,"₦ 7,240"
"Radio Harness Chest Rig Bag Pouch,Holster,Vest","₦ 8,838"
Jack Stereo Cable Gold 6.5mm Male/3.5mm Female Audio Adapter,"₦ 10,324"
Mi Rophone Speaker Headset V4/V6 Interphone Universal Headset  -black-clip,"₦ 6,290"
Baofeng Walkie Talkie 2way Radio,"₦ 12,000"
Baofeng Radio Baofeng Bf-888s C5,"₦ 47,000"
Smart Watch + Bluetooth Headset Waterproof Sports Combination Affordable Set,"₦ 5,704"
Wood Bracelet Jig Tool Survival Wristband Knitting Tool DIY,"₦ 11,200"
Adjustable Ring Light Podcast Streaming Microphone PC Laptop,"₦ 52,141"
Baofeng Two Way Radio Walking Talkie - 2 Piece,"₦ 23,900"
Repeater Box For Two Way   For BAOFENG For TYT For WOUXUN For KIRISUN For HYT Relay Box DIY Repeater For Walkie Talkie-Black,"₦ 9,840"
General Craft Teeth Crampons Winter Snow Skiing Mountain Climbing Non Slipping Shoe Cover,"₦ 12,630"
Baofeng 2 Pieces Security Phone Walkie Talkie BF-888S,"₦ 22,000"
5pc Windshield Headset Wind Shield Pop Filter Mic Cover Foam,"₦ 9,993"
Microphone 3.5mm 3 In1 Portable Lapel Lavalier Condenser Mic,"₦ 9,149"
SKMEI Outdoor Man Sports Compass Watches Hiking Digital LED Electronic Watch Chronograph Men Clock - Black By HonTai,"₦ 26,806"
PC USB Condenser Microphone Kit 192kHz Studio Recording Mic,"₦ 62,911"
SKMEI 1231 SKMEI 1231 Outdoor Man Sports Compass Watches Hiking Digital LED Electronic Watch - Black,"₦ 26,791"
Outdoor Man Sports Military 50M Waterproof Compass Watches Hiking Digital LED Electronic Watch,"₦ 22,185"
SKMEI Outdoor Man Sports Compass Watches Hiking Digital LED Electronic Watch Chronograph Men Clock - Green,"₦ 27,254"
Wired Microphone 3.5 Mm Jack,"₦ 2,989"
SKMEI Outdoor Man Sports Compass Watches Hiking Digital LED Electronic Watch Chronograph Men Clock - Black,"₦ 27,254"
General Craft Interphone Headset M Connector Air Duct Earphone,"₦ 10,260"
General Craft 270x140CM Hammock Camping 210T Nylon Double Hanging Lightwei,"₦ 13,155"
General Craft 270x140CM Hammock Camping 210T Nylon Double Hanging Lightweight Swing Bed Outdoor Travel Parachute Sleeping Bed,"₦ 13,155"
