Item,Price
Onshore Boat Ship Swimming Pool Lifebuoy Life Saving  Lifeguard Rescue Flotation Buoyancy Ring Safety With Perimeter Rope + Key Holder,"₦ 45,999 - ₦ 180,500"
Toddler Swim Vest Foam Lifejacket With Adjustable Safety Light Blue M,"₦ 23,890"
Adult Professional Life Jacket,"₦ 13,500"
Toddler Swim Vest Foam Lifejacket With Adjustable Safety Strap Pink L,"₦ 24,990"
3mm Neoprene Stretch Men Wetsuit Size Small To 3X Plus Size Full S,"₦ 26,466"
Ultralight Scuba Diving Tank Back Pack Bracket Oxygen Bottle Support,"₦ 35,628"
Simulation Soft Plastic Toy Snake Simulation Snake Rubber,"₦ 1,112"
DC 12V 108 LED Swimming Pool Light RGB White Warm White,"₦ 16,752"
Kids Dudu Fish Inflatable Swim Vest,"₦ 7,400"
Big Size Water Shoes Beach Diving Yoga Shoes-Yellow,"₦ 16,600"
Female Swimming Suit 3xl,"₦ 10,200"
Swimmers Training Snorkel Pool Open Water Swimming Breath Tube W Blue,"₦ 12,193"
Anti Fog Diving Mask Snorkel Set Swimming  Scuba Champagne,"₦ 11,151"
Girls' One Piece Swimsuit Children's Climbing Suit Baby Swim,"₦ 22,100"
Breathable Foam Life Jacket Kayaking Life Vest Floating Black XS,"₦ 15,610"
Adult Swimming Snorkel Mask,"₦ 15,000"
"LED Reflective Running Vest,Adjustable Elastic Running","₦ 8,536"
"Silicone Swimming Web Fins Hand Flippers Training Gloves, M(Blue)","₦ 2,380"
Pair Swimming Dive Flexible Silicone Ear Plugs Earplug Blue,₦ 368
SAFETY LIFE JACKET,"₦ 16,900"
Diving  Holder Wrap Neoprene Sheath Leg Straps With 2 Pockets Red,"₦ 13,886"
Men Women Diving Socks Soft-sole Outdoor Swimming Shoes Breathable Beach Socks Black,"₦ 2,020"
Swimwear Thin Underwear,"₦ 3,873"
Home Slate Wall Mounted Floating Shelf Bracket Keys Books CDs Purple,"₦ 4,414"
"Scuba Diving Light, 1000 Lumen Underwater Flashlight, IP68","₦ 15,152"
Surfing Swimming Diving Quick-Drying Wet Suit Full Body 2mm Men Neoprene Wetsuit For Cold Water,"₦ 40,371"
Swimming Ear Plug Diving Earplug Shower Noise Cancelling With Blue,₦ 385
Body Glove 3T BAREFOOT WARRIOR MEN'S,"₦ 12,720"
Fire Fighting 6in1 Tru Ks Tank Navy Boat Building Blo Ks  Hildren Toys-8612-6,"₦ 2,440"
SUPER YAMAHA LIFE JACKET,"₦ 34,999"
Water Sports Vest Traditional Neoprene Life Jacket Various Sizes S-XL,"₦ 14,501"
Scuba Diving Safety Line  Snorkeling Spearfishing,"₦ 3,730"
Fishing Suit Adult Swimming Buoyancy Vest Adjustable,"₦ 21,341"
12 LED Lamp Mist Maker Fogger For Reptile Tank Water Fountain Pond,"₦ 7,856"
Life Jacket For Safety,"₦ 22,899"
Of Color 10W Flood LED Silver Case Black Underwater 1pcs,"₦ 21,379"
Life/safety Swimming Jacket/vest,"₦ 15,000"
Waterproof 50 100 LED Fairy Lights Solar Powered Rope Tube,"₦ 9,410"
