Item,Price
Waterproof Portable Foldable M Picnic Camping Pocket Blanket,"₦ 7,580"
Waterproof Portable Foldable H Picnic Camping Pocket Blanket,"₦ 8,538"
1 LB Gas M Propane QCC1 Regulator Valve Propane Refill Adapt,"₦ 8,141"
Lightweight Aluminum Alloy M Folding Table For Camping Festi,"₦ 30,726"
BBQ Portable Camping M Side Folding Tables Picnic Table BBQ,"₦ 39,995"
Camp Funiture Camping Hanging Rack Outdoor Folding Ultralight Shelf Portable Storage Triangle Medium Rack,"₦ 32,490"
Clip-On Portable Folding Camping Picnic Outdoor Beach Chair Side Table For Drink,"₦ 13,890"
Tablet Case For Ipad 10.2 Inch 2020 8th Generation Smart,"₦ 34,920"
Portable Camping Table Aluminum Alloy Folding Camp Table Lightweight Outdoor For Camping Hiking Backpacking Picnic Large Table,"₦ 84,890"
2 Sizes Beach Mat Outdoor Portable Waterproof Travel Camping Folding Picnic Pad #3,"₦ 19,890"
Outdoor Camping Picnic Blanket Large Waterproof Beach Sand Portable Mat PVC 145 X 200,"₦ 32,090"
1 LB Gas Propane QCC1 Regulator Valve Propane Refill Adapter Outdoor BBQ Hunt,"₦ 11,890"
Foldable Portable Table Roll Up Aluminum Alloy Picnic Outdoor Camping Ultralight,"₦ 82,490"
Portable Camping Table Aluminum Alloy Folding Camp Table Lightweight Outdoor For Camping Hiking Backpacking Picnic 1 X Large Connection Port,"₦ 34,290"
Outdoor Camping Picnic Blanket Large Waterproof Beach Sand Portable Mat PVC 195 X 200,"₦ 30,890"
BBQ Portable Camping A Side Folding Tables Picnic Table BBQ,"₦ 39,995"
BBQ Portable Camping Side Folding Tables Picnic Table BBQ Mat,"₦ 53,490"
Portable Camping Table Aluminum Alloy Folding Camp Table Lightweight Outdoor For Camping Hiking Backpacking Picnic 1 X Lamp Post + Hook,"₦ 32,990"
Waterproof Portable Foldable A Picnic Camping Pocket Blanket,"₦ 7,659"
Portable Camping Table Aluminum Alloy Folding Camp Table Lightweight Outdoor For Camping Hiking Backpacking Picnic 4 X Desktop Boards,"₦ 42,490"
Portable Camping Table Aluminum Alloy Folding Camp Table Lightweight Outdoor For Camping Hiking Backpacking Picnic 1 X Small Connection Port,"₦ 31,990"
Camp Funiture Camping Hanging Rack Outdoor Folding Ultralight Shelf Portable Storage Triangle Large Rack,"₦ 37,890"
Portable Camping Table Aluminum Alloy Folding Camp Table Lightweight Outdoor For Camping Hiking Backpacking Picnic Small Table,"₦ 56,890"
