Item,Price
Folding Wayfarer Sunglasses With Case Shades For Women Men,"₦ 9,167"
Men Sunglasses UV Protection Fashion Sun Glasses For Women,"₦ 4,502"
Men's UV Protection UV400 Polarized Sunglasses - Black,"₦ 5,882"
New Sunglasses Unisex Multiple Color Options ​Brand Retro Hip Hop,"₦ 4,559"
Sunglasses Unisex Women's Fashion Items European And American Fashion,"₦ 5,183"
New Sunglasses Unisex Multiple Color European And American Fashion All-match,"₦ 4,559"
New Sunglasses Unisex Multiple Color Options ​Brand 926,"₦ 4,256"
New Sunglasses Unisex Multiple Color Brand Summer Must-have Trendy Items,"₦ 3,942"
New Sunglasses Unisex Multiple Color Women's Trend Essentials Versatile Styles,"₦ 3,743"
New Sunglasses Unisex Multiple Color Trendy Essentials Hip-hop Street Style,"₦ 3,859"
Uv Protection UV400 Polarized Sunglasses For Men,"₦ 6,118"
Casual Simple Men’s Glasses,"₦ 8,000"
"Tribe Oakley Jawbreaker Replacement Refill Compatible Lens,","₦ 35,231"
"Rudy Project Propulse Sports Sunglasses, White Gloss (Frame)","₦ 276,813"
Rudy Project Impact X Photochromic 2 Discoloration Lens Cutl,"₦ 372,266"
Men's UV Protection UV400 Polarized Sunglasses - Wooden Legs,"₦ 8,745"
Spider Monster Domestic Sports Polarized Sunglasses Fishing,"₦ 95,887"
Rudy Project Impact X Photochromic 2 Laser Lens Cutline Spor,"₦ 372,266"
Sodamon RETRON RT3301 Series Polarized Discoloration Sports,"₦ 166,956"
"Rudy Project Magnus Sports Sunglasses, Blue Navy Matte (Fram","₦ 314,995"
"Rudy Project Cutline Sports Sunglasses SP633969-0014, Gloss","₦ 276,813"
