Item,Price
Defacto 2 Piece Set Babyboy Regular Fit Bibs -Ecru,"₦ 2,400"
Adjustable Bag Rack(Holds 16 HandBags),"₦ 3,500"
Defacto 2 Piece Set Babyboy Standart Fit Bibs -Orange,"₦ 2,280"
Adjustable Bag Rack (Holds 16 HandBags),"₦ 3,500"
Defacto 2 Piece Set Babyboy Standart Fit Bibs -Ecru,"₦ 2,400"
Defacto Girl Hat -Beige,"₦ 3,800"
Adjustable Bag Rack(Holds HandBags),"₦ 3,500"
Short-sleeved Pregnant Women In Summer Dress Large Size T,"₦ 13,900"
Defacto Babyboy Standart Fit Bibs -Navy,"₦ 2,040"
Snow Ski Safety Glasses  Anti Fog Motorcycle Colorful,"₦ 5,101"
Cycling Glasses Sport Bike Running Sunglasses Polarized PC White,"₦ 1,785"
Safety Lab  Eye Protector Clear Protective Glasses UV Black,"₦ 1,241"
Adjustable Bag Rack(Holds 16 Hand Bags),"₦ 4,500"
Ninja Face Mask Hat Polyester,"₦ 3,137 - ₦ 4,424"
2 Pairs Merino Wool Thermal Socks,"₦ 22,300"
2021 Middle-aged And Elderly Large Size Mothers Wear Dres,"₦ 13,900"
Snow Ski Safety Glasses  Windproof Motorcycle Blue Colorful,"₦ 8,631"
Snow Sports Ski  Anti-fog Snowboard Glasses UV Black+Gray,"₦ 3,711"
Ladies Beach Hat,"₦ 5,500"
Ski  UV Protection Adult Eyewear Over Glasses For Snow Green,"₦ 8,369"
Ski  UV Protection Snow  For Skate Outdoor Sports Red,"₦ 8,360"
2PcsSet Men Hat Neck Warmer Windproof Winter Men Ladies Knit Skull Cap Scarf Kit Wine Red,"₦ 9,609"
"Ski Snowboard  Protection Anti Fog For Men, Women - Multicolor","₦ 2,453"
Glasses Interchangeable Lens Anti UV For Sport Combat Black,"₦ 10,436"
Safety Lab  Eye Protector Clear Protective Glasses  Black,"₦ 2,239"
Snow Ski Safety Glasses  Windproof ATV Cycling Black Colorful,"₦ 3,418"
1 Pair Snowboarding Socks Windproof Winter Children Girls Boys Sports Snow Stockings Black Gray,"₦ 4,286"
Ear Caps Elastic Reusable Ear Warmer White,"₦ 4,576"
Neck Warmer Winter Thermal Women Bear Cross Scarf ,"₦ 3,528"
Scarf Warm Cycling Neck Warmer Black,"₦ 3,650"
Ski Snowboard  Professional Snow Glasses With Rose Red Lens,"₦ 4,482"
Middle-aged And Elderly Mothers Wear New Fashion Cheongsa,"₦ 13,900"
Parents And Children Wear Mother And Woman Dress Summer F,"₦ 29,990"
Genuine Spring And Autumn Short Coat Network Celebrity Go,"₦ 29,990"
