Item,Price
Heart Anklets Women Beach Barefoot Jewelry Non Fade Adjustable Pendant Silver,"₦ 5,233"
FeiraDeVaidade Tassel Anklet Bracelet Layered Anklets-Gold,₦ 475
FeiraDeVaidade Crown Heart Love Charm Women Anklet-Gold,₦ 695
FeiraDeVaidade Love Multilayer Anklet-Silver,₦ 296
FeiraDeVaidade Ankle Bracelets Letter A Anklet-Gold,₦ 189
FeiraDeVaidade Women Rhinestone Adjustable Star Bead Ankle Chain-Silver,₦ 378
Vintage Floral Hollow Heart-shaped Pendant Anklet For Ladies,"₦ 1,220"
FeiraDeVaidade Ankle Bracelets Letter A Anklet-Silver,₦ 195
FeiraDeVaidade Simple Weaving Craft Anklet-multicolor,"₦ 1,192"
Women Multi Layer Pineapple Star Beads Dangle-Gold,"₦ 2,887"
Silver Stainless Steel Anklet Bracelets,"₦ 4,000"
FeiraDeVaidade Love Charm AnkletPlated Boho Beach Dainty Cute Anklet-Gold,₦ 856
FeiraDeVaidade Love Charm AnkletPlated Boho Beach Dainty Anklet-Silver,₦ 841
Stainless Steel Anklet Bracelet Gold,"₦ 8,000"
Heart Anklets Women Beach Barefoot Jewelry Non Fade Adjustable Pendant Gold,"₦ 5,233"
FeiraDeVaidade Double Layer Tortoise Conch Anklet-Blue,₦ 461
FeiraDeVaidade Layered Anklet Gold Heart Anklet-Gold,₦ 291
3pcs Anklet Bracelet Set Women Anklet Bracelet Leg Chain Gold Jewelry Butterfly,"₦ 1,999"
Women Shiny Rhinestone Anklet Foot Chain Ankle Bracelet,"₦ 1,220"
FeiraDeVaidade Boho Butterfly Anklets For Women-Silver,₦ 345
FeiraDeVaidade Pineapple Layered Anklets Adjustable-Silver,₦ 284
FeiraDeVaidade 8Pcs Wavy Arrow Tail With Toe Ring-Rose Gold,"₦ 1,663"
FeiraDeVaidade 60PCS Titanium Nose Rings Hoop-multicolor,₦ 480
FeiraDeVaidade Punk Moon Sun Waist Chain Belt-Silver,"₦ 2,104"
Thigh Leg Chain Bikini-Silver,"₦ 4,350"
FeiraDeVaidade Heart Nose Ring Studs Body Jewelry-Gold,₦ 359
FeiraDeVaidade Multilayer Turtle Pendant Anklets-Black,₦ 373
FeiraDeVaidade Dainty Number Ankle Bracelets-Gold,₦ 626
FeiraDeVaidade Evil Eye Ankle Bracelet For Women-Gold,₦ 334
FeiraDeVaidade Upper Arm Bracelet Boho Adjustable-Silver,₦ 729
FeiraDeVaidade Fashion Beach Beaded Anklet-Silver,₦ 336
Boho Lady Beaded Starfish Charm Barefoot Sandal Foot,"₦ 1,340"
FeiraDeVaidade Tiny Moon Anklets Simple Dainty-Silver,₦ 562
FeiraDeVaidade Evil Eye Ankle Bracelet For Women-Silver,₦ 341
FeiraDeVaidade Layered Anklet Gold Heart Anklet-Silver,₦ 313
FeiraDeVaidade Boho Style Pentagram Double-layer Anklet-H01,₦ 398
