Item,Price
Sexy Full Panties Set Of 4 In 1,"₦ 4,700"
Sexy Bum Ladies Niker Panties 4pieces,"₦ 3,450"
Best Ladies Panties Set Of 6 In 1,"₦ 4,500 - ₦ 4,900"
Sexy V- Shape Low Waist  Lace Panties  ( 12pieces),"₦ 4,800"
Sexy Cottton Love Gstring For Ladies 4pieces,"₦ 3,999"
Sexy Condom Seamless Thong Panties Set Of 6 In 1,"₦ 4,500"
Ladies Condom Panties Set Of 6,"₦ 5,000"
Ladies High Waist Pants 6pcs,"₦ 4,000"
Tummy Control Ladies Pants 6pieces,"₦ 5,500"
Very Sexy Underwear G-string Pants - 4 Piece,"₦ 4,200"
Quality Lace Sexy Women Panties 6pcs,"₦ 4,500"
Sexy V- Shape Low Waist  Lace Panties  ( 6 Set),"₦ 2,999"
Sexy Bum Ladies Nika Panties 4pieces,"₦ 4,400 - ₦ 4,600"
Trendin Ladies Cotton Thong 6 In 1,"₦ 4,400"
Sexy Thong G-String 4 In 1 Pack,"₦ 3,999"
Very Sexy Lovers Lady Gstring Pants 4pieces,"₦ 4,000"
Panties Set Of6 Panties In 1,"₦ 3,500"
Sexy Ladies Panties Set Of 6pcs,"₦ 4,200 - ₦ 4,500"
Ladies Cotton  Pants 6pcs,"₦ 3,500"
Sexy Breathable Ladies Underwear Panties 4pieces,"₦ 5,500"
Ladies Sexy Panties Set Of 6pcs,"₦ 4,500"
ALL LADIES LACE Panties Set Of 12,"₦ 4,500"
Seamless Beautiful Sexy Ladies Pants 6pcs,"₦ 4,500"
Ladies Sexy Panties Love Gstrings 6 In A Pack  (set Of 6) Any HIP Size,"₦ 4,800 - ₦ 4,990"
Sexy Ladies Cotton Panties 6pcs,"₦ 3,300"
High Waist Tummy Control Ladies Panties 4pcs,"₦ 4,500"
Ladies High Waist Sexy Panties 3pcs,"₦ 3,000"
Cotton And Lace Panties For Ladies 6in1,"₦ 3,000"
Seamless Ladies Pants 4 In 1 Pack,"₦ 4,000"
Sexy Baby Panties ( 6 Set) Different Colours,"₦ 4,000"
Ladies Night Wear - Top And Short -,"₦ 5,450"
Ladies Beautiful Night Gown,"₦ 6,999"
Big Sexy Ladies Panties Set Of 6pcs,"₦ 4,000"
Ladies Cotton Panties Set Of Six,"₦ 3,500 - ₦ 4,000"
