Item,Price
Womens Nurse Fancy Dress Up Costume Bedroom Outfit Lingerie Sexy,"₦ 4,773"
2pcs 100 Cotton Women School Girl Uniform Mini Skirt Role Play,"₦ 11,691"
Naughty Sexy Women's School Girl Uniform Lingerie Fancy Dress Blue,"₦ 5,263"
Sexy Women School Girl Uniform Student Cosplay Fancy Dress Blue,"₦ 5,908"
Nurse Costume Accessory Garter  Pen Halloween Fancy Dress,"₦ 2,072"
Lingerie Uniform Cosplay Costume For Women Gift Maid Apron,"₦ 10,160"
Women School Girl Uniform Nightclub Cosplay Costume Outfit Pink,"₦ 2,397"
Underwear Strapless Front Buckle Invisible Bra With Adjustable Back Ladies Bra,"₦ 6,000"
Women's Native Indian American Costume - Tassel Suede Dress & XL,"₦ 18,750"
Women Leather Harness Body Chest Adjustable Waist Strap Belt Goth Punk,"₦ 3,117"
Belly Dance Waist Chain Hip Skirt Scarf With Sequins Coin Yellow,"₦ 2,931"
Leather Harness Body Chest Adjustable Waist Straps Belt Goth Punk,"₦ 9,724"
Belly Dance Costume Hip Scarf Hip Wrap Scarf Gold Coin Sequin Belt Red,"₦ 2,931"
Maid Costume Japanese Anime Maid Dresses Classic With Apron Lolita,"₦ 18,029"
Sexy Womens Black Leather Cage Bra Body Harness Straps Cosplay,"₦ 3,224"
Belly Dance Waist Chain Hip Skirt Scarf With Sequins Coin Deep Purple,"₦ 2,931"
Hen Party Bunny Set Rabbit Ear Headband Cuff Collar Costume,"₦ 4,046"
"Bunny Costume Cosplay Lingerie And Tails Bodysuit, Girls Ladies Outfit","₦ 6,067"
Sexy Cosplay Bunny Costume Fancy Adult Dress Rabbit Set Headband Cuffs,"₦ 4,475"
Prettyia Japanese School Girl Uniform Sailor Anime Fancy Dress Blue,"₦ 5,908"
Women Belly Dance Dancing Coins Tassels Gypsy Headband Head Band Gold,"₦ 3,831"
Kids Mermaid Tail Mermaid Swimsuit Swimming Children Mermaid Costume For Girls Birthday Pool Party Gift,"₦ 29,990"
Ladies Fancy Dress Up Nun Magic Nun Halloween Party Cosplay Black  L,"₦ 8,847"
Sexy Women's Bunny Halloween Costume Outfit Cosplay Fancy Dress,"₦ 5,393"
Sailor Anime School Girl Uniform Student Costume Lingerie Crop Pink,"₦ 5,643"
Women Student Uniform School Girl Crop Top Mini Skirt Dress Blue,"₦ 6,159"
Women Bunny Costume Girls Ladies Lingerie And Tails Bodysuit Roleplay,"₦ 15,097"
Maid Apron Lingerie Uniform Cosplay Costume Short Dress No Knee Socks,"₦ 7,900"
Naughty Sexy Women's School Girl Uniform Lingerie Fancy Dress Pink,"₦ 6,770"
Maid Costume Beer Wench Dirndl Dress Sweet German Clothes Women For,"₦ 22,900 - ₦ 23,628"
Sexy Women Bunny Halloween Costume Outfit Cosplay Costume Black,"₦ 4,674"
