Item,Price
Portable Plaid PU Leather Handbag - Grey,"₦ 3,990"
2PCS Woman Leather Messenger Shoulder Bag Handbag Satchel-Pink,"₦ 3,000"
4 In 1 Set Handbags Single Shoulder Messenger Bag-Brown,"₦ 5,690"
Lady Bag Lady Bag Tramp Bag Messenger Shoulder Bag Sling Bag Purse Briefcase,"₦ 6,890"
Ladies Leather Mini Hand Bag - Black,"₦ 8,999"
Shoulder Bag - Black,"₦ 5,990"
Handbag For Women - Black,"₦ 9,740"
Women Handbag Shoulder Bag Ladies Messenger Bag Hairball Bags High Quality Bag,"₦ 9,990"
Shoulder Bag - Handbag For Women - Black,"₦ 5,990"
Top Handle High Quality 3In1 Women's Hand Bag - Black,"₦ 10,999"
Mummy Diaper Backpack Mummy Bag Large Capacity Bag Baby Nursing Bag,"₦ 5,400"
Women Fashion Shoulder Bag With Chain Handle Ladies Crossbody Bags Tote Bucket Handbag(#Black),"₦ 5,895"
New Girls Mini Jelly Bag- Black,"₦ 1,500"
High Quality Patent Leather Top Handle Shiny Handbag - Wine,"₦ 13,650"
Ladies Mini Hand Bag - White,"₦ 6,500"
Latest Fashion Ladies Two Piece One Shoulder Handbag,"₦ 10,389"
Soft PU Leather Women Purple Underarm Bag Retro Solid Color Ladies Handbags Fashion Design Girls Sm,"₦ 6,693"
The Latest European And American Fashion Women's Four-piece Shoulder Handbag,"₦ 10,866"
4Piece Handbags Set Ladies Shoulder Bags Women Tote Bag,"₦ 9,500"
The Latest European And American Retro Stone Pattern Handbag-brown,"₦ 8,280"
Ladies Leather Mini Hand Bag- Brown,"₦ 6,999"
New Solid Color Fashion Beads Tassel Three-piece Portable Shoulder Messenger Bag,"₦ 8,280"
High Quality Rhinestone Classy Female  Handbag,"₦ 39,300"
New European And American Retro Three-piece Solid Color Portable Shoulder Bag,"₦ 8,280"
Top Handle High Quality 3In1 Women's Hand Bag,"₦ 10,699"
Foldable Large Duffel Bag Luggage Storage Bag-Wine Red,"₦ 3,785"
Matured Strong Ladies Fashionable Hand Bag_ Black,"₦ 7,999"
Women Quality Office Casual Unique Design Ladies Handbag - Black,"₦ 9,500"
Foldable Large Duffel Bag Luggage Storage Bag-Dark Blue,"₦ 3,696"
3 Pcs Women Bag Handbag Purse Female Shoulder Bag Wallet,"₦ 6,990"
Clear Tote Bags Friendly Purse Shoulder Handbag PVC-,"₦ 1,528"
Ladies Women Mature Leather Red Handbag,"₦ 13,800"
Ladies Beautiful Pu Leather Handbag - Blue,"₦ 10,980"
Women Casual Tote Bag Female High Quality PU Leather Handbag 3in1 Set（No Profit）RED,"₦ 9,000 - ₦ 9,500"
Defacto Women - Bag-Black,"₦ 10,400"
Defacto Woman - Baguette Bag-Beige,"₦ 7,582"
Classy Shoulder Hand Bag - Black,"₦ 6,499"
Vera WOMEN'S LADY'S ORIGINAL LEATHER OFFICE PARTY HANDBAG - PEACH COLOR,"₦ 5,500"
