Item,Price
Feng Shui Black Obsidian Wealth Bracelet,"₦ 2,800"
Blue Eye Detail Bead Bracelet With Hand Of Hamsa,₦ 999
7 Chakra Reiki Healing Heart Bracelet..,"₦ 1,473"
New Feng Shui Black Obsidian Wealth Bracelet,"₦ 2,850"
Mens Double Dragon Pearl Feng Shui Obsidian Wealth Bracelet,"₦ 2,900"
Pure Natural Feng Shui Black Obsidian Wealth Bracelet,"₦ 15,000"
Feng Shui Gold Skull Obsidian Wealth Bracelet - Black,"₦ 2,850"
Women Fashion Elegant Bracelets Hand Chain,₦ 999
Feng Shui Black Obsidian Wealth Bracelet - Silver Fortune,"₦ 2,800"
Feng Shui Agate Wealth Bracelet,₦ 999
2-in-1 Gold-Plated Black Obsidian Wealth Bracelet,"₦ 3,000"
New Feng Shui Black Obsidian Wealth Bracelet - Silver Fortune,"₦ 2,800"
2 IN 1 Pixiu Feng Shui Black Obsidian Wealth Bracelet,"₦ 2,990"
Natural Stone Feng Shui Black Obsidian Wealth Bracelet,"₦ 11,450"
Women Fashion Elegant Bracelets Hand Chain Bangle,"₦ 1,499"
Feng Shui Black Obsidian Wealth Bracelet And Ring,"₦ 3,900"
Fortified Blue Eyes Bracelet With Hand Of Hamsa,"₦ 2,999"
100% Feng Shui Black Obsidian Wealth Bracelet,"₦ 1,899"
Feng Shui Obsidian Stone Beads Pixiu Wealth And Good Luck Men/Women Bracelet,"₦ 3,500"
Feng Shui Black Obsidian Wealth Bracelet - Chinese Blessed/Fortified,"₦ 15,000"
Mens Golden Feng Shui Black Obsidian Wealth Bracelet - Green,₦ 350
Bracelet Bangles Women Zircon BR005,"₦ 1,299"
Blue Eye Charm Bead Protection Bracelet With 5 Hand Of Hamsa,"₦ 1,500"
Mens Double Pi Xiu Feng Shui Obsidian Wealth Bracelet,"₦ 3,900"
Blue Eye Charm Bead Protection Bracelet With Hand Of Hamsa,"₦ 4,000"
Mens Feng Shui Black Obsidian Wealth Bracelet - Gold Pixiu,"₦ 2,850"
Mens Feng Shui Black Obsidian Wealth Bracelet,"₦ 2,850"
High Quality Nice Blue Eye Lucky Protection Bracelets X2,"₦ 3,999"
New Feng Shui Black Obsidian Wealth Bracelet - Silver,"₦ 2,900"
New Feng Shui Red Agate Obsidian Wealth Bracelet,"₦ 2,900"
New Double Feng Shui Black Obsidian Wealth Bracelet,"₦ 3,900"
