Item,Price
White Steampunk Corset Top Waist Cinchers Shaper Lace Women Sexy Plus Size,"₦ 15,999"
Black Corset Top Waist Shaper Lace Women Steampunk Sexy Long Sleeve Plus Size,"₦ 14,950"
Black Steampunk Corset Top Waist Cinchers Shaper Lace Women Sexy Plus Size,"₦ 15,999"
Red Corset Top Waist Shaper Lace Women Steampunk Sexy Long Sleeve Plus Size,"₦ 14,950"
Red Corset Top Waist Cinchers Shaper Lace Women Steampunk Sexy Plus Size,"₦ 15,999"
Waist Trainer Elastic Gym Fat Burning Slimming Belt Slim Body Shaper Bodysuit,"₦ 12,443"
Green Corset Top Waist Cinchers Shaper Lace Women Steampunk Sexy Plus Size,"₦ 15,999"
Dark Red Corset Top Waist Cinchers Shaper Lace Women Steampunk Sexy Plus Size,"₦ 15,999"
Crossed Compression Corset For Women Hip And Abdomen Molding Clothing One Piece Stockings For Post,"₦ 13,915"
Black Corset Top Waist Cinchers Shaper Lace Women Steampunk Sexy Plus Size,"₦ 15,999"
Blue Corset Top Waist Cinchers Shaper Lace Women Steampunk Sexy Plus Size,"₦ 15,999"
Sexy Lingerie Large Size For Women Red Mesh Corset Picardias Monkeys One-piece Underwear Large Siz,"₦ 5,968"
Body Super Latex Waist Trainer,"₦ 15,000 - ₦ 15,500"
Women's High Waist Body Sculpting And Tummy Control Underwear Beige,"₦ 5,181"
Women's High Waist Body Sculpting And Tummy Control Underwear Black,"₦ 5,181"
Backstrom Women Form Wearing Bodies Hip Elevation Meeting Forming Postpartum Bellery One Piece Sli,"₦ 17,109"
Elastic Enhancement Bralette For Woman Sexy Bra Without Hoops Antiligeero Korean Style Wild Tube T,"₦ 7,220"
KKSKY-Mens And Woman Polyester T-Shirt Brunetty Breathery Clothing For Gym Sports Street Clothing,"₦ 15,625"
White Corset Top Waist Cinchers Shaper Lace Women Steampunk Sexy Plus Size,"₦ 15,999"
Beige Steampunk Corset Top Waist Cinchers Shaper Lace Women Sexy Plus Size,"₦ 15,999"
Women Girl Underwear Lace Lace Large Lingerie Corset One Piece Pajamas Woman Erotic Sexy Lingery W,"₦ 5,968"
Padded V-Neck Padded Holder Sexy One-Piece Lingerie Slimming Modeler Waist Trainer Body Body Molde,"₦ 15,745"
Summer Summer Dress Sleeveless Womens Designer Clothing With Back Naked Informal Sexy One Piece Ba,"₦ 14,523"
Chicly-exotic Underwear For Women And Adults Sensual One-piece Sleeping Monkey Molding Clothes Wed,"₦ 9,986"
Universal Slimming Exercise Girdle Postnatal Belly Belt,"₦ 5,240"
Sexy Lace Bra For Women Underwear With Enhancement Checkered Bralette On The Back Lingerie,"₦ 10,489"
Seamless Bra With Enhancement Pillow For Women Large M-6XL Underwear With Adjustable Taps Black Sh,"₦ 10,046"
One-piece Swimsuit In Big Size For Women Sexy And Female Swimsuit With Push Up And Closed Pool Clo,"₦ 16,502"
"2pcs - Women Waist Trainer, Body Shaper And Cincher","₦ 5,750"
"FNETS-Bandage For Pregnant Women Belly Slimming Corset Pregnancy Belt Sexy Molder,","₦ 14,455"
Sexy Lace Bra Soft-seamless Enhancer Bralette Adjustable Sports With Front Closure Extra-blank Bre,"₦ 11,838"
Sexy Lace Lingerie With Ruffles Temptation Bodies Erotic Nightgown Sex Princess Dress Corset Bodie,"₦ 16,202"
Sexy Lingerie For Women Body Of One Piece Lace Corset Slimming Underwear,"₦ 18,811"
Sexy Bra With Silk Straps For Women Soft Bralette For Sleeping Fasteners Push-Up Sexy Lingerie Top,"₦ 5,135"
One-piece Molding Vest Body Model Female Corset For Hip Enhancement And Abdomen,"₦ 16,344"
