Item,Price
Fortified Sensual Waist Bead - Gold,"₦ 3,999"
Fortified Sensual Waist Bead,"₦ 4,000"
New Style Popular Fashion Holiday Design Beautiful Flower Bracelet Jewelry,₦ 390
African Stone Sexy Waist Bead- Gold,"₦ 3,000"
African Stone Sensual Waist Bead,"₦ 4,000"
Silver Stone Sensual Waist Bead,"₦ 2,900"
Irregular Crystal Gem Bead Bracelet,₦ 700
European And Ameri An 8mm Natural  Rystal  Olor Mat Hing Bra Elet Person Ty-light Brown,₦ 560
Reative DIY Gi  Strawberry  Rystal Bra Elet Gl  Bead Bra Elet Pendant- Hampagne  Olor,₦ 750
Hip Hop  Ool Love Bra Elet Double Heart Heart Shape Ele Troplating Bra Elet-si Er,₦ 850
Fortified Sensual Waist Bead- 2colors,"₦ 5,500"
Small Daisy Bra Elet Female  Rystal Beaded Bra Elet Fashion  Ple Bra Elet-pink+yellow,₦ 700
Korean  Ple Bra Elet Fashion Person Ty Bra Elet Hypoallergeni  Jewelry-gold-Bowknot,₦ 570
Beautiful Stone Sensual Waist Bead,"₦ 3,500"
4pcs Fashion Small Wrist Beads Bracelet- Black,"₦ 5,000"
International Import Bracelet Elegant And Noble Gift,"₦ 1,318"
Fortified Sensual Waist Bead - Gold-and Silver,"₦ 5,500"
Fortified Sensual Waist Bead - Gold And Silver,"₦ 5,500"
Round Loop  Hain Bra Elets Versatile Asymmetri Al Jewelry  Harm Bangle-si Er,₦ 690
