Item,Price
New Style Popular Fashion Holiday Design Beautiful Flower Bracelet Jewelry,₦ 390
European And Ameri An 8mm Natural  Rystal  Olor Mat Hing Bra Elet Person Ty-light Brown,₦ 560
Reative DIY Gi  Strawberry  Rystal Bra Elet Gl  Bead Bra Elet Pendant- Hampagne  Olor,₦ 750
Hip Hop  Ool Love Bra Elet Double Heart Heart Shape Ele Troplating Bra Elet-si Er,₦ 850
Small Daisy Bra Elet Female  Rystal Beaded Bra Elet Fashion  Ple Bra Elet-pink+yellow,₦ 700
Korean  Ple Bra Elet Fashion Person Ty Bra Elet Hypoallergeni  Jewelry-gold-Bowknot,₦ 570
International Import Bracelet Elegant And Noble Gift,"₦ 1,318"
Round Loop  Hain Bra Elets Versatile Asymmetri Al Jewelry  Harm Bangle-si Er,₦ 690
European And Ameri An  Ple Fashion Heart-shaped Love Letter  Lavi Le  Hain-gold-B,₦ 430
6 Pcs Cup Drop Oil Pendants Wine Glass Marker New Year Colorful Shell,"₦ 1,454"
Round Loop  Hain Bra Elets Versatile Asymmetri Al Jewelry  Harm Bangle-gold,₦ 720
6 Pcs Cup Metal Decor For Home Stem Glasses New Year Silver Christmas,"₦ 6,900"
Sparkling Aurora Crystals Link Chain Stretch Bracelet Women Jewelry Gift,₦ 870
European And Ameri An 8mm Natural  Rystal  Olor Mat Hing Bra Elet Person Ty-bla K,₦ 580
6 Pcs Cup Drop Oil Pendants Wine Glass Marker New Silver Christmas,"₦ 5,740"
Cup Ring Table Decorations Metal Ring Decor Drop Oil Silver Christmas,"₦ 5,391"
English Letter Pendant Ne Kla E Dainty Person Zed  Hain  Hoker For Women-gold-O,₦ 430
Cup Wine Glass Charms Metal Decor Table Decorations Silver Christmas,"₦ 4,697"
6X Cup Drop Oil Pendants Metal Decor For Home New Year Colorful Shell,"₦ 1,454"
European And Ameri An  Ple Fashion Heart-shaped Love Letter  Lavi Le  Hain-gold-J,₦ 420
Cup Ring Table Decorations Metal Ring Decor Drop Oil Colorful Shell,"₦ 1,454"
6 Pcs Cup Metal Decor For Home Stem Glasses New Year Colorful Shell,"₦ 1,454"
Ethni  Style Si Er Leaf Bra Elet Person Zed Bra Elet For Men And Women-si Er,"₦ 1,600"
Cup Metal Decor Table Decorations For Home New Year Colorful Shell,"₦ 1,454"
European And Ameri An  Ular Jewelry  Olorful Seven Agate Beaded Bra Elet-multi Olor,₦ 590
6 Pcs Cup Wine Glass Marker Metal Decor New Year Silver Christmas,"₦ 4,874"
Cup Wine Glass Charms Metal Decor Table Decorations Christmas Style,"₦ 5,877"
Cup Wine Glass Marker Metal Decor For Home New Year Silver Christmas,"₦ 5,892"
Cup Wine Glass Charms Metal Decor Table Decorations Colorful Shell,"₦ 1,454"
Women's Fashion Imitation Agate Coral Buddha Beads Hand String Bracelet,"₦ 1,500"
Cup Wine Glass Marker Metal Decor For Home New Year Colorful Shell,"₦ 1,454"
6X Cup Drop Oil Pendants Metal Decor For Home New Year Christmas Style,"₦ 7,783"
6X Cup Metal Decor Table Decorations For Home New Year Colorful Shell,"₦ 1,454"
6 Pcs Cup Wine Glass Marker Metal Decor New Year Merry Christmas Style,"₦ 6,099"
6X Cup Drop Oil Pendants Metal Decor For Home New Silver Christmas,"₦ 6,220"
6 Pcs Cup Metal Decor For Home Stem Glasses New Year Christmas Style,"₦ 6,471"
6 Pcs Cup Wine Glass Marker Metal Decor New Year Merry Colorful Shell,"₦ 1,454"
6X Cup Metal Decor Table Decorations For Home New Silver Christmas,"₦ 6,180"
