Item,Price
Butt Lifter Padded Panty - Enhancing Body Shaper For Women - Seamless,"₦ 5,500 - ₦ 5,800"
Women Padded Body Shaper And Hip Enhancer(Black),"₦ 5,499"
High Waist Tummy Control Buttocks Lifter Girdle Tight,"₦ 4,500"
Women High Waist Cinchers Body Shaper Waist Trainer Corset Butt Lifter Pants Tummy Control Pant Girdle,"₦ 5,899"
Tummy Control Girdle Pants (pink),"₦ 3,000"
PERMANENT PADDED HIPS ENHANCER,"₦ 9,000"
Women Butt Lifter Slimming Sexy Shapewear Tummy Control Panties High Waist Trainer Body Shaper,"₦ 5,200 - ₦ 5,400"
Butt Lifter Padded Panty - Enhancing Body Shaper For Women -,"₦ 5,500 - ₦ 5,800"
Women Butt Lifter Tummy Girdle Tight,"₦ 4,999"
Shorts Women's High Waist Trainer Scrunch Big Butt Lifter Pant Sexy Sports Leggings Tummy Control  Short Body Shapers,"₦ 13,448"
Tummy Control Girdle Pants ( Black),"₦ 3,500"
Lifter Shape Wear And Enhancer Thigh,"₦ 4,500"
Lifter Shapewear Colombian Reductive Girdles Waist Trainer Body Shaper Tummy Control Fajas Slimming Underwear Women Corset,"₦ 28,105"
Bum Lifter/Tummy Control Waist Clincher - Black,"₦ 5,450"
Womens Butt Lifter Tummy Control  High Waist Hip Padded  Body Shaper Thigh Slimmer Shapewear Hooks 4 Pads,"₦ 20,281"
Women Seamless Padded Panty Butt Lifter - Enhance Body Shaper,"₦ 3,000 - ₦ 6,000"
Women's Shapewears Tummy Girdle Tight,"₦ 3,900"
High Waist Ladies Pant 6 In 1 - Multicolour,"₦ 7,598"
Body Shield Ladies Tummy Girdle And Butt Lifter,"₦ 5,900 - ₦ 6,500"
PADDED HIPS ENHANCER& HIGH WAIST GIRDLE,"₦ 6,500"
Women Butt Lifter Lingerie Underwear Padded Seamless Butt Hip Enhancer Shaper   Buttocks Briefs Body Shapers,"₦ 14,338"
LADIES Body Cinchers Tummy And Thigh Control Pant Girdle,"₦ 6,900"
Fullness BUTT LIFTER AND TUMMY ADJUSTABLE CONTROL SHAPER - Black,"₦ 5,999"
Double Compression Power Shaping Shorts BBL Post Op Surgery Supplies Skims Kim Kardashian Jeans Woman High Waist Lifter,"₦ 26,882"
Velssut Shapewear For Women Fajas Waist Cincher Underwear Waist Trainer Bodi Shaper Under Dresses Tummy Control,"₦ 18,080"
Women Lady Lifter Hip Enhancer Shaper Paded  Underwear,"₦ 15,757"
Fajas Colombians Girdle Woman Post Liposuction High Compression Lifter Modeling Belt Tummy Control Shorts,"₦ 25,904"
High Waist  Lifter And Botty Enhancer Shapewear,"₦ 4,500"
Hip Enhancer Lifter Control  Women Body Shaper  Pad Foam Padded Underpant Female Shapewear HourglBody,"₦ 24,926"
Women's Shapewear Firm Control Seamless Padded Thigh Slimmer High Waist  Hip Pads Enhancer Butt Lifter Short Booster,"₦ 22,848"
Colombian Girdles Waist Trainer Flat Stomach For Slim Woman Shaping  Lifter Full Body Shaper Tummy Control Shapewear,"₦ 22,848"
High Waist Trainer Body Shaper Zip Tummy Belly Control  Shapewear Women Girdle Slimming Pants Fajas Colombianas Underwear,"₦ 18,447"
Ladies Tummy Panty,"₦ 2,000"
Women High Waist Body Shaper Girdle Underwear Trainer Slimming Tummy Shaping Panties Butt Lifter Modeling Strap(Black),"₦ 5,500 - ₦ 5,800"
Women Waist Trainer Corset,"₦ 2,500"
