Item,Price
4Pcs/Set Women Bracelets Women Jewelry Fashion Accessorries 2new,"₦ 1,140"
2Pcs Couple Bracelets 2 Matching Yin Yang Hand-Golden,₦ 966
3PCS/SET Multilayer Vintage  Leather Braided Bracelet,"₦ 3,995"
4PCS/SET Multilayer Vintage DIY Men PU Leather Braided Bracelet Jewelry,"₦ 1,680"
Butterfly Cuban Link Necklace Set,"₦ 1,999"
Women's Classy Woven Bracelet Fashion Jewlery,₦ 569
Unisex Cuban Iced Out Hand-chain-SILVER,"₦ 3,000"
2Pcs Couple Bracelets 2 Matching Yin Yang Hand-Silver,"₦ 1,044"
Teny's Star And Diamond Women Pearl Beaded Bangle,"₦ 4,500"
Bracelet Women Girl Crystal Heart Shaped Bangle Jewelry Gift,"₦ 1,650"
FeiraDeVaidade Zircons-encrusted Bracelet-Rose Gold,₦ 274
Mens Silver Dragon Feng Shui Black Obsidian Wealth Bracelet,"₦ 2,499"
IQPC® Fashion Luxurious Women's Bracelet Four Leaf Clover Bracelet Jewelry Gift,"₦ 1,499"
Feng Shui Black Obsidian Wealth Mens Bracelet  - Silver,"₦ 2,850"
Fancy Hand Beaded Bracelet Set,"₦ 3,833"
Fancy Hand Beaded Bracelets  Set,"₦ 3,800"
Ladies Unique Hand Bangle Bracelets,"₦ 1,999"
Buckle Closure Shining Bridal Bracelet Alloy-Silver,₦ 826
Multipurpose Bracelet Umbrella Rope Survival Wristband Fishing Line Hooks\/Compass\/Flint Fire Starter\/Scraper\/Knife\/Whistle\/Braided Pulseras Parachute Cord Men&#39;s Women&#39;s Outdoor Tool Accessory,"₦ 3,495"
Women Lucky Four-leaf Clover Bracelet - Silver,"₦ 2,800"
Ladies Unique Gold Hand Bangle Bracelets Classy Gift Idea,"₦ 1,999"
Mens Obsidian Beads Universal Rosary Bracelet,"₦ 2,800"
3PCS/SET Multilayer Vintage Leather Braided Bracelet,"₦ 3,895"
 Multi-Functional Bracelet Umbrella Rope Survival Wristband Fishing Line Hooks\/Compass\/Flint Fire Starter\/Scraper\/Knife\/Whistle\/Braided Pulseras Parachute Cord Men&#39;s Women&#39;s Outdoor Tool Accessory,"₦ 3,495"
Ladies Unique Bangle Bracelet,"₦ 3,000"
Women's 4 Pcs Colorful Beads Multilayer Bangle Infinity Handmade Wrap Bracelets,"₦ 1,080"
IQPC® Titanium Steel Fashion Couple Bracelet Roman Numeral Bracelet,"₦ 1,499"
FeiraDeVaidade Men's Wolves Head Bracelet Braided Bangle Bracelet-Gold,₦ 491
IQPC® Fashion Luxurious Men's Bracelet Boy‘s Bracelet Jewelry Gifts,"₦ 1,099 - ₦ 1,499"
Men Bracelet Vintage Multi Layers Beads Knitted Male-Black,"₦ 1,183"
Ladies Sweet Steel Bracelet,"₦ 3,100"
Fancy Hand Beaded Bracelets  Set For  Women,"₦ 3,850"
Fashionable Temperament Bracelet Gold Bracelet 10 Pieces Set Combination,"₦ 4,900"
Mens Blue  Obsidian Wealth Bracelet.,"₦ 4,499"
Couple Bracelet,"₦ 2,950"
IQPC® Fashion Four Leaf Clover Ladies Bracelet Classic Valentine's Day Gift,"₦ 1,299"
FeiraDeVaidade Fashionable Zircons-encrusted Bracelet-Silver,₦ 279
Hand Beaded Bracelet Set For Women,"₦ 3,800"
