Item,Price
Summer Pointed High Heels,"₦ 7,199 - ₦ 7,332"
Transparent High Heel Protector 3 Pairs (Small Medium Large) - Clear,"₦ 4,999"
Heel Protector Stiletto Stopper Guard (Small Thinner Size) 1 Pair - Black,"₦ 2,970"
Women's Shoes Flats Frosted Classic Sandals Non-Slip Casual Boat Shoes,"₦ 3,990"
High Heel Protector Guard (Small Thinner Size) 1 Pair - Clear,"₦ 2,970"
Ladies Fashion Women  Black,"₦ 7,000"
High Heel Protector Stopper Guard (Wide /Large) 1 Pair - Clear,"₦ 2,970"
High Heel Protector Stopper Guard (Large) 1 Pair - Clear,"₦ 2,970"
Ladies Wedge Mid Heel High Platform Slippers - BLACK,"₦ 15,500 - ₦ 16,500"
High Heel Protector Stiletto Stopper Guard (2 Pairs Clear And Black) - Medium,"₦ 4,490"
Unique Ladies Low Heel Design - WHITE,"₦ 13,999"
Ladies Fashion Heel Slippers,"₦ 17,000"
Smart Chain-Designers Slingback - Black,"₦ 13,999"
Wedding Fashion High Heels,"₦ 6,986"
Heel Protector Stiletto Stopper Guard (Small/Narrow) 1 Pair - Black,"₦ 2,970"
Ladies Fashion Mid Heel Slippers,"₦ 17,000"
High Heel Protector Horse Shoe Design - 3 Pairs (Small Medium Large) - Clear,"₦ 5,750"
Ladies Fashion Latest Design Heel Slippers- LEMON,"₦ 13,999"
Ladies Fashion Women  Brown,"₦ 7,500 - ₦ 8,000"
T Bar Bow Glossy Patent Leather Platform Heel Shoe-BLACK,"₦ 19,500"
Smart Ladies Slingback - Black,"₦ 13,999"
Ladies Fashion Mid Heel Slippers With Glittery Stones-silver,"₦ 14,499 - ₦ 15,499"
Cresfimix Women Classic High Quality Black Slip On Low Heel Pumps Lady Fashion Sweet Black Square Heel Shoes For Office A6859,"₦ 17,069"
Ladies Fashion Latest Design Heel Slippers-BLACK,"₦ 13,599"
Thick Heel Women Shoes,"₦ 3,599 - ₦ 3,999"
Genuine Leather Cross Over Belt Mid Heel Courts Shoes,"₦ 19,500"
Bigtree Ladies Shallow Heels Wedding Pumps Dress Party Shoes Black,"₦ 19,986"
Liliana Stoned Block Heeled Slippers For Women- Black,"₦ 14,000"
High Heel Protector 3 Pairs (Small Med Large) - Clear,"₦ 5,999"
Fashion And Beauty Products Women Low Heel Sandals White,"₦ 13,000"
Unique Pump - Black,"₦ 14,500"
Ladies Fashion Trendy Heel Cover Shoe,"₦ 15,500"
Croc Wet Look Flat Shoe- Brown,"₦ 17,000"
Bigtree Ladies Crystal Heels Wedding Pumps Dress Party Shoes Black,"₦ 19,800 - ₦ 37,800"
