Item,Price
Deluxe Comfortable Strapless Bra Set Of 3 Pieces,"₦ 4,550"
Women's Pajamas Chiffon Sleepwear Night Dress,"₦ 4,500"
"Push Up Bra, Breast Tape, Booby Tape 5cm*5","₦ 3,100"
"Push Up Bra, Breast Tape, Booby Tape","₦ 2,900"
4 In 1 Seamless Non-Padded Support Bra Top -,"₦ 6,500"
S-XXL Silicone Invisible Adhesive Women Bra Breast Lifting  Cover,"₦ 1,756"
2PCS Quality Tummy Control Girdle Pants,"₦ 6,499"
Ladies Open & Close Nursing Bra-Keep Breast In Shape,"₦ 3,600"
Defacto Woman Strapless Bra-Bordeaux,"₦ 3,858"
1 Pcs Lady Lace Floral Embroidered Push-Up Wireless Adjustable Strap Bra,"₦ 2,982"
Eelhoe Breast Breathable Push Up Tape Body Tape Invisible Chest Lift Tape,"₦ 2,700"
Women Bu*tt Lifter Shaper Tummy Panties Black,"₦ 3,000"
1 PcsStrapless Silicone Self Adhesive Invisible Bra Butterfly Wings,"₦ 1,997"
"Eelhoe Push Up Bra, Breast Tape, Booby Tape 5cm*5m","₦ 13,708"
1 PCS Seamless Tube Top Women's Skin-friendly And Comfortable Lace,"₦ 1,739"
"Push Up Bra, Breast Tape, Booby Tape 10*5cm","₦ 6,000"
Crochet Bikini Bra Top Sexy Bra Handmade,"₦ 1,750"
Ladies Bum Bum Padded Bu*tt Lifter Enhancement Shorts (black),"₦ 8,000"
HIGH QUALITY LADIES BRA UNDERWEAR,"₦ 5,500"
"Push Up Bra, Breast Tape, Booby Tape And Disposable Nipple Cover","₦ 4,000"
Hollow Out Women's Lady Lace Panty,"₦ 2,800"
One Word Around Cross Shoulder Breast Wrap Without Shoulder Strap,"₦ 5,900"
Reusable Silicon Nipple Cover,"₦ 2,499"
PERFECT PADDED WOMEN BRA  (1piece),"₦ 7,800 - ₦ 8,800"
Ladies Sexy Butterfly Gstring Thong Pants - 4 Piece,"₦ 4,300"
1 Pcs Plus Size No Steel Ring Knit Ladies Bra Embroidery Thin Cup Gather,"₦ 2,463"
1 Pcs Lady Strapless Invisible Silicone Breast Patch Self Adhesive,"₦ 1,739"
1PCS Women Sports Bra Large Size Seamless Adjustment Underwear Bra,"₦ 1,687"
1 Pcs Korean Style Women Bra Lace Breast Adjustment Bra Cute And Comfortable,"₦ 2,689"
Women Bra For Fashion People,"₦ 2,200"
Low Cut Sexy Push Up Bra- Black,"₦ 4,499 - ₦ 4,500"
Nipple Cover Invisible Silicon Bra,"₦ 2,499"
Defacto Woman Underwear Bra -Black,"₦ 3,926"
S-XXL Silicone Invisible Adhesive Push Up Bra Breast Lifting Nipple Cover,"₦ 1,756"
Body Shaper Waist Trainer Corset Weight Loss Fat Burner,"₦ 2,199 - ₦ 2,999"
Defacto 2 Piece Set Girl Underwear Regular Fit Crew Neck Sleeveless Bra -Pink and White,"₦ 3,040"
Defacto Woman Bralette Underwear -Black,"₦ 2,462"
