Item,Price
3 Pcs/ Set Fashion Love Heart Shaped Diamond Gold Bracelet,"₦ 1,056"
New Fashion Women Bracelet Gold Color Alloy Letter Charm,₦ 409
Fashion Geometry Bead Men'S Bracelet Simple Classic Stone,₦ 684
Fashion Cuff Acrylic Wide Bangles Bracelet For Women,"₦ 1,825"
Handmade Small Bracelets Rice Beads Beaded Bracelet Natural,"₦ 1,091"
Rhinestone Magnetic Buckle Wrap Wristband Cuff Bangle,₦ 646
5 Pcs/Set Trend Bangle Snowflake Gems Star Crescent Wafer,"₦ 1,293"
Hippie Style Braided Line Friendship Bracelet Wrist Ankle,₦ 627
Friendship Gift Wax Handmade Cactus Bracelet Summer Fresh,₦ 779
Bohemian Handmade Woven Beads Bracelet Fashion Crystal,₦ 808
Adjustable Buckle Paracord Survival Parachute Cord,"₦ 1,321"
5 In 1 Multifunctional Outdoor Compass Survival Weaving,"₦ 1,464"
"3Pcs / Set Of Lettering ""Big Sis Mom"" Love Pendant Necklace","₦ 1,734"
Handmade Retro Black Lace Vampire Slave Bracelet With,₦ 941
1 roll 25m Nylon Cord Thread Chinese Knot Macrame Rattail Bracelet Braided String Yellow,₦ 634
Bohemian Jewelry Moon Star Multi Layer Beaded Pendant,₦ 665
1 Roll 25m Nylon Cord Thread Bracelet Braided String,₦ 552
Bohemian Starfish Shell Beaded Bracelet Set Ladies Retro,"₦ 1,207"
Stainless Steel Lizard Black Red Silicone Bangle Cuff,"₦ 1,844"
1Pc High Elastic Quick Dry Sport Elbow Arm Warmers Pad Long Arm Sleeve Support Basketball red M,"₦ 2,402"
Elegant Punk Metal Pattern Infinity Sign Bracelet Bangle -,₦ 580
Emitting Women Glow In Dark Fluorescent Heart Pendant,"₦ 1,188"
5 In 1 Multifunctional Compass Survival Weaving,"₦ 1,448"
Women's European Bohemian Style Retro Beads Knotted,"₦ 1,473"
Bohemian Handmade Natural Sea Shell Bracelet Anklet Fashion,₦ 646
12 Pieces / Set Of Ladies Glass Beads Bracelet And Bracelet,"₦ 4,609"
Luminous Heart Shaped Glowing Bracelet Fluorescent Jewelry,"₦ 1,065"
Wedding Gift Choker Necklace Earring Bangle Bracelet Ring,"₦ 4,704"
Leopard Jewelry Set For Women Leopard Bracelet Teardrop,"₦ 5,037"
"5 in 1 Multifunctional Outdoor compass Survival Weaving Bracelet,Umbrella Rope Bracelet Self Defense Tool Brown","₦ 1,813"
"7 in 1 Multifunctional chargeable Outdoor Survival Weaving Bracelet,Umbrella Rope Bracelet Self Defense Tool black","₦ 5,456"
Bracelet Rose Window Vintage Bracelet Chain Paris Blessing,₦ 984
