Item,Price
Ladies Autumn And Winter Long-sleeved V-tie Double-breasted Woolen Jacket,"₦ 20,778"
High Tube Rainproof Snowproof Adult Shoe Cover Size: XXXL(Blue),"₦ 20,360"
"Durable Reflective Motorcycle Split Raincoat Pants Riding Bicycle Electric Bike Windproof Waterproof Rain Wear For Adult, Size: XL(Black)","₦ 35,230"
Women Coat Jacket Ladies Zipper Blazers Motorcycle Leather Black,"₦ 19,890"
Women Coat Jacket Ladies Zipper Blazers Motorcycle Leather Cotton Suit,"₦ 20,499"
Suits Button Women Suits Slim-fit Women Coat Long-sleeved Ladies Jacket,"₦ 22,999"
"Children Non-Slip Plus Velvet Warm Cartoon Short Rain Boots, Size:Inner Length 18cm, Style:Without Cotton Cover(Pink)","₦ 11,670"
Outdoor Mountaineering Eva Thickened Children Fashion Raincoat Average Size(Purple),"₦ 4,990"
Jackets Women's Coats Casual Suits Buttons High-end Coats Blazers Ladies Suits,"₦ 18,999"
Lightweight Long Sleeve Ladies Shirt Jacket Denim Print Butterfly Embroidery,"₦ 20,999"
Ladies Suits Button Women Suits Slim-fit Women Coat Long-sleeved Jacket,"₦ 16,999"
"Low Toe Shoe Covers Men And Women Non-Slip Thick Bottom Flip Buckle Waterproof Rain Boots, Size: 36/37(White)","₦ 14,040"
"Low Toe Shoe Covers Men And Women Non-Slip Thick Bottom Flip Buckle Waterproof Rain Boots, Size: 38/39(Blue)","₦ 14,040"
Ladies Retro Short Loose Windbreaker Jacket,"₦ 33,920"
Woman Regular Fit Regular Blazer Ladies Shirt Jacket Denim Butterfly Embroidery,"₦ 11,199"
"Low Toe Shoe Covers Men And Women Non-Slip Thick Bottom Flip Buckle Waterproof Rain Boots, Size: 40/41(Gray)","₦ 13,890"
High Tube Rainproof Snowproof Adult Shoe Cover Size: XXXXL(Black),"₦ 21,070"
"Kids Cartoon Animal Waterproof Jumpsuit Raincoat Boys Girls Children Rainwear Hooded Raincoat Suit, Size:L(Blue)","₦ 19,840"
"Children Non-Slip Plus Velvet Warm Cartoon Short Rain Boots, Size:Inner Length 18cm, Style:Without Cotton Cover(Dark Blue)","₦ 11,670"
Knitted Ultra Short Tube Top Camisole-Black,"₦ 26,810"
Kids Cartoon Animal Waterproof Jumpsuit Raincoat Children Rainwear,"₦ 20,900"
Satin Camisole Sexy Halter Top-White,"₦ 27,077"
Ladies Retro Fashion Long Loose Windbreaker Jacket,"₦ 35,200 - ₦ 35,670"
Large Size Mid-length Trench Coat,"₦ 37,150"
Blazers Women Coats Work Blazers Ladies Suits Coats Office Suits Women Jacket,"₦ 15,599"
Children Non-Slip Plus Cartoon Short Rain Boots Rainboots Kids Rubber Shoes,"₦ 15,900 - ₦ 16,900"
