Item,Price
Women Lingerie Lace Babydoll V Neck Pajamas Sleepwear Leopard S-2XL Chemise,"₦ 3,999"
Red Women Lingerie Lace Babydoll V Neck Pajamas Sleepwear S-2XL Chemise,"₦ 3,999"
Plus Size Pajamas Women Lingerie Sexy Sleepwear Lace Chemise Nightgown,"₦ 3,999"
Sexy Female Nightwear Honeymoon Lingerie Night Dress With G-string,"₦ 3,188"
Pajamas Women Sexy Lingerie One Piece Babydoll Bodysuit Lace Black,"₦ 4,999"
Night Club Long Style Erotic Lace Underwear Sexy Hot Babydoll Dress,"₦ 3,130"
Top Empty Style Suspender Skirt Women Dress Sexy Lace Costume Lingerie G-string Intimates Underwear Sleepwear Q-18,"₦ 15,655"
Women Lace Deep V-Neck Nightdresses,"₦ 4,500"
Sexy Women See-through Lace Lingerie Open Crotch Dew Underwear Q-182,"₦ 15,809"
Sexy Women See-through Lingerie Three Points Hot Underwear Q-116,"₦ 13,962"
Women Lace Lingerie Front Closure Babydoll V Neck Nightwear Pajamas Dress Red,"₦ 4,999"
Avidlove Ladies Women Sexy Halter Lace Lingerie Babydoll Sleepwear Mini Night Jumpsuit One-Piece Chemises ( Red ),"₦ 17,390"
Sexy Lingerie Spaghetti Strap Irregular Hem Babydoll Chemise And G-string Set Nightwear,"₦ 18,138"
New Womens Floral Lace Sexy Comfortable Low Rise Open Crotch Bikini Underwear Briefs,"₦ 9,923"
Gauze Style Suspender Skirt Hot Women Dress Lace Costume Sexy Lingerie Intimates Underwear Sleepwear Q-22,"₦ 15,962"
Avidlove Ladies Women Sexy Halter Lace Lingerie Babydoll Sleepwear Mini Night Jumpsuit One-Piece Chemises ( Green ),"₦ 16,495"
Avidlove Ladies Women Sexy Halter Lace Lingerie Babydoll Sleepwear Mini Night Jumpsuit One-Piece Chemises ( Purple ),"₦ 17,859"
Women Dress Set Halter Style Sexy Lingerie Pajamas Sleepwear Costume G-string Underwear Q-128,"₦ 15,501"
Sexy Kimono Lingerie Underwear Cosplay Sleepwear Black,"₦ 17,764"
Women Fashion Sexy Halter Hollow Out Adjustable Spaghetti Strap Crop Top Unlined Bandage Bra Underwear Cami Top,"₦ 11,527"
Sexy Women See-through Lingerie Off Shoulder Lace Dress Underwear Cosplay Suit Q-78,"₦ 14,424"
Blue New Sexy Denim Shorts Women Holes Mini Pants Jeans Womens Shorts High Waist Slim Solid Joint Sexy Bottom Ladies Clothing (Color:As Firstt Picture),"₦ 20,045"
Women Basic Stretch Layer Strapless Hollow Seamless Solid Cropped Tube Top Bra Bandeau ( Pink ),"₦ 12,007"
"Sexy Maid To Tease Lingerie Costume Outfit,Black","₦ 17,812"
Black New Sexy Denim Shorts Women Holes Mini Pants Jeans Womens Shorts Slim High Waist Solid Joint Sexy Bottom Ladies Clothing (Color:As Firstt Picture),"₦ 19,657"
New Women Vest Hem Lace Camisole Loose Sexy Pure Color Pajamas Womens Camisoles (China Size),"₦ 13,347"
Ladies V-Neck Spaghetti Strap Sleepwear Dress - Dark Red,"₦ 22,892"
Women Basic Stretch Layer Strapless Hollow Seamless Solid Cropped Tube Top Bra Bandeau ( Nude ),"₦ 12,664"
Pajamas Chemise Lingerie V Neck Sleepwear Wedding Night Honeymoon Lover Red,"₦ 4,999"
