Item,Price
New Sexy Floral Off-Shoulder Strap Bikini Suit Ladies Swimwear Bikini Set,"₦ 27,683"
2pc Bikinis Set Women Swimdress Plus Size Tankini Swimjupmsuit Bikini Set,"₦ 33,615"
Plus Size Swimwear Women Sexy Tankini Swimwear Tank Digital Print Bikini Set,"₦ 20,872"
Women Tie-dye Print Bikini Swimwear Beachwear Silk Scarf Mesh Smock Skirt,"₦ 7,056"
Bikini Set Women Korean Sexy High Waist Students Girls Split Bikini Set,"₦ 28,781 - ₦ 29,880"
Foreign Bikini 2022 Summer Beach Wear SwimSuit Ladies Fashion Bikini,"₦ 12,000"
Crochet 3 Pieces Crochet Bikini Set- Orange,"₦ 12,000"
Crochet 3 Pieces Handmade Crochet Bikini Set- Purple,"₦ 12,000"
USA Lovely Champagne Shade & Shore Bralette & Bikini,"₦ 16,990 - ₦ 16,995"
Sexy Ruffled Swimsuit Women Push Up Hollow Out Cross Bikini Set Bikini Set,"₦ 29,829"
Women 3pieces Swimsuit Set 2022 Summer Leopard Print Bikini Set Bikini Set,"₦ 21,311"
Sexy Patchwork Leopard Color High Waisted Swimsuit 2 Peice Set Women Bikini Set,"₦ 21,092"
Dunnes Women's Stylish Sexy Bikini Two Piece,"₦ 5,500"
Vintage Brazilian Bikini Set For Women Girls Sexy Lace-Up Push Up Bikini Set,"₦ 21,311"
3 Pieces Handmade Crochet Bikini Set- White,"₦ 12,000"
Ladies Bikini Swimsuit High Quality Off Shoulder Tie Front Skirt Bikini Set,"₦ 23,728"
Ladies Sequin Sexy Swimwear High Waist Bikini Push Up Swim Suit Bikini Set,"₦ 20,872"
3 Pieces Crochet Bikini Set,"₦ 12,000"
Kids Girls  Neoprene 2.5mm  Diving Suit Swimwear Girls Short-M150659K Purple 4,"₦ 39,690"
New Short-Sleeved Bikini Sexy Split Swimsuit For Women High-Waisted Bikini Set,"₦ 30,539"
2019 New Plus Size Two Piece Women Swimwear High Waist Trunks Elephant Print Halter Swimsuit Swimming Bathing Suit S-5XL HLS,"₦ 23,293"
New Sexy Printed Split Bikini Swimming Suit For Women High Waist 2 Bikini Set,"₦ 28,561"
Bandeau Bikini 2022 Purple Print Swimwear Women Skirts 3 Pieces Set Bikini Set,"₦ 26,804"
Yeezzi Super Deal Bikini Swimsuit Sexy Beach Wear Bathing Suit Bikini Set,"₦ 23,728"
Sexy Knited 2 Pieces Women Crocheted Bikini And Lace Up Tassel Skirt Bikini Set,"₦ 25,046"
Mixed Color Tassel Bikini Sexy Crochet Bikini Crop And Shorts Summer Bikini Set,"₦ 28,342"
Conservative Swimwear Women Short Sleeve One Piece Swimsuit-Short Sleeve Green,"₦ 45,290"
Conservative Swimwear Women Short Sleeve One Piece Swimsuit-Short Sleeve Pink,"₦ 45,290"
2022 One Piece Long Sleeves Swimsuit Women Female Zipper Surf-Type 17,"₦ 31,290"
2022 New Bikini Sling Cow Print Sexy Halter Bikini Set Swimsuit Bikini Set,"₦ 26,364 - ₦ 29,880"
Girls Split Swimsuits Cute Shoulder Swimsuit Children Swimwear Bikini Set,"₦ 23,069"
Bandeau Bikini Swimwear Women Special Material Solid Sexy Bathing Bikini Set,"₦ 20,213"
Ladies One Piece Swimsuit Women Triquini Swimwear Swim Beach Wear Bikini Set,"₦ 20,433 - ₦ 20,652"
3pcs Sexy Ladies Split Swimwear Sets Women Swimsuit Bikini With Bikini Set,"₦ 20,872 - ₦ 21,092"
Ladies Summer Color Matching Sexy Swimsuit Bikini Adults Women Lace Bikini Set,"₦ 21,970"
Sexy Floral Print Micro Bikini Swimwear Women Lace Up Bandage Orange Bikini Set,"₦ 20,213"
Hand-Woven Shell Ladies Bikini Swimsuit Knitted Hollow Out Female Bikini Set,"₦ 20,652"
Sexy Halter Strap Black White Micro Thong String Shiny Bikini With Bikini Set,"₦ 20,872"
Crochet Knitted Beach Dress Sexy Women Bra Long Tassel Skirts 2 Bikini Set,"₦ 28,561"
