Item,Price
High-end Wide Fashionable Corset PU Leather Belt For Waist Sizes 33” – 37”,"₦ 3,900"
Womens Nurse Fancy Dress Up Costume Bedroom Outfit Lingerie Sexy,"₦ 4,012"
2pcs 100 Cotton Women School Girl Uniform Mini Skirt Role Play,"₦ 11,691"
Naughty Sexy Women's School Girl Uniform Lingerie Fancy Dress Blue,"₦ 5,263"
High-end Wide Fashionable Corset PU Leather Belt For Waist Sizes 30” – 33”,"₦ 3,900"
Sexy Women School Girl Uniform Student Cosplay Fancy Dress Blue,"₦ 5,908"
Nurse Costume Accessory Garter  Pen Halloween Fancy Dress,"₦ 2,072"
Lingerie Uniform Cosplay Costume For Women Gift Maid Apron,"₦ 10,160"
Women School Girl Uniform Nightclub Cosplay Costume Outfit Pink,"₦ 2,397"
Underwear Strapless Front Buckle Invisible Bra With Adjustable Back Ladies Bra,"₦ 6,000"
Woman Base Shirt Sexy Long Sleeve See Through Transparent,"₦ 6,378 - ₦ 6,658"
Women's Native Indian American Costume - Tassel Suede Dress & XL,"₦ 18,750"
Women Leather Harness Body Chest Adjustable Waist Strap Belt Goth Punk,"₦ 3,117"
Belly Dance Waist Chain Hip Skirt Scarf With Sequins Coin Yellow,"₦ 2,931"
Belly Dance Costume Hip Scarf Hip Wrap Scarf Gold Coin Sequin Belt Red,"₦ 2,931"
Leather Harness Body Chest Adjustable Waist Straps Belt Goth Punk,"₦ 9,724"
Beautiful And Luxury Female Net Corset,"₦ 6,000"
Maid Costume Japanese Anime Maid Dresses Classic With Apron Lolita,"₦ 18,029"
LADIES WHITE CORSET BRA TOPS,"₦ 15,000"
Sexy Womens Black Leather Cage Bra Body Harness Straps Cosplay,"₦ 3,224"
Belly Dance Waist Chain Hip Skirt Scarf With Sequins Coin Deep Purple,"₦ 2,931"
"Bunny Costume Cosplay Lingerie And Tails Bodysuit, Girls Ladies Outfit","₦ 6,067"
Woman Base Shirt Long Sleeve Black Transparent Ladies Tops,"₦ 5,772"
Woman Sexy Mini Dress,"₦ 9,316"
Hen Party Bunny Set Rabbit Ear Headband Cuff Collar Costume,"₦ 4,046"
Prettyia Japanese School Girl Uniform Sailor Anime Fancy Dress Blue,"₦ 5,908"
Women Belly Dance Dancing Coins Tassels Gypsy Headband Head Band Gold,"₦ 3,831"
Woman Base Shirt Sexy Long Sleeve See Through,"₦ 5,818 - ₦ 6,378"
Ladies Fancy Dress Up Nun Magic Nun Halloween Party Cosplay Black  L,"₦ 8,847"
Sailor Anime School Girl Uniform Student Costume Lingerie Crop Pink,"₦ 5,643"
Women Student Uniform School Girl Crop Top Mini Skirt Dress Blue,"₦ 6,159"
Naughty Sexy Women's School Girl Uniform Lingerie Fancy Dress Pink,"₦ 6,770"
