Item,Price
Defacto Woman Cover-Up Knitted Cardigan-Beige,"₦ 8,960"
Defacto Woman - V Neck Long Sleeve Regular Fit Tricot Cardigan-Beige,"₦ 7,926"
Defacto Woman Relax Fit Mock Neck Knitted Cardigan-Grey,"₦ 8,400"
Convington Ladies' Open-Front Cardigan,"₦ 4,750"
Defacto Woman - V Neck Long Sleeve Regular Fit Tricot Cardigan-Black,"₦ 5,118"
Defacto Woman Oversize Fit Knitted Cardigan-Black,"₦ 10,080"
Defacto Woman - V Neck Long Sleeve Oversize Fit Tricot Cardigan-Blue,"₦ 8,536"
Defacto Woman - V Neck Long Sleeve Regular Fit Tricot Cardigan-Pink,"₦ 13,803"
Women Knit Crew Neck Drop Shoulder Long Lantern Sleeve Sweater Top -White,"₦ 7,499"
Defacto Woman - V Neck Long Sleeve Regular Fit Tricot Cardigan-Brown,"₦ 7,926"
Defacto Woman - Polo Neck Long Sleeve Regular Fit Tricot Cardigan-Beige,"₦ 8,882"
Defacto Woman - V Neck Long Sleeve Oversize Fit Tricot Cardigan-Beige,"₦ 8,546"
Defacto Woman Standart Fit Knitted Cardigan-Grey,"₦ 9,622"
Defacto Woman - Mock Neck Long Sleeve Slim Fit Tricot Cardigan-Black,"₦ 7,596"
Turtle Neck Sleeveless Top For Women - Black,"₦ 3,200"
Defacto Woman - V Neck Long Sleeve Regular Fit Tricot Cardigan-Purple,"₦ 5,144"
Turtle Neck Long Sleeve Top For Women - 6 In 1,"₦ 22,800"
Defacto 1 Piece Woman Relax Fit Polo Neck Long Sleeve Knitted Knitted Cardigan - Black,"₦ 6,400"
FEMALE MULTICOLOURED KNITTED WOOL CARDIGAN,"₦ 25,000"
Defacto Woman - Mock Neck Long Sleeve Fitted Knitted Cardigan-Brown,"₦ 8,466"
Defacto Woman - Polo Neck Long Sleeve Regular Fit Tricot Cardigan-Pink,"₦ 6,923"
Turtle Neck Long Sleeve Top For Women - Sky Blue,"₦ 4,000"
Women Open Front Vintage Kimono Long Cardigan,"₦ 7,810"
Women Solid Loose Knitted Cardigan Long Arm Sweater - Chocolate Brown,"₦ 8,889"
Turtle Neck Long Sleeve Top For Women - Grey,"₦ 3,500 - ₦ 4,000"
Defacto Woman - Hooded Oversize Fit Knitted Cardigan-Orange,"₦ 13,909"
Turtle Neck Long Sleeve Top For Women - Green,"₦ 3,500 - ₦ 5,500"
A4 Fashion Mfed Ruffle Hem V Neck Plus Size Cardigan,"₦ 3,500"
Defacto Woman - Hooded Oversize Fit Knitted Cardigan-Beige,"₦ 10,684"
Turtle Neck Long Sleeve Top For Women - Orange,"₦ 3,800 - ₦ 4,000"
Turtle Neck Long Sleeve Top For Women - White,"₦ 4,800 - ₦ 5,000"
Button Down Hooded Knitted Cardigan Plus Size Sweater Coat,"₦ 11,999"
Turtle Neck Long Sleeve Top For Women - Ash,"₦ 3,500 - ₦ 5,800"
Autumn Winter Thicken Warm Sweater Cardigan Women Japan Style Lazy-gray Thicken,"₦ 29,802"
Turtle Neck Long Sleeve Top For Women - Nude,"₦ 4,000 - ₦ 4,800"
Women Solid Long Sleeve Irregular Sweaters,"₦ 20,571"
