Item,Price
Elite Luxury Natural Opal Crystal Beads Stoned Fashion Women's Bracelet,"₦ 8,800"
"Small Fresh ECG Titanium Steel Bracelet, Suitable For Girlfriend, Mother, Lover","₦ 8,479"
Elegant Pearl Bracelets,"₦ 2,800"
"Silver Titanium Steel Temperament Bracelet, Does Not Fade, Fashionable And Versatile","₦ 8,679"
"Simple Titanium Bracelet, Fashionable And Versatile","₦ 14,726"
Daisy Qinghuan Series Bracelet Ins Niche Design New Female Imitation Shell Beads,"₦ 28,000"
Women's Design Versatile Simple Rose Gold Titanium Bracelet,"₦ 8,879"
"2022 Fashion Simple Bracelet, Adjustable Charm Bracelet Wedding Party Girl Gift","₦ 8,899"
Simple Versatile Titanium Steel Colorfast Bracelet For Girlfriend,"₦ 8,579"
Rose Wide Lace Charm Bracelet With Ring,"₦ 5,500"
Gold Heart Pattern Panel Bracelet For Everyday Wear,"₦ 8,579"
"Titanium Steel Smiley Bracelet For Engagement, Mother's Day And Birthday Gifts","₦ 8,579"
"Trendy Fashion Women's Titanium Steel Bracelet, Holiday Gift","₦ 8,479"
"New Fashion Pendant Titanium Steel Bracelet, Simple Jewelry Accessories","₦ 8,479"
Fashionable Simple Stainless Steel Bracelet For Every Occasion,"₦ 8,679"
"Women's Silver Adjustable Titanium Steel Bracelet, Holiday Gift","₦ 8,479"
Women's Bracelets Charm Bracelets Fashion Jewelry Gifts For Girls,"₦ 8,579"
Adjustable Bracelet Colorfast Women's Birthday Gift,"₦ 8,579"
"Ladies Bracelet Titanium Steel Bracelet, Gifts For Girlfriends","₦ 8,479"
"Fade-free Titanium Steel Bracelet, Holiday Gift For Girlfriends","₦ 8,479"
International Import Bracelet Elegant And Noble Gift,"₦ 1,645"
Ladies Bracelet Zircon Rose Gold Silver Titanium Steel Accessory Bracelet,"₦ 8,479"
"Stainless Steel Women's Bracelet, Simple And Fashionable","₦ 8,479"
14mm Adjustable Agate Beaded Bracelet Set Of 3,"₦ 15,000"
"Titanium Steel Bracelet For Women, Double Layer Bracelet, Gift For Girlfriend","₦ 8,999"
Ladies Bracelet Fashion Titanium Jewelry Length 18CM,"₦ 15,566"
"Silver Titanium Steel Small Daisy Bracelet, Fashion White Belt","₦ 14,726"
