Item,Price
Faux Leather Jackets For Women Zip Up Motorcycle Short PU Outwear Coat,"₦ 29,800"
Women's Fashion PU Leather Jacket Imitation Leather Coat,"₦ 28,200"
New Women's Leather Jackets Fashion Thin Jackets,"₦ 38,930"
Women's Leather Jackets,"₦ 43,995"
Black Walking Shoes Casual Sports Women's Shoes,"₦ 66,562"
Women's Jacket Fashion Outerwear Leather Clothing,"₦ 39,632"
Women's Leather Casual Jacket,"₦ 38,930"
Women's Leather Jackets Fashion Casual Jackets,"₦ 40,334"
Cropped Jackets Women Short PU Leather Coat,"₦ 24,074"
Short Jacket With Stand-up Collar And Rivets,"₦ 37,075"
Leather Jacket Women's Casual Jacket,"₦ 36,624"
Women's Leather Jackets Fashion Short Jackets,"₦ 38,830"
Women's Leather Jackets Fashion Leather Jackets,"₦ 38,930"
New Women's Leather Jackets,"₦ 40,585"
