Item,Price
Men And Women Smile Reversible Bucket Hat Cap,"₦ 2,999"
Defacto Women - Sun Hat -Beige,"₦ 2,427"
Head Warmer Beanie- Black,"₦ 1,999"
Defacto Woman - Hat-Black,"₦ 3,200"
Unisex Straw Hat - Chocolate,"₦ 2,750"
Defacto Woman - Cap -Beige,"₦ 2,241"
Defacto Woman Beige Hat,"₦ 3,200"
Unique/Unisex Straw Hats,"₦ 2,750"
Defacto Women - Sun Hat-Beige,"₦ 2,463"
Women Under Scarf Hijab Tube Bonnet Bone Chemo Hat Head Cover Inner Caps Muslim,"₦ 2,487"
Hair Steaming Cap,"₦ 3,895"
Satin Bonnets With Tie Band Fixed Women Hair Bonnet Custom Satin Bonnet Black,"₦ 1,900"
Portable Hair Steaming Cap,"₦ 4,000"
Defacto Woman - Hat-White,"₦ 2,493"
Satin Bonnets With Tie Band Fixed Women Hair Bonnet Custom Satin Bonnet,"₦ 1,900"
Auto Gele-ready To Wear Black,"₦ 7,100"
UNISEX  BEACH STRAW HAT FASHION SUMMER HAT,"₦ 4,500 - ₦ 5,500"
Five Pieces Unisex Face Caps,"₦ 7,000"
Women's Satin Reversible  Hair Bonnet Purple-Lilac,"₦ 2,999"
Multi-purpose Beach Visor Hats For Ladies,"₦ 5,500"
UNISEX  BEADED WINTER WOOL FASHION  BERET WINTER,"₦ 4,500"
2 In 1 Unisex Reversible Bucket Hat Double Sided,"₦ 4,900"
Ladies Turban Cap,"₦ 4,999"
"3Pcs Unisex Wool Fashion Beret - Black, Red And Yellow Beret - Big Size","₦ 8,500"
"Beautiful Yellow Colour Ladies Beret ""Good For Group Performance""","₦ 3,600"
Hair Care Women Wide Band Elastic Satin Bonnet Cap-Black,"₦ 1,800"
Ladies Beach Hat Black,"₦ 4,000"
Ladies Turban Cap With Fascinator - Gold,"₦ 9,999"
Ladies Wide Brim Hat Floppy Straw Hat For Church Or Beach,"₦ 4,499"
Unisex  Reversible Bucket Hat,"₦ 3,999"
EsoGoal Women Foldable Summer Sun Hats  Anti Sun Protection,"₦ 1,890"
Ladies Stylish Wide Brim Hat,"₦ 3,900"
Superior Fedora Cow Boy Hat (Black),"₦ 4,999 - ₦ 47,500"
Unisex Black Balaclava Face Mask Three Hole,"₦ 4,000"
Fascinator Hairpin Lightweight Comfortable Polyester-Black,"₦ 2,548"
Women Solid Color Thicken Woolen Yarn Knitted-Beige,"₦ 6,298"
Defacto Woman Hat-Black,"₦ 3,800"
