Item,Price
DAGi Ecru Bra - Non-padded Bra - Normal Fit - Underwear For Women,"₦ 9,120"
DAGi Smoke Color Aphrodite Lifting Bra,"₦ 16,483 - ₦ 24,725"
Sexy Lingerie Strapless Brassiere Top Push Up Bras Gifts,"₦ 2,355"
2PC Sexy Lingerie Strapless Brassiere Top Push Up Bras Gifts,"₦ 5,445"
10PCS Bare Lifts Instant Breast Lift Support Invisible Bra Shaper Adhesive Tape,"₦ 1,627"
Wire Free Comfortable Bra Sleeping Bras for Women Soft Bralette,"₦ 9,576 - ₦ 11,856"
Seamless Bras Wireless Comfortable Full Coverage Bras for Women Side Support,"₦ 8,270"
Comfortable Supportive Bra Breathable Ladies Comfort Invisible Bra for Everyday Wear,"₦ 9,182"
Bras with Removable Padding Soft and Comfortable Seamless Wireless Bras for Women,"₦ 8,664"
Womens Bras Comfortable Bras for Women No Underwire Bra,"₦ 14,136"
Demi Bra Simple Wireless Womens Everyday Bra,"₦ 9,341 - ₦ 10,358"
