Item,Price
Rhinestone     Net   Tights   Womens   Stockings   Crystal   Black,"₦ 1,843"
Ladies Sexy Fishnet Long Stockings Hose Black,"₦ 4,999"
Ladies Sparkling Net Stockings Tights Pantyhose,"₦ 4,000"
Sexy Ladies Fishnet Stockings Elastic Flower Lace Trim Panty Hose,₦ 892
Net Fishnet Long Socks Stockings Women Pantyhose Tight Thigh Black,"₦ 2,556"
Sexy Ladies Fishnet Long Stockings Stretchy Floral Lace Pantyhose Pink,₦ 587
3 In 1 Ladies Tight,"₦ 4,500"
Women Winter Tights Stretchy Thermal 85G No Fleece Brown Translucent,"₦ 4,710"
Women Sexy Beautiful Fishing Net Stockings - Black,"₦ 1,184"
Women's Ultra Thin Pantyhose Leggings Control Top Stretch Normal Skin,"₦ 1,138"
Ladies Net Pantyholes,"₦ 4,500"
Sexy Ladies Fishnet Thigh-High Stockings Net Mesh Elastic Lace Red,"₦ 1,440"
Black Lace Seductive Sexy Fishnet Women Long Silk Stockings,"₦ 2,200"
Sexy Ladies Fishnet Thigh-High Stockings Net Mesh Elastic Lace Pink,"₦ 1,464"
Ladies Glitter Rhinestone Fishnet Stockings Net Pantyhose Black,"₦ 2,764"
Sexy Ladies Fishnet Stockings Elastic Flower Lace Trim Panty Hose Pink,"₦ 1,579"
Ladies Fishnet Thigh-High Stockings Net Mesh Flower Lace Panty Purple,"₦ 1,611"
Sexy Womens Thigh-High Long Stockings High Waist Crystal Panty Black,"₦ 3,014"
Women's   Thin Tights Leggings  +Skin Color,"₦ 8,636"
Ladies Sexy Fishnet ThighHigh Long Stockings Crystal Panty Hose Black,"₦ 2,656"
60D Plus Size Women's Sheer Y Shiny Glossy Oil Hose Tights Thick Good Quality One Line-White,"₦ 22,571"
Casual Socks Opaque Thick Thin 220G Fleece Lined Brown Translucent,"₦ 8,578"
Girl Winter Warm Full Length Leg  85G No Fleece Brown Translucent,"₦ 4,894"
Ladies Sexy Fishnet Short Stockings Hose Black,"₦ 4,999"
Womens Fishnet Stockings Crystal Rhinestones Stretchy Panty Hose Black,"₦ 2,296"
Ladies Ice Silk Seamless Safety Tights,"₦ 4,000"
Ladies Sexy Fishnet Thigh-High Long Stockings Crystal Panty Hose Black,"₦ 2,376"
Women Winter Tights Thermal 220G Fleece Lined Brown Translucent,"₦ 8,890"
Women Winter Tights Stretchy Thermal 85G No Fleece Black Translucent,"₦ 4,702"
