Item,Price
Black Wedding Ring Set Diamond For Couple,"₦ 7,500"
B009 Elegant Blue Diamond Bracelet For Ladies-Silver,"₦ 1,257"
Luxury Adjustable Zirconia Diamond Engagement Proposal Ring With Free Case,"₦ 4,999"
B006 Ladies Elegant Bracelet With Diamonds-Rose Gold,₦ 744
Jewelry Lovely Earring Jewellery Set - Silver,"₦ 1,845"
Unique Pink Knuckle Ring Sets of 8,"₦ 2,999"
Cuban Link Chain With Cross Pendant,"₦ 2,700"
Adjustable Premium Love Diamond Engagement Proposal Ring With Red Ring Case,"₦ 4,999"
4 Non-Piercing Nose Ring Jewelry Nose Hoop Ring No Piercing Clip On,"₦ 2,500"
Feng Shui Black Obsidian Wealth Bracelet,"₦ 2,800"
2022 Luxury Bold Diamond Set  For Couples With Plain Band (4 In One),"₦ 9,750"
Iced Out Cuban Link Choker With Clown Pendant- Silver,"₦ 5,480"
5 In 1 Anklet/Leg Chain- 5pc Per Set,"₦ 1,990"
Women Vintage Multi-layer Jewelry Moon Necklace-SILVER,"₦ 1,100"
"Set Of Jewelry 4in1 - Necklace, Ring, Bracelet & Earring","₦ 3,950"
Cuban Link Chain With Cross Pendant Silver,"₦ 3,500"
16 In 1 Set Gothic Collar Choker Necklace Combination Set,"₦ 5,778"
Natural Freshwater Pearls Ladies Fashion Necklace,"₦ 2,000"
Luxury Fashion Necklace Earring Bracelet Ring Set Gold Color,"₦ 3,430"
Necklace Chain With Hand Chain Gold,"₦ 5,499"
Iced Out Cuban Gold - LINK CHAIN,"₦ 5,000"
Modern And Trendy Women Artificial Crystal Versatile Long Necklace Sweater Chain,"₦ 1,200"
N002 Fashion 2 In 1 Women Vintage Earrings And Necklace Set-Gold,"₦ 1,192"
Gold Butterfly Link Necklace 5 Pendants,"₦ 1,100"
Gold Tiny Necklace With Love Pendant,"₦ 4,000"
Non Tarnish Tiny Gold Chain & Shinny Stone Pendant,"₦ 3,000"
Zircon Necklace Wedding Bride Gift Necklace,"₦ 1,300"
Cuban Link Chain With Leaf Pendant Silver,"₦ 3,500"
"Crystal Bracelet With Artificial Diamond Inlaid For Wedding, Engagement, Mother`s Day And Birthday Gift, Diameter: 5.25 Cm, Perimeter:16.5 Cm(Silver)","₦ 1,380"
Cuban Iced Out Link Bracelet -Silver,"₦ 3,700"
Blue Eye Detail Bead Bracelet With Hand Of Hamsa,₦ 860
"Ladies Two Tone Cuban Hand/ Wrist Chain - Gold, Silver","₦ 3,500"
3PCS/SET Multilayer Vintage  Leather Braided Bracelet,"₦ 3,995"
B001 Elegant Crystal Bracelet Unisexe-Brown,₦ 657
Mens Silver Dragon Feng Shui Black Obsidian Wealth Bracelet,"₦ 2,800"
Feng Shui Gold Skull Obsidian Wealth Bracelet - Black,"₦ 2,850"
B008 Elegant Female Crystal Bracelet-Transparent,"₦ 1,043"
Mens Dual Layer Braided Faux Leather Magnetic-Black,"₦ 1,748"
Feng Shui Black Obsidian Wealth Bracelet - Silver Fortune,"₦ 2,800"
"Golden Necklace, Ring And Earrings Bride Jewelry Set","₦ 5,500"
Rhinestone/Crystal Drop Necklace &  Earring Jewelry Set,"₦ 3,399"
Magnificent Women Wedding Necklace And Jewelry Set- Gold,"₦ 2,999"
Simple Stainless Steel Gold Jewelry Sets For Women Rhinestone Crystal Wedding Necklace Earring Set For Ladies,"₦ 1,690"
"Classic Jewelry Set; Necklace, Earring, Bracelet, Ring","₦ 3,450"
Women Fashion Jewelry 3 In 1 Earrings Jewellery Set (Red),"₦ 1,899"
Fashion Jewelry Radiant And Lovely Earing Jewellery Set - Silver,"₦ 3,200"
"Elegant Diamond Jewelry Set; Necklace, Earrings, & Bracelet","₦ 2,450"
3Pcs Elegant Luxury Pearl Set Necklace Ear Wristlet For Women,"₦ 1,100"
Jewelry Pearl Lovely Earring Jewellery Set,"₦ 1,699"
Jewelry Double Lovely Earring Jewellery Set - Silver,"₦ 2,290"
Bridal Wedding Party Rhinestone Waterdrop Pendant Necklace-,"₦ 1,440"
Women's Pendant Necklace Earrings Ring Jewelry Set (Blue),"₦ 1,490"
30 Pairs Of Fashion Earring Set  Pearl Crystal Ear Studs,"₦ 3,260"
"6 In 1 Set Of Hoops,Studs & Pearl Mix Shape  Earrings","₦ 1,850"
E001 Ladies Metal Geometric Earrings-Gold,₦ 837
Set Of 12 Pairs Lovely Mix Different Shape Stud Earrings,"₦ 1,850"
Women Shiny Waterdrop Rhinestone Claw Hook Earrings,"₦ 1,350"
Diamond Drop Shaped Crystal Earrings.-Gold,"₦ 1,650"
Crystal Diamond Stone Earring Silver,"₦ 3,000"
6 In 1 Studs Rings And Big Loop Earrings - Gold,"₦ 2,000"
Earrings 4 Claws Design Non-Piercing Alloy Magnet Rhinestone Inlaid Ear Stud For Party,₦ 689
Women Shiny Waterdrop Rhinestone Claw Hook Stud Earrings,"₦ 1,350"
Diamond Stone Earring,"₦ 3,100"
Silver Non Piercing Diamond Stone Earring,"₦ 4,700"
Beaded Crystal Drop Earrings,"₦ 2,000"
Knuckle Ring Set For Ladies,₦ 990
R004 Fashion Charming Diamond Wedding Engagement Ring For Ladies-Diamond,"₦ 1,099"
Diamond-Studded  Wedding Engagement Ring,"₦ 1,200"
2Pcs/Set Couple Rings Silver Adjustable Men And Women Rings,"₦ 1,680"
Women Opening Adjustable Zircon Couple Ring Diamond For Men,"₦ 2,500"
14 In 1 Knuckle Ring Set For Ladies,"₦ 1,530"
Vintage Silver Free Shipping Dragon 316L Stainless Steel Ring Mens Jewelry For Men Lord Wedding Band Male Ring For Lovers(# ),"₦ 10,001"
White Golden Iced Out HipHop Engagement Rings CZ Pinky Men Women Full Crystal Ring(#White),"₦ 10,001"
2 Adjustable Solid Ring Set For Ladies,"₦ 2,500"
Zircon Women Bridal Diamond Wedding Ring,"₦ 1,180"
14 In 1 Set Vintage Knuckle/Finger Ring,"₦ 2,999"
Female Silver Vintage Bridal Ring,"₦ 10,001"
13Pcs Boho Hollow Stacking Ring Set Knuckle-Antique Silver,"₦ 1,146"
Forever Love Lovers Couple Matching Ring Steel Finger Ring,"₦ 2,640"
5 PIECES Unisex Rose Flower Lapel/Brooch For Men/Women Suit,"₦ 5,100"
Vintage Women Rhinestone Inlaid High Heels Brooch Pin Breastpin Scarf Shawl Clip-Blue,"₦ 1,392"
Lapel Pin Hollow Double Lion Suit Stick Brooch - Silver,"₦ 2,500"
Unisex Rhinestone Musical Note Chain Tassel Brooch Pin Lapel Badge Shawl Jewelry-Golden,"₦ 1,111"
Unisex Crown Shape Brooch Tassel Chain Lapel Pin Retro Corsage Suit Accessory-Silver,"₦ 1,206"
Men’s Suit Tuxedo Flower Lapel Stick Pin Brooch Wedding-Q1,₦ 985
Unisex Crown Shape Brooch Tassel Chain Lapel Pin Retro Corsage Suit Accessory-Golden,"₦ 1,201"
Women Men Leaf Flower Brooch Pin Suit Badge Decor Party-Red,₦ 849
Cartoon Heart Brooch Pin Fashion Women Men Clothes Bags Decoration,"₦ 1,034"
Women's Rhinestone Music Note Scarf Brooch Rose Gold Treble Clef Pin Jewelry-Rose Gold,₦ 853
2pcs Fancy    3D 5 Point  Brooch Lapel Pin Shirt Collar Pin Gold,"₦ 1,872"
12 Pieces Assorted Rhinestone Imitation Pearl Brooch Set Badge Gold,"₦ 6,873"
Brooch Find Workmanship Decoration Delicate Alloy Flower-Red,"₦ 1,340"
Unisex Crown Shape Brooch Tassel Chain Lapel Pin-Golden,"₦ 1,389"
Unisex Crown Shape Brooch Tassel Chain Lapel Pin-Silver,"₦ 1,175"
N012 Ladies Luxurious Diamond Angel Wings Necklace-Gold,"₦ 1,720"
Best Friends Love Heart Couple Necklace. Jewelry 2,₦ 890
Diamond Engagement Ring/Wedding Band Set For Women,"₦ 1,850"
Women Bead Chain Sequins Strip Multi Layer Necklace - Silver,₦ 900
Butterfly Link Necklace With 5 Pendant 2new,₦ 999
R001 New Fashion 15 In 1 Knuckle Ring Set For Ladies-Gold,"₦ 1,378"
Double Layer Butterfly Necklaces Chokers - Gold,₦ 449
Elegant Female Crystal Bracelet-Transparent,₦ 930
N001 Fashion Women Vintage Geometry Sequins Strip Multi-Layer Necklace-Gold,₦ 558
Queen Letter Pendant Necklace Gold 2,₦ 890
Women's Diamond Pendant Necklace,"₦ 1,650"
6 Pairs Ladies Hoop Diamond Pearl Earrings Set Punk Earrings II,"₦ 1,950"
Ladies Elegant Bracelet With Diamonds-Rose Gold,₦ 740
Multi Layer Coin Tassels Bar Necklace For Women,₦ 999
B007 Fashion Ladies Elegant Love Heart Bracelet With Diamonds-Gold,₦ 799
17 In 1 Knuckle Ring Set For Ladies,"₦ 1,800"
Double Layer Butterfly Pendant Clavicle Chain-Silver,₦ 371
5 Circles Gold Plated Necklace Earrings Jewelry Sets,"₦ 3,499"
2Pcs 1314 520 Heart Key Lock Jigsaw Pendant Couple Love Necklace Valentines Gift-Dual Color,"₦ 1,201"
4Pcs/Set Women Bracelets Women Jewelry Fashion Accessorries 2new,"₦ 1,140"
3 Nose Rings Non Piercing Fake Magnetic Horseshoe-gold/silver/black,"₦ 1,620"
Women Unique Silver Pendant Diamond Necklace,"₦ 1,999"
"2pcs I Love You Forever&Always ""Couple Pendants Necklace For Lovers Valentines B","₦ 1,249"
2Pcs Couple Bracelets 2 Matching Yin Yang Hand-Golden,₦ 966
