Item,Price
"Beautiful Yellow Colour Ladies Beret ""Good For Group Performance""","₦ 3,600"
Hair Care Women Wide Band Elastic Satin Bonnet Cap-Black,"₦ 1,800"
Ladies Sequence Turban Cap White,"₦ 5,999"
Ladies Turban Cap,"₦ 4,999"
Ladies Turban Cap With Fascinator - Gold,"₦ 9,999"
Women's Jamaican Rasta Style Beanie Cap Reggae Warm Knitted Striped Bob Marley Hat,"₦ 4,500"
Fluffy Cute Letter OMG Head Band,"₦ 1,900"
Ladies Wonuola Cap Black,"₦ 5,000"
Step By Step Turban Cap With Accessories,"₦ 8,000"
All Occasion Butterfly Headband-Black,"₦ 1,499"
Ladies White Zarah Cap,"₦ 5,000"
Yellow Silky Doo-Rag Durag - Yellow,"₦ 3,499"
Ladies Turban Cap  - Gold,"₦ 5,999"
Hair Band Folded Multicolor Rainbow Style Polyester-,"₦ 1,548"
All Occasion Butterfly Headband-Yellow,"₦ 1,499"
Wine Braid Turban Cap,"₦ 7,500"
Beautiful Braid Turban Cap  -pink,"₦ 5,000"
Ladies Sequence Turban Cap,"₦ 6,999"
Alien Head Beanie Head Warmer,"₦ 2,999"
Classy Straw Fascinator - Silver,"₦ 6,543"
Ladies Turban Cap - Ladies Turban Head Wrap,"₦ 8,499"
New Silky  Durag -Brown,"₦ 3,498"
Headband Pearl Skin-friendly Chiffon Baby Girls Bow Knot-Red,₦ 837
Unisex Sports Yoga Fitness Stretch Sweat Sweatband-Black,₦ 603
Jamaican Rasta Style Beanie Cap Reggae HeadWarmer Bob Marley Hat,"₦ 4,500"
Ladies Straw HAT- White,"₦ 6,999"
Ladies Turban Cap- Green,"₦ 7,000"
Cute Kids Baby Girl Toddler Lace Flower Headband-Rose Red,₦ 699
Ladies Turban Cap With Fascinator -GREEN,"₦ 6,789"
Honana BX-808 Elastic Ladys Plain Headbrand Yoga Sport Wash Face Snood,₦ 359
3Pcs/Set Kids Baby Girls Lovely Bowknot Headband Elastic-1#,"₦ 3,160"
Fluffy White OMG Head Band,"₦ 2,000"
White Fluffy Head Band For Ladies,"₦ 1,900"
STYLE ME 2 Trendy Ladies Braided Hairband Headband,"₦ 8,000"
