Item,Price
Cartoon Asak Socks-Penguin,"₦ 25,563"
Alphabet Long Basketball Socks-White,"₦ 25,741"
Shallow Mouth Thin Boat Socks-Sea Blue,"₦ 25,563"
Rainbow Striped Ins Cotton Socks-White Thick,"₦ 25,741"
Men's And Women's Tube Socks-Khaki Face,"₦ 25,741"
Shallow Mouth Thin Boat Socks-Light Green,"₦ 25,563"
Thin Emoji Stockings-Pink,"₦ 25,741"
Cartoon Asak Socks-Fox,"₦ 25,563"
Cotton Thin Short Low-cut Socks-Pear,"₦ 25,563"
Trendy Medium Long Tube Cotton Socks-White,"₦ 25,741"
Thin Crystal Silk Stockings-Orange Avocado,"₦ 25,653"
Men's And Women's Tube Socks-Blue,"₦ 25,741"
Shallow Mouth Thin Boat Socks-Green,"₦ 25,563"
Shallow Mouth Short Thin Boat Socks-Thick Striped Lamb,"₦ 25,563"
Cartoon Literary High Socks-Cat,"₦ 25,741"
Shallow Mouth Short Thin Boat Socks-Blue Lamb,"₦ 25,563"
Cartoon Asak Socks-Pigeon,"₦ 25,563"
Thin Crystal Silk Stockings-White Strawberry,"₦ 25,653"
Ink Painting Ink Cotton Socks-King,"₦ 25,741"
Shallow Mouth Thin Boat Socks-Pink,"₦ 25,563"
Men's And Women's Tube Socks-Black Face,"₦ 25,741"
Cartoon Asak Socks-Vole,"₦ 25,563"
Shallow Mouth Thin Boat Socks-Red,"₦ 25,563"
Alphabet Long Basketball Socks-Green,"₦ 25,741"
Hip Hop Ins Trendy Tube Socks-Black,"₦ 25,741"
Ink Painting Ink Cotton Socks-Flower,"₦ 25,741"
Shallow Mouth Thin Boat Socks-Light Brown,"₦ 25,563"
Trendy Medium Long Tube Cotton Socks-Blue,"₦ 25,741"
Ink Painting Ink Cotton Socks-Animal,"₦ 25,741"
Hip Hop Ins Trendy Tube Socks-Red,"₦ 25,741"
Trendy Medium Long Tube Cotton Socks-Grey,"₦ 25,741"
Thin Crystal Silk Stockings-Dark Blue Avocado,"₦ 25,653"
Alphabet Long Basketball Socks-Black,"₦ 25,741"
Vintage British Style Tube Socks-Beige,"₦ 25,741"
Cartoon Asak Socks-Green Crocodile,"₦ 25,563"
Thin Emoji Stockings-Grey,"₦ 25,741"
Ink Painting Ink Cotton Socks-Sunset,"₦ 25,741"
Thin Crystal Silk Stockings-Orange Durian,"₦ 25,653"
Cartoon Emoticon Short Boat Socks-Red,"₦ 25,563"
Trendy Medium Long Tube Cotton Socks-Yellow,"₦ 25,741"
