Item,Price
Vintage Transparent Computer Glasses,"₦ 4,500"
Retro Unisex Small Frame Oval UV  Protective Fashion Sunglasses-White,"₦ 1,999"
Cut Trimmed Lens Metal Curved Temples SunGlasses Female,"₦ 3,600"
Classic Female Fashion Sunglasses.,"₦ 4,000"
Anti Blue Light Cat Eye Eyeglasses,"₦ 4,999"
Hot Shapers Waist Trimmer,"₦ 3,000"
Classic Ladies Anti Blue Light Female Cat Eye Glasses,"₦ 3,950"
Wig Colorful Heat Resistant Hair Decor Long Extension-Yellow,₦ 517
Tummy Wrap Slimming Belt For Flat Tummy,"₦ 3,300"
Ladies Rhinestone UV Protection Sunglasses,"₦ 4,999"
3 In 1 Postpartum Girdle Support Recovery Belly Wrap,"₦ 8,350"
2016lgfd916 Women's Belt Vintage Nubuck Suede Man Made Belt,"₦ 10,410"
Black Red Pu Leather Metal Buckle Waist Pin Belt Women Thin,"₦ 9,671"
Wig Colorful Heat Resistant Hair Decor Long Extension-Blue,₦ 481
Eyeglasses Frames With Clear Lens Retro Optical Frame Round Vintage Eye Glasses Women Men,"₦ 4,240"
Unique Woven Braided Elastic Belt -BLACK,"₦ 2,600"
Women Lady Gold Metal Chain Belt Flower,"₦ 2,990"
Ladies Classic Wide Leather Waist Belt- Black,"₦ 2,599"
2pcs Elegant Crystal Tassel Belt Chain Adjustable Body Waist Boho,"₦ 5,295"
Gold Belts For Women Waistbands Metal Waist Gold Chain Belt,"₦ 6,500"
LouisWill Women Waist Belt Ladies Casual Alloy Pin Buckle,"₦ 3,690"
Lydiaz Classy Fashion Waist And Tummy Leather Peplum Belt - Black,"₦ 4,500"
Unisex Women Men Crossbody Bag Waterproof Pocket Mobile,"₦ 8,580"
Women Waist Fashion Belt With Metal Buckle - Black,"₦ 3,999"
LADIES PURE LEATHER BELT - BLACK,"₦ 7,580"
Jeans Belt Vintage Mens Big Pin Buckle Wide Belts Kemer Cow Leather Belts Ceinture Homme Luxe Marque Cinta(B Balck),"₦ 18,550"
Ladies Stylish Beaded Crystal Decor Wide Waist Band Belt,"₦ 7,000"
Head Warmer Beanie- Black,"₦ 1,999"
Five Pieces Unisex Face Caps,"₦ 7,000"
Ladies Beach Hat Black,"₦ 4,090"
Unique/Unisex Straw Hats,"₦ 2,750"
NEW TRENDY FASHION LEATHER BERET SUMMER CAP,"₦ 4,799"
"3 Fedora Hats (Royal Blue, Light Brown And Black)","₦ 10,699"
UNISEX BEACH 2 IN1STRAW HAT FASHION SUMMER HAT,"₦ 10,500"
UNISEX  BEACH STRAW HAT FASHION SUMMER HAT,"₦ 4,500 - ₦ 5,500"
Ladies Turban Cap With Fascinator - Gold,"₦ 9,999"
2 In 1 Quality Unisex Fedora Hat,"₦ 6,500"
Ponytail Kinky Straight With Drawstring,"₦ 5,000"
Sonar Splint Straight Hair Professional Hair Stretcher,"₦ 8,500"
10 Pcs Vintage Hollow Butterfly Charm Hair Clips-Rose Gold,"₦ 2,703"
Women's Satin Reversible Double-Sided Hair Bonnet Black-Gold,"₦ 2,999"
Female Knitted Hairband Cross Elastic Sports Headband-Pink,"₦ 27,437"
Women Girl Magic Donut Shape Hair Ring Bun Former-Black,₦ 408
Wide Knot Hair Bands For Women- Navy Blue,"₦ 1,800"
Pearl Stone Bead Headwear Accessories Headband Hair Band,"₦ 1,599"
New Silky Durag Unisex 3 Set Doo Rag,"₦ 7,500"
2 In1Pearl Stone Bead Headwear Headband Hair Band & Earrings,"₦ 2,550"
Glittering Rhinestone Hair Clips & Pearls Hairpins,"₦ 3,350"
Hair Clip Diamond Nine Flower Black Ponytail Extension Bun,"₦ 4,600"
6pcs Elastic Rubber Hair Ties Bowknot Band,"₦ 1,999"
Thread For Plaiting Hair 12 Pieces,"₦ 6,000"
"Unisex Big Frame Blue Light Blocking, Anti Eyestrain Glasses","₦ 1,750"
Classic Ladies Anti Blue Cat Eye Glasses,"₦ 3,999"
Vintage Oval Fashion Sunglasses,"₦ 3,500"
Flat Transparent Anti Blue Ray Computer  Eyeglasses,"₦ 2,898"
Female Square Oversized Vintage Sunglasses - Black,"₦ 4,500"
Ladies Cat Eye Leopard  Sunglasses .,"₦ 2,290"
Acrylic Frame Sunglasses,"₦ 3,500"
Womens Computer Glasses Blue Light Blocking Cat Eye Frames,"₦ 7,070"
Photochromic Polarized Sunglasses Oversized Square Frames,"₦ 6,160"
Retro Round Glasses Optical Eyewear Frames For Women Men,"₦ 4,660"
LouisWill Ladies Eyewear Anti-UV Square Sun Glasses,"₦ 2,890"
Unisex Anti Blue Light Protective Computer Screen Glasses,"₦ 1,850"
"Unisex Blue Light Blocking, Anti Eyestrain Screen Glasses","₦ 1,950"
Arab Shemagh Keffiyeh Military Tactical Palestine Scarf Shawl Kafiya Wrap Hot Grid Scarves For Female Male Birthday's Gift(#Sky Blue) SHA,"₦ 16,451"
Defacto Woman Shawl - Pink,"₦ 2,040"
JKRISING Messianic Jewish Tallit Blue And Gold Prayer Shawl Talit And Talis Bag Prayer Scarfs(#Nave Blue)(70x20) SHA,"₦ 19,906"
JKRISING Messianic Jewish Tallit Blue And Gold Prayer Shawl Talit And Talis Bag Prayer Scarfs(#Purple)(70x20) SHA,"₦ 19,906"
JKRISING Messianic Jewish Tallit Blue And Gold Prayer Shawl Talit And Talis Bag Prayer Scarfs(#Pink)(70x20) SHA,"₦ 19,906"
JKRISING Messianic Jewish Tallit Blue And Gold Prayer Shawl Talit And Talis Bag Prayer Scarfs(#Blue)(70x20) HON,"₦ 14,941"
CZHCQQ Warm Cashmere Scarf Women Shawls Square Wool Poncho Hijab Stoles Big Winter Women Scarves For Ladies Luxury Brand(#colour1)(130x130) HON,"₦ 34,375"
Men's Polyester Silk Hanky Handkerchief Pocket Square,"₦ 12,200"
HIRIGIN Latest Women Men Arab Shemagh Keffiyeh Palestine Scarf Shawl Wrap Scarves USA(#Red) SHA,"₦ 16,451"
Men Scarf  Desert Arab Keffiyeh Scarf,"₦ 22,100"
Women Wristlet Wallet Leather Clutch Tassel Purse Ladies Long Black,"₦ 5,564"
Womens Long Wallet PU Leather Purse Credit Card Holder Ladies Black,"₦ 3,674"
Women Ladies Wallet Mini Bifold Change Pouch PU Leather Compact Pink,"₦ 5,676"
Women Wallets Long Style Multi-functional Wallet Purse Fresh PU Leather Female Clutch Card Holder-Burgundy,"₦ 18,620"
Women Wallet Purse Card Phone Holder - Black,"₦ 6,599"
100%  Leather Wallet Women Long Female Ladies Wallets Cowhide Leather Luxury Designer Money Walet Women Purse  Perse-Coffee,"₦ 27,250"
SENDEFN Women Wallet Button Wallet Women Large Capacity Vintage Ladies Wallets For IPhone 7S Trend 5160-67-8006 Black,"₦ 23,950"
SENDEFN Women Wallet Button Wallet Women Large Capacity Vintage Ladies Wallets For IPhone 7S Trend 5160-67-Blue,"₦ 26,380"
LouisWill Women's PU Short Multifunction Snap Wallet,"₦ 3,990"
Women Large Capacity Wallet Multi-function Mobile Phone Bag,"₦ 8,599"
Classy Men Leather Wallet -Coffee,"₦ 5,995"
Ladies Leather Wallets 3D Crocodile Alligator Women Purse Clutch Long,"₦ 18,550"
Elegant Wallet Women Luxury  Famous Designer Concise Vintage Nubuck Phone Coin Long Women Wallets And Purses-Brown,"₦ 18,550"
Women's Wallet Card Case Women's Wallet Long,"₦ 18,100"
Women Wallets Long Style Multi-functional Wallet Purse Fresh PU Leather Female Clutch Card Holder-Black,"₦ 18,070"
Anti Blue Cat Eye Light Eyeglasses,"₦ 4,500"
Retro Unisex Small Frame Oval UV  Protective Fashion Sunglasses-Black,"₦ 1,999"
Women’s Fashion Big Face Retro Sunglasses,"₦ 1,990"
Vintage Round Oversized  Sunglasses,"₦ 3,999"
Anti Blue Light Eyeglasses,"₦ 4,500"
Sexy Ladies Cat Eye Vintage Sun Glasses-Black,"₦ 1,920"
Anti Blue Rays Computer Glasses,"₦ 3,199"
Square Small Frame Fluorescent Street Sunglasses,"₦ 2,050"
Crystal Cut-Edge  Ladies UV Protection Sunglasses ,"₦ 3,500"
Defacto Women - Sun Hat -Beige,"₦ 2,427"
Women Wallet Long Purse Love To You Solid Color Clutch Vintage Fashion Money Clip Coin Pocket,₦ 999
Men Black Classic Pilot Sunglasses,"₦ 1,990"
"Female Oversized Sunglasses - Black,","₦ 3,500"
Men And Women Smile Reversible Bucket Hat Cap,"₦ 2,999"
Ladies Rhinestone Pearl Waist Chain Fashion Dress Decorated Elastic Belt,"₦ 2,399"
Black Luxury Round Street Sunglasses - Designer Sunglasses,"₦ 2,999"
Defacto Woman Belt - Black,"₦ 2,972"
