Item,Price
Unique And Quality Ladies Gown,"₦ 6,500"
Quality Ladies Gown,"₦ 6,500 - ₦ 7,000"
ClassyTrendy Ladies Two Piece Set,"₦ 7,500 - ₦ 8,000"
Turkish Double Breasted Sleeveless Blazer With High Waist Trouser-BLACK,"₦ 22,000"
Claire Classy One Button Striped Suit-Navy,"₦ 12,500"
Claire Classy One Button Striped Suit,"₦ 13,500"
Comfortable Ladies Sexy Jumpsuit,"₦ 12,000"
Katrin Black Katrin Long Sleeve Trouser Suit With Belt,"₦ 25,000"
Collection Debenhams Gorgeous Two Button Plus Size Pant Suit ,"₦ 15,000"
Turkish Double Breasted Sleeveless Blazer With High Waist Trouser-WINE,"₦ 22,000"
2 Piece Set Women Double Breasted Suit Jacket Casual Straight Pants-Black,"₦ 29,400"
Two-piece Printed Long-sleeved Top And Shorts Suit,"₦ 17,295"
Two-piece Set Women Solid Stretch Business Lady Suits+ Side Zipper Pants,"₦ 29,600"
Women Hollow Lace G-string Open Crotch Briefs Panties,"₦ 12,858"
Turkish Double Breasted Sleeveless Blazer With High Waist Trouser-WHITE,"₦ 22,000"
vivida A 3- Pieces Ladies Pant Suit-Grey. LPS-4903,"₦ 50,000"
2 Piece Set Women Double Breasted Suit Jacket Casual Straight Pants-Pink,"₦ 29,400"
Melvincucci Women's Business Blazer Pant Suit Set For Work,"₦ 39,900 - ₦ 49,900"
Women Vintage Belted Slim Fit Long Sleeve Suit Jacket Set - Sweetcorn Yellow,"₦ 15,999"
Autumn and Winter New Fashion Women Suit Women's Tracksuits Casual Set With A Hood Fleece Sweatshirt Three Pieces Set ,"₦ 19,190"
Katrin London Women's Long Sleeves Trouser Suit - Grey,"₦ 20,000"
Two-piece Set Women Solid Stretch Business Long Sleeve Lady Suits+Straight Pants,"₦ 35,300"
Alfred Dunner Elegant Damask Pant Suit,"₦ 18,000"
Women Hoodies Suits Autumn Long Sleeve Patchwork Tracksuit,"₦ 14,000 - ₦ 15,500"
vivida  A 3- Pieces Ladies Pant Suit-Grey. LPS-4903,"₦ 50,000"
Women 2 Piece Outfits Long Sleeve Jogging Suits Casual Sweatshirt And Pants Set Tracksuit,"₦ 33,400"
Women's Suit Office Long Sleeve Suit Pants 2 Piece Set,"₦ 44,500"
Autumn And Winter New Fashion Women Suit Women's Tracksuits Casual Set With A Hood Fleece Sweatshirt Three Pieces Set ,"₦ 33,590"
2022 winter new Korean sportswear three piece suit warm women's thickened Plush sweater leisure suit trend,"₦ 33,590"
Appraisal Stylish Appraisal Two Buttons Long Sleeves Pant Suit Set With Belt,"₦ 34,999"
Women 2 Piece Outfits Long Sleeve Casual Suits Casual Sweatshirt And Pants Set Tracksuit,"₦ 33,792"
Long Sleeve Crop Top Women Set 2pcs Skinny Tracksuit Outfits,"₦ 8,000 - ₦ 8,500"
2 Piece Set Women Double Breasted Suit Jacket Casual Straight Pants-Blue,"₦ 29,400"
