Item,Price
"Homewear For Plus Size  (Robe, Trouser & Top)","₦ 16,000"
Night Wear For Ladies Short And Top,"₦ 4,999"
"Homewear For Plus Size - Robe, Trouser & Top","₦ 16,000"
Nightwear Women Ladies Gift,"₦ 13,300"
Spring Sleepwear Women,"₦ 26,100"
Marlon Plus Size Sweetheart Cotton Pyjamas - Pink,"₦ 12,500"
Wine Not 2 Piece Lounge Wear,"₦ 11,500"
Women Solid V Neck Pajamas Set,"₦ 10,880"
Cartoon Women's Pajamas Suit Casual Loose Pajamas,"₦ 13,310"
Moon Lash 2 Piece,"₦ 10,000"
Women's Pure Cotton Printed Pajamas Suit Lovely Pajamas,"₦ 26,390"
X ❤ 2 Piece Lounge And Sleep Wear,"₦ 10,000 - ₦ 11,500"
Women Velvet Sweet Cute Bellyband,"₦ 12,140"
Rose 2 Piece Lounge And Sleep Wear,"₦ 11,500"
Plum Blossom Shirt Top Bellyband Underwear,"₦ 13,140"
Shirt Top Bellyband Underwear,"₦ 14,100"
Sexy Underwear Lace Bellyband Set,"₦ 25,960"
Women's Fashionable Pajamas Women's Underwear,"₦ 24,960"
Women Neck Halter Top Nightwear,"₦ 13,440"
Women Sexy Lingerie Exotic Lingerie,"₦ 12,970"
Adult Unisex Flannel Pajama Anime,"₦ 41,410"
Women Underwear Set Sleepwear,"₦ 23,400"
Bellyband Sexy Backless Summer Sling,"₦ 28,000"
