Item,Price
3in1 Men/Women Turtle Neck Top/ Cooperate,"₦ 14,800"
Men/Women Turtle Neck Top/ Cooperate Black - 1 SIZE FIT ALL,"₦ 5,300"
Men/Women Turtle Neck Top/ Cooperate Black,"₦ 5,299"
Men/Women Turtle Neck Top/ Cooperate- Grey,"₦ 5,200"
Men/Women Turtle Neck Top/ Cooperate White,"₦ 5,500"
Defacto Woman Cover-Up Knitted Cardigan-Beige,"₦ 8,960"
Soft Men/Women Turtle Neck Top- Ash,"₦ 3,500"
Men/Women Turtle Neck Top Brown - 1 SIZE FIT ALL,"₦ 5,200"
Convington Ladies' Open-Front Cardigan,"₦ 4,750"
Men/Women Turtle Neck Top/ Cooperate Wear,"₦ 5,200"
Defacto Woman - V Neck Long Sleeve Regular Fit Tricot Cardigan-Beige,"₦ 4,865"
Men's Turtle Neck Top/ Cooperate Yellow,"₦ 5,300"
2in1 Men/Women Turtle Neck  Coperate Top,"₦ 10,200"
Men/Women Turtle Neck Top/ Cooperate Navy Blue,"₦ 5,200"
Men's Turtle Neck Top/ Cooperate White,"₦ 5,500"
Men/Women Turtle Neck Top/ Cooperate Wine,"₦ 5,300"
3in1 Men/Women Turtle Neck Top/ Cooperate - 1 SIZE FIT ALL,"₦ 14,700"
Turtle Neck Long Sleeve For Female - Ash,"₦ 3,300"
Defacto Woman Relax Fit Mock Neck Knitted Cardigan-Grey,"₦ 8,400"
Men/Women Turtle Neck Top/ Cooperate ] Navy Blue,"₦ 5,500"
Men/Women Turtle Neck Top Brown,"₦ 5,200"
Defacto Woman - V Neck Long Sleeve Regular Fit Tricot Cardigan-Black,"₦ 5,118"
Autumn And Winter Men's Thick Round Neck Sweater Fashion Casual Warm-white,"₦ 6,499 - ₦ 6,999"
Men/Women Turtle Neck Top/ Cooperate- Black,"₦ 5,200"
Men/Women Turtle Neck Top/ Cooperate Black -,"₦ 5,500"
Turtle Neck Long Sleeve For Female - Navy Blue,"₦ 4,200"
New Autumn Armless Croptop Female Turtleneck,"₦ 2,200"
Women Knit Crew Neck Drop Shoulder Long Lantern Sleeve Sweater Top -White,"₦ 7,499"
Men/Women Turtle Neck Top/ Cooperate Red - 1 SIZE FIT ALL,"₦ 6,499"
Men/Women Turtle Neck Top/ Cooperate Brown,"₦ 5,299"
Korea Men Cotton Turtle Neck Turtleneck Sweater Stretch  Slim Fit Brand Knitted-Army Green,"₦ 5,999"
Ladies  Rib Turtleneck Long Sleeve Pullover Sweater,"₦ 3,400"
Men/Women Turtle Neck Top Red - 1 SIZE FIT ALL,"₦ 5,500"
Men/Women Turtle Neck Top/ Cooperate Gray,"₦ 5,299"
UNISEX Turtle Neck Top/ Cooperate Royal Blue - 1 SIZE FIT ALL,"₦ 5,950"
